"Mr. Heater Portable Buddy Camping, Job Site Propane Gas Heater MH9BX (For Parts)",75.0,Last item available,"[""I bought this heater for my small garage workshop. My electric heater kept tripping the breaker while using other equipment. I was afraid of other gas heaters due to their carbon monoxide emissions. This was one of the few gas heaters rated for indoor use. It also has an oxygen depletion detector and tip over cut off feature which I thought was very important.This heater silently keeps my shop warm in even the coldest temperatures and can also be attached to a 20 pound propane tank with an accessory hose ~ which I also purchased. I've run this heater for up to 6 hours uninterrupted with no noticeable fumes and since all the heat is focused out the front, it can be set close to a wall with no worries.I know I'm going to get a lot of use out of this heater. It was a very reasonable price and filled my needs perfectly. Highly recomend the Mr. Heater Buddy for heating small spaces."", 'Here in Monterey County the weather can be colder in the evenings. At my home we cut of the central heating back in ‘88 so we all dress up like eskimos to keep warm. Don’t get me wrong. We do use electric heaters in certain areas but after purchasing this Portable Propane heater, it was Heaven sent. I recommend this product with all my heart. It is compact. It is durable. It is easy to refuel. It is warm to hot. And now, as we speak, the 5 ft extension hose just arrived. When connected from my Gas Buddy to a 20 lb propane tank, I should get at least 24 hrs of constant heat. Thank you for your time. ', 'The last power outage we only had kerosene heaters.  They are big, bulky, heavy, require pouring fuel and the fumes left us wheezing and coughing.  Therefore, we found these Mr. Heater, bought two and what a difference.  Small enough to be moved from room to room and so much safer.  You will love Mr Heater.', ""Small and practical for portable heat when equipped with a disposable bottle, it's even great for a more permanent heat source - just pair this heater up with a hose and a large refillable propane bottle.  It even has a pilot light for easy on and off use.  Two heat settings, 4000 and 9000 BTUs.  The back of the heater stays cool to the touch, so it can be used backed against a wall.  Six stars for this heater."", 'Really nice heater. Relatively easy to operate and has safety features. Heater will not run all night, though with the small propane cylinders. ', ""Love this portable propane heater. Can't wait to take it camping. In the meantime, we use it around the house to warm up and enjoy the heat it produces. If the power goes out, we will stay warm with this heater!"", ""This is a very good product.  What is different about Mr. Heater compared to other small heaters is that it uses 1 lb. propane tanks, thus it does not have to be plugged in or placed near an electrical outlet.  It is easy to use and have a anti tip safety feature that will cut the unit off if the unit is tipped.  Keep on hand a few 1 lb. propane cylinders, and you're good to go.  Very good heater for small spaces and can be used indoors."", 'Great propane heater with 2 settings. I also bought a 12ft hose to connect to a 5 Gallon propane tank. The low setting was enough to warm my 29ft motor home. Perfect.', 'Purchased the additional Mr. Heater 10\' hose (item F273704) that you don\'t have to use a filter and connected it to a 20 lb. bottle of propane.   Easy to light and ran all night on low to keep my greenhouse warm.  I used a 1.5"" PVC water pipe and ran the pipe under the foundation of my greenhouse and then ran the hose through it outside where the tank was located.  For safety reasons, you aren\'t supposed to have the 20 lb. tank inside near the heater.  I cut up an old wash cloth and stuck it inside the pvc pipe to keep bugs and cold air from entering into my greenhouse. So easy to do.  ', 'Product operates exactly as advertised, which nowadays is not always the case. It functions easily and simply. Really like the option to go to larger capacity tank for longer use periods or not having to change out bottles constantly.']",,Mr. Heater,Heater,,,"F232000, MH9BX",,,MH9BX,,,,,,,,,0089301320000,,,Battery,Floor,3,,,Rotary Knob,Copper,,,Heat Pump,,Black,,,,,,,,6 hrs,14.25 in,,9in.,No,,,,Unknown,,,,,,,,,,14.25in.,,,,,,4000-9000 BTU,,,20 gal,,,,,,,,,,,,,,,,,,,,,,,,,,,,,,,,,,,,,,,,,,,,,,,,,,,,,,,,,,,,,,,,,,,,,,,,,,,,,,,,,,,,,,,,,,,,,,,,,,,,,,,,,,,,,,,,,,,,,,,,,,,,,,,,,,,,,,,,,,,,,,,,,,,,,,,,,,,,,,,,,,,,,,,,,,,,,,,,,,,,,,,,,,,,,,,,,,,,,,,,,,,,,,,,,,,,,,,,,,,,,,
Mat Heating Pad Device Tool 1200W 110V/220V Silicone Orange Heater Supply,72.64,30-day returns, ,"New: A brand-new, unused, unopened, undamaged item in its original packaging (where packaging is applicable). Packaging should be the same as what is found in a retail store, unless the item is handmade or was packaged by the manufacturer in non-retail packaging, such as an unprinted box or plastic bag. See the seller's listing for full details. ",Unbranded,,,,Does Not Apply,,,Heating Pad,,,,,,,,,,,Silicone rubber,,,,,1200W,,,,,,,Orange,,,,,,,,,,,,,,,,,,,,,,,,,,,,,,,,,,,,,,,,,,,,,,,,,,,,,,,,,,,,,,,,,,,,,,,,,,,,,,,,,,,,,,,,,,,1500v / 5s,± 8%,200 cm,,,,,,,,,,,,,,,,,,,,,,,,,,,,,,,,,,,,,,,,,,,,,,,,,,,,,,,,,,,,,,,,,,,,,,,,,,,,,,,,,,,,,,,,,,,,,,,,,,,,,,,,,,,,,,,,,,,,,,,,,,,,,,,,,,,,,,,,,,,,,,,,,,,,,,,,,,,,,,,,,,,,
Metro (METRO) kotatsu Replacement heater U-shaped quartz tube MSU-501H #2462,70.3,Last item available, ,"New: A brand-new, unused, unopened, undamaged item in its original packaging (where packaging is applicable). Packaging should be the same as what is found in a retail store, unless the item is handmade or was packaged by the manufacturer in non-retail packaging, such as an unprinted box or plastic bag. See the seller's listing for full details. ",Metro,Replacement heater,Timer,,MSU-501H,,Heater unit,MSU-501H,,,,,,,,,,,,Electric,Floor,1,,501-600 W,Switch,,,,kotatsu,100 V,Black,,,,,,,,,4.1cm,,29cm,,,,,,,,,,,,,,,29cm,,,,,,,,,,,,,,,,,,,,,,,,,,,,,,,,,,,,,,,,,,,,,,,,,,,,,,,,,,,,,,,,,,,,,,,,,,,,,,,,,,,,,,,,,,,,,,,,,,,,,,,,,,,,,,,,,,,,,,,,,,,,,,,,,,,,,,,,,,,,,,,,,,,,,,,,,,,,,,,,,,,,,,,,,,,,,,,,,,,,,,,,,,,,,,,,,,,,,,,,,,,,,,,,,,,,,,,,,,,,,,,,,,,,,,,
 , , , ,,,,,,,,,,,,,,,,,,,,,,,,,,,,,,,,,,,,,,,,,,,,,,,,,,,,,,,,,,,,,,,,,,,,,,,,,,,,,,,,,,,,,,,,,,,,,,,,,,,,,,,,,,,,,,,,,,,,,,,,,,,,,,,,,,,,,,,,,,,,,,,,,,,,,,,,,,,,,,,,,,,,,,,,,,,,,,,,,,,,,,,,,,,,,,,,,,,,,,,,,,,,,,,,,,,,,,,,,,,,,,,,,,,,,,,,,,,,,,,,,,,,,,,,,,,,,,,,,,,,,,,,,,,,,,,,,,,,,,,,,,,,,,,,,
Portable Mini Fan Heater Winter Office Desktop Electric Air Warmer,99.79, , ,New,smart frog,,Mini,,Does not apply,,,KW-CH200,,,,,,,,,,,,"Electric, Fan",,,,,,,,,,,,,,,,,,,,,,,,,,,,,,,,,,,,,,,,,,,,,,,,,,,,,,,,,,,,,,,,,,,,,,,,,,,,,,,,,,,,,,,,,,,,,,,,,,,,,,,,,,,,,,,,,,,,,,,,,,,,,,,,,,,,,,,,,,,,,,,,,,,,,,,,,,,,,,,,,,,,,,,,,,,,,,,,,,,,,,,,,,,,,,,,,,,,,,,,,,,,,,,,,,,,,,,,,,,,,,,,,,,,,,,,,,,,,,,,,,,,,,,,,,,,,,,,,,,,,,,,,,,,
HONEYWELL TurboForce Digital Power Heat Circulator Heater Pivot Oscillation NEW,74.95,30-day returns,"[""There are many great factors to this heater, my primary reason is it is a heater, but the secondary reason which I confirmed with the maker was that it is also a fan only that can be run during the summer months.  Which I was using till our recent cold spell and the heater can run in many different mode like, low, med, high or by temp, which runs at 65 degrees, 70 and 75... I haven't checked to see how warm it can get.   It also  can run on a timer  also on the back is a switch to put in constant running or on and off cycle.   The brand is a well known name and I am to date very pleased with this purchase."", 'Meet my expectation. Good quality, but reasonable price. I like the auto mode of the product where it can rotate and sense the heat, so I do not need to manually intervene.', 'This is the best fan ever, it rotates, flips, three levels on every level, gets the job done. I have two of these now and they work great.', 'smooth', 'Great heater, does not get hot to the touch .', 'Awesome sauce!!!']","New: A brand-new, unused, unopened, undamaged item in its original packaging (where packaging is applicable). Packaging should be the same as what is found in a retail store, unless the item is handmade or was packaged by the manufacturer in non-retail packaging, such as an unprinted box or plastic bag. See the seller's listing for full details. ",Honeywell,Compact,Oscillation,,HHF565B,,,HHF565B,,,,,,,,,328785003017,,,Electric,,2,,,Digital,,,,Forced Air/Fan,120 V,Black,,,,,,,,,,,,,,,,,,,,,,,,,,,,,,,,,,,,,,,,,,,,,,,,,,,,,,,,,,,,,,,,,,,,,,,,,,,,,,,,,,,,,,,1500 Watts,,,,,,,,,,,,,,,,,,,,,,,,,,,,,,,,,,,,,,,,,,,,,,,,,,,,,,,,,,,,,,,,,,,,,,,,,,,,,,,,,,,,,,,,,,,,,,,,,,,,,,,,,,,,,,,,,,,,,,,,,,,,,,,,,,,,,,,,,,,,,,,,,,,,,,,,,,,,,,,,,,,,,,,,,,
HEATER BASEB 750W 3' WH,73.66,30-day returns, ,"New: A brand-new, unused, unopened, undamaged item in its original packaging (where packaging is applicable). Packaging should be the same as what is found in a retail store, unless the item is handmade or was packaged by the manufacturer in non-retail packaging, such as an unprinted box or plastic bag. See the seller's listing for full details. ",Cadet,Baseboard Heater,Timer,,09952,0027418099525,,,,,,,,,,,27418099525,,Steel,Electric,Wall,1,,,Remote Control,,,,,240 V,White,,,,,,,,,,,,,,,,,,,,,,,,,,,,,,,,,,,,,,,,,,,,,,,,,,,,,,,,,,,,,,,,,,,,,,,,,,,,,,,,,,,,,,,,,,,,,,,,,,,,,,,,,,,,,,,,,,,,,,,,,,,,,,,,,,,,,,,,,,,,,,,,,,,,,,,,,,,,,,,,,,,,,,,,,,,,,,,,,,,,,,,,,,,,,,,,,,,,,,,,,,,,,,,4086138,,,,,,,,,,,,,,,,,,,,,,,,,,,,,,,,,,,,,,,,,,,,,,,,,,
Orpat OHH 1200 Modern Sturdy Design Climate Control Portable Halogen Room Heater,,30-day returns, ,"New: A brand-new, unused, unopened, undamaged item in its original packaging (where packaging is applicable). Packaging should be the same as what is found in a retail store, unless the item is handmade or was packaged by the manufacturer in non-retail packaging, such as an unprinted box or plastic bag. See the seller's listing for full details. ",Orpat,Halogen  Heater,,,Does Not Apply,,Strip,OHH 1200,,,No,,,,,,Does not apply,,Gun Metal,Electric,Floor,3,151-200 sq ft,"400 W ,800 W & 1200 Watt",,,58 Cm Approx,,Radiant,240 V,Gray,,,,,,,,,35 Cm Approx,Infrared,16 Cm Approx,,,,,India,,,,,,,,,,,,,,,,,,,,,,,,,,,,,,,,,,,,,,,,,,,,,,,,,,,,,,,,,,,,,,,,,,,,,,,,,,,,,,,,,,,,,,,,,,,,,,,,,,,,,,,,,,,,,,,,,,,,,,,,,,,,,,,,,,,,,,,,,,,,,,,,,,,,,,,,,,,,,,,,,,,,2900 Gram Approx,,,,,,,,,,,,,,,,,,,,,,,,,,,,,,,,,,,,,,,,,,,,,,,,,,,,,,,,,,,,,,,,,,,,,,,,,,,,,
"Mr. Heater Portable Buddy Camping, Job Site Propane Gas Heater MH9BX (For Parts)",75.0,Last item available,"[""I bought this heater for my small garage workshop. My electric heater kept tripping the breaker while using other equipment. I was afraid of other gas heaters due to their carbon monoxide emissions. This was one of the few gas heaters rated for indoor use. It also has an oxygen depletion detector and tip over cut off feature which I thought was very important.This heater silently keeps my shop warm in even the coldest temperatures and can also be attached to a 20 pound propane tank with an accessory hose ~ which I also purchased. I've run this heater for up to 6 hours uninterrupted with no noticeable fumes and since all the heat is focused out the front, it can be set close to a wall with no worries.I know I'm going to get a lot of use out of this heater. It was a very reasonable price and filled my needs perfectly. Highly recomend the Mr. Heater Buddy for heating small spaces."", 'Here in Monterey County the weather can be colder in the evenings. At my home we cut of the central heating back in ‘88 so we all dress up like eskimos to keep warm. Don’t get me wrong. We do use electric heaters in certain areas but after purchasing this Portable Propane heater, it was Heaven sent. I recommend this product with all my heart. It is compact. It is durable. It is easy to refuel. It is warm to hot. And now, as we speak, the 5 ft extension hose just arrived. When connected from my Gas Buddy to a 20 lb propane tank, I should get at least 24 hrs of constant heat. Thank you for your time. ', 'The last power outage we only had kerosene heaters.  They are big, bulky, heavy, require pouring fuel and the fumes left us wheezing and coughing.  Therefore, we found these Mr. Heater, bought two and what a difference.  Small enough to be moved from room to room and so much safer.  You will love Mr Heater.', ""Small and practical for portable heat when equipped with a disposable bottle, it's even great for a more permanent heat source - just pair this heater up with a hose and a large refillable propane bottle.  It even has a pilot light for easy on and off use.  Two heat settings, 4000 and 9000 BTUs.  The back of the heater stays cool to the touch, so it can be used backed against a wall.  Six stars for this heater."", 'Really nice heater. Relatively easy to operate and has safety features. Heater will not run all night, though with the small propane cylinders. ', ""Love this portable propane heater. Can't wait to take it camping. In the meantime, we use it around the house to warm up and enjoy the heat it produces. If the power goes out, we will stay warm with this heater!"", ""This is a very good product.  What is different about Mr. Heater compared to other small heaters is that it uses 1 lb. propane tanks, thus it does not have to be plugged in or placed near an electrical outlet.  It is easy to use and have a anti tip safety feature that will cut the unit off if the unit is tipped.  Keep on hand a few 1 lb. propane cylinders, and you're good to go.  Very good heater for small spaces and can be used indoors."", 'Great propane heater with 2 settings. I also bought a 12ft hose to connect to a 5 Gallon propane tank. The low setting was enough to warm my 29ft motor home. Perfect.', 'Purchased the additional Mr. Heater 10\' hose (item F273704) that you don\'t have to use a filter and connected it to a 20 lb. bottle of propane.   Easy to light and ran all night on low to keep my greenhouse warm.  I used a 1.5"" PVC water pipe and ran the pipe under the foundation of my greenhouse and then ran the hose through it outside where the tank was located.  For safety reasons, you aren\'t supposed to have the 20 lb. tank inside near the heater.  I cut up an old wash cloth and stuck it inside the pvc pipe to keep bugs and cold air from entering into my greenhouse. So easy to do.  ', 'Product operates exactly as advertised, which nowadays is not always the case. It functions easily and simply. Really like the option to go to larger capacity tank for longer use periods or not having to change out bottles constantly.']",,Mr. Heater,Heater,,,"F232000, MH9BX",,,MH9BX,,,,,,,,,0089301320000,,,Battery,Floor,3,,,Rotary Knob,Copper,,,Heat Pump,,Black,,,,,,,,6 hrs,14.25 in,,9in.,No,,,,Unknown,,,,,,,,,,14.25in.,,,,,,4000-9000 BTU,,,20 gal,,,,,,,,,,,,,,,,,,,,,,,,,,,,,,,,,,,,,,,,,,,,,,,,,,,,,,,,,,,,,,,,,,,,,,,,,,,,,,,,,,,,,,,,,,,,,,,,,,,,,,,,,,,,,,,,,,,,,,,,,,,,,,,,,,,,,,,,,,,,,,,,,,,,,,,,,,,,,,,,,,,,,,,,,,,,,,,,,,,,,,,,,,,,,,,,,,,,,,,,,,,,,,,,,,,,,,,,,,,,,,
Mr. Heater Portable Little Buddy Propane Heater 3800 BTU Warmer Safe Camping,74.99, ,"[""I like it and the whole idea of what options I have with it. I rated it 4 (better than expected) but that's not really it. It is working as I expected, but not just OK. It's good for what I want. And I'm using it on a 100lb tank even though it says to use on 20lb tanks. The attachments are not really working from what I can see so far. And if you don't have the metal guard surrounding the valve (such as older tanks) they are useless. So far I'm satisfied, but will be more satisfied as the temp drops and I use it more."", 'I don’t know if it is a good product or not because Northern Tool, despite having three of them listed as “in stock”, did not have them and I was forced to cancel my order. I came to find out from a friend of mine that they replaced the Mr. Heater brand heater with another brand that is sold much cheaper on other websites. This is deceptive advertising at its worst.', ""I haven't had time to use it yet, but i did set it up and got it started several times to check it out. It lit right up and put out good heat. I think it will serve my purposes very well."", ""Doesn't put off as much heat as I expected but takes the chill off in an unheated 2 car garage."", 'Shipping cost too high', 'And I have no idea of long-term use', 'Nice unit and it throws a lot of heat!', 'Works great for my shop']","New: A brand-new, unused, unopened, undamaged item in its original packaging (where packaging is applicable). Packaging should be the same as what is found in a retail store, unless the item is handmade or was packaged by the manufacturer in non-retail packaging, such as an unprinted box or plastic bag. See the seller's listing for full details. ",Mr. Heater,Portable Heater,Auto Shut-off,,SRC15T,,,Mr. Heater MH4B,,,,,,,,,,,Steel,Propane,"Tank-Top, Desk/Tabletop",1,100 sq ft or Less,,Analog/Mechanical,,,,Radiant,Not Electric,Black,,,,,,,,,,,,,,,,,,,,,,,,,,,,,,,,3000-3999 BTU,,,,,,,,,,,,,,,,,,,,,,,,,,,,,,,,,,,,,,,,,,,,,,,,,,,,,,,,,,,,,,,,,,,,,,,,,,,,,,,,,,,,,,,,,,,,,,,,,,,,,,,,,,,,,,,,,,,,,,,,,,,,,,,,,,,,,,,,,,,,,,,,,,,,,,,,,,,,,,,,,,,,,,,,,,,,,,,,,,,,,,,,,,,,,,,,,,,,,,,,,,,,,,,,,,,,,,,,,,,,,,,,,
Williams Sonoma Rowenta Silent Comfort Heater **Photo Shoot,,30-day returns, ,,Rowenta,,,,,,,,,,,,,,,,Does not apply,,,,,,,,,,,,,,,,,,,,,,,,,,,,,,,,,,,,,,,,,,,,,,,,,,,,,,,,,,,,,,,,,,,,,,,,,,,,,,,,,,,,,,,,,,,,,,,,,,,,,,,,,,,,,,,,,,,,,,,,,,,,,,,,,,,,,,,,,,,,,,,,,,,,,,,,,,,,,,,,,,,,,,,,,,,,,,,,,,,,,,,,,,,,,,,,,,,,,,,,,,,,,,,,,,,,,,,,,,,,,,,,,,,,,,,,,,,,,,,,,,,,,,,,,,,,,,,,,,,,,,,,,,,,,,,
F273699 Heater Fuel Filter - Quantity 6,72.39, ,"['This is the correct filter for using a hose with your Mr Heater. It filters oils that can come from the hose and any trash that might have found its way into hose. Arrived as advertised and ready to go.', ""Those little 1 lb. cylinders are great but if you want to heat for longer than a couple hours you'll find buying a 20 lb. propane tank, a long supply hose and a regulator a must.  My old Mr. Buddys used to work without a regulator but the new one I got wouldn't even light the pilot light without the regulator.  At any rate, I'm sitting warm and Mr. Buddy is working.  Do yourself a favor - even if you don't regularly use a big tank with Mr Buddy having the regulator and hose will give you peace of mind knowing should you need heat for a longer time you've got everything you need to stay warm.  It turns your propane heater from something you can use occasionally to knock the chill off into a heater you can depend on in an emergency."", 'Fuel filter kit matched up with my Mr. Heater without any issues. Works great.', ""I wish it weren't necessary to purchase these filters, because they are expensive and don't last particularly long.  However, they are absolutely necessary.  I learned the hard way with my first Mr. Buddy, which I ran with standard unfiltered propane canisters, which the Mr. Buddy is designed for.  In a season, the heater was hopelessly clogged and useless.  These filters will prevent that from happening.  The problem, unfortunately, is that, with the filters installed, standard canisters don't fit into the heater compartments that are designed to hold them.  The central promise of the Mr. Buddy—portability—is thus dead on arrival."", 'An excellent add-on to a Mr. Heater. Will keep the tiny orifice open and clear, if you are using a 20lbs propane tank. ', ""Have had a Big Buddy for several years as my space heater in the winter. Have always had this filter installed for protection. The filters aren't cheap, but you must have them as a blockage and the cleaning process thereafter is a pain. That's the only reason they are a good value."", 'This product came very fast and it really improve my tent heat performance. Before, I had trouble with the heater. Was hard to start and very hard to keep pilot fire lit. After installing it the pilot heats up fast and stays lit. Nice product, I bought two of them. Both heaters run excellent.', ""The hose I ordered does not require the fuel filter.  My error.  I'm only keeping it in case I buy one that does to run 2 tanks.  Not really a decorater item, so that idea is out.  Into the spares locker on the boat. "", 'Works as needed for Mr heater Buddy heaters.I mistakenly used a generic extension hose from 20lb propane bottle to Buddy heater a few times before the heater stopped working from ""goo"" which came from hose.This filter is much needed for Buddy heaters,I even use it for portable BBQ\'s for same reason.I did learn if the hose from bottle is made by Mr Heater it is fine without filter,true or not I have not tried it yet,Mr Heater uses different materiel for their hoses', ""I used my heaters 2 or 3 times without filter, never again. I didnt know I needed a filter until after reading that I should use one. don't want to damage my heaters. with the price being so low there is just no reason to not use one.""]","New: A brand-new, unused, unopened, undamaged item in its original packaging (where packaging is applicable). Packaging should be the same as what is found in a retail store, unless the item is handmade or was packaged by the manufacturer in non-retail packaging, such as an unprinted box or plastic bag. See the seller's listing for full details. ",Mr. Heater,HOME COMFORT APPLIANCES,n/a,,F273699,0799360364180,,,,,,,,,,,089301736993,,Aluminum,Propane,"Bulkhead, Cabinet",1,,,Analog/Mechanical,,,,Convection,12 V,Gray,,,,,,,,,n/a,"Bluetooth, Bluetooth/Bluetooth Low Energy (BLE)",8.500,,,,,China,,,,,,,2019,,,,Standard,,,,,10000-10999 BTU,,,,,,,,,,,,,,,,,,,,,,,,,,,,,,,"Amazon Alexa, Universal",,,,,,,,,,,,,,,,,,,,,,,,,,,,,,,,,,,,,,,,,,,,,,,,,,,,,,,,,,,,,,,,,,,,,,,,,,,,,,,,,,,,,,,,,,,,,6,,,,,,,,,,,,,,,,,,,,,,,,,,,,,,,,,,,,,,,,,,,,,,,,,,,,,,,,,,,,,,,,,,,,,,,,,,,,,,,,,,,,,,,,,,,,,,,,,,,,,
Lasko 6405 Space Heater Designer Oscillating Gold,71.01,30-day returns,"[""I previously had one of these heaters and actually heated most of my home with it.  The new one I purchased seems to be just as good so far.  I love the fact that it's beautiful and looks like part of the furniture.  My only complaint is that you can't select a temperature range in low heat.  Selecting a temperature range automatically puts it into high heat."", 'Perfect for 200 to 300 Sq foot area. Nice design. Fits in perfectly with my decor. I really like that you can set the temperature that is comfortable and forget it. It has been perfect for a room that has been a bit chilly in the winter months. Highly recommend 👌 ', ""I love this heater, it heats up a 12x10 room quickly and it's whisper quiet.  I would give it 5 stars but...since it's digital, it only allows you to choose temps in increments of 5 degrees.  70 degrees is just a bit chilly while 75 degrees is a little too warm.  So far though it hasn't gone below freezing out yet, so who knows, it may work out when it's 40 below zero outside."", 'This heater is terrific.  Love the hi and low settings.  Oscillating features is great.  Highly recommend!!', ""I'm glad I bought this heater, just in time for these sub-zero temps. we've been having here in the mid-west. My home is almost 100 years old, and has steam heat. The down stairs gets quite chilly when the temperature drops below 20 degrees. This has been a real help warming it, without having to constantly wearing a sweater. "", 'I look at these units as money savers. There’s no point in turning on the heater for the whole house when you just need to heat yourself in a small area.', 'The Lasko Designer Series 1500 Watt Ceramic Electric Portable Heater has sleek lines and looks good in any room.  The thermostat works perfectly and it really produces the heat you require.  I highly recommend this heater.  We now have two of them.  Great product.', 'because a friend bought one &amp; she loved hers as i do mine just wish it came with a remote other wise its just awesome &amp; dosent take long to heat my apt', 'Build quality is excellent and it heats like crazy. However there is an internal overheat protection which seemed to kick-in too aggressively especially if something is blocking the air-flow. Then you have to unplug and wait for 10min for it to reset and start.']","Open box: An item in excellent, new condition with no wear. The item may be missing the original packaging or protective wrapping, or may be in the original packaging but not sealed. The item includes original accessories. The item may be a factory second. See the seller's listing for full details and description. ",Lasko,,"Timer, Oscillation",,6405,0046013766236,,Lasko 6405,,,,,,,,Designer Oscillating Heater,0046013766236,,Ceramic,Electric,,2,,,Touch,,,,,120 V,Brown,,,,,,,0046013766236,,,,,,,,,,,,,,,,,,,,,,,,,,,,,,,,,,,,,,,,,,,,,,,,,,,,,,,,,,,,,,,,,,,,,,,,,,,,,,,,,,,,,,,,,,,,,,,,,,,,,,,,,,,,,,,,,,,,,,,,,,,,,,,,,,,,,,,,,,,,,,,,,,,,,,,,,,,,,,,,,,,,,,,,,,,,,,,,,,,,,,,,,,,,,,,,,,,,,,,,,,,,,,,,,,,,,,,,,,,,,,,,,,,,,,,,,,,,,,,,,,,,,,,,,,
