"Pelonis 1,500-Watt Digital Electric Oil-Filled Radiant Portable Space Heater",74.0, ,"[""This heater is a great product. It doesn't blow heated air around. It gradually heats the air around it so I guess you could say it is subtler and is definitely quieter. I have one in a mid-sized bedroom and two fairly close together in the living room.  I only run the central heat twice in the morning to get the chill out and then these heaters maintain the warmth all day at a better cost. I've had the one for a couple of years with no problems."", '     I have other Pelonis oil filled space heaters..  This one works just as good withe the convenience of the remote control.  highly recommend this product..', 'I thought I was buying a new one. When I got the product it looked like it was out of the box before not put back right and also had scratches all over it . I was not happy ! I was expecting a new one!', ""because  I had one same heater  and it didn't  give me any problems "", 'Good heat output and digital thermostat conserves energy.', 'Very happy with this heater.', 'Verry happy.']","Open box: An item in excellent, new condition with no wear. The item may be missing the original packaging or protective wrapping, or may be in the original packaging but not sealed. The item includes original accessories. The item may be a factory second. See the seller's listing for full details and description. ",Pelonis,Portable Heater,,,HO-0280,,,HO-0280,,,No,,,,,,750545105004,,Cast Metal,Electric,Desk/Tabletop,3 Heat,,,Digital,,,,Radiant,,Black,,,,,,,,,,,,,,,,Unknown,,,,,,,,,,,,,,,,,,,,,,,,,,,,,None,,,,,,,,,,,,,,,,,,,,,,,,,,,,,,,,,,,,,,,,,,,,,,,,,,,,,,,,,,,,,,,,,,,,,,,,,,,,,,,,,,,,,,,,,,,,,,,,,,,,,,,,,,,,,,,,,,,,,,,,,,,,,,,,,,,,,,,,,,,,,,,,,,,,,,,,,,,,,,,,,,,,,,,,,,,,,,,,,,,,,,,,,,,,,,,,,,,,,,,,,,,,,,,,,,,,
Arlec 2000W Wall Mount Ceramic Heater With Remote Control CEH126 ,99.99,28 sold, ,New,Arlec,,,,Arlec HEater,Does not apply,,,White,,,,,,,,Does not apply,,,,Wall,,,,Remote Control,,,,,,,,,,,,,,,,,,,,,,,,,,,,,,,,,,,,,,,,,,,,,,,,,,,,,,,,,,,,,,,,,,,,,,,,,,,,,,,,,,,,,,,,,,,,,,,,,,,,,,,,,,,,,,,,,,,,,,,,,,,,,,,,,,,,,,,,,,,,,,,,,,,,,,,,,,,,,,,,,,,,,,,,,,,,,,,,,,,,,,,,,,,,,,,,,,,,,,,,,,,,,,,,,,,,,,,,,,,,,,,,,,,,,,,,,,,,,,,,,,,,,,,,,,,,,,,,,,,,,,,
Pelonis 1500W - II Portable Ceramic Disc Furnace Heater,75.0, ,"[""First impression is: it's HEAVY. I like heavy. 90% of the space heaters on the market are flimsy units with cheap thermostats that burn out in a year because they're constantly kicking on &amp; off. The Pelonis is a ceramic design which appears much more durable. The control knobs turn smoothly - no shortcuts were taken with parts. Best for rooms where you want to maintain a constant temperature, but it doesn't mind being cranked up either.If you have to shut it off, I recommend switching to FAN for a few minutes as a cool-down cycle.I got my first Pelonis brand-new in the box for $5 at a yard sale. I knew I needed to get another!"", 'The original pelonis heater I had last 32 years. I bought another one identical to the original. ', 'Great heater...this is the second one I own...', 'It’s working. All that matters.', 'Works great!', 'excellent thank you']",,Pelonis,Ceramic,"Automatic Shut-Off, Enclosed Motor, Portable",,,,,1500W,,,,Bathroom/ Office/ Small room,,,,,,,Ceramic,Electric,,Variable,,up to 1500W,Switch,,,,Furnace,120 V,Brown,,,,,,,,,7 in,,6 in,,,,,Taiwan,,,,,,,1989,,,5 in,Moderate,,,,,,,,,,,,Brown,,,,,,,,,,,,,,,,,,,,,,,,,,,,,,,,,,,,,,,,,,,,,,,,,,,,,,,,,,,,,,,,,,,,,,,5200,,,,,,,,,,,,,,,,,,,,,,,,,,,,,,,,,,,,,,,,,,,,,,,,,,,,,,,,,,,,,,,,,,,,,,,,,,,,,,,,,,,,,,,,,,,,,,,,,,,,,,,,,,,,,,,,,,,,,,,,,,,,,,,,,,,,,,,,,,,,,,,,,,,
Mid Century Yellow FLOWTRON MARK ll 1500 Watt Heater Cooler Tested Free Ship,70.0,7 watchers, ,"Used: An item that has been used previously. The item may have some signs of cosmetic wear, but is fully operational and functions as intended. This item may be a floor model or store return that has been used. See the seller’s listing for full details and description of any imperfections. ",FLOWTRON,Heater • Cooler,,,,,,MKll,,,,,,,,,,,"Aluminum, Ceramic, Plastic","Electric, Fan","Desk/Tabletop, Floor",4,151-200 sq ft,1001-1500 W,Dial,,,,Forced Air/Fan,750/1500 Watt,Yellow,,,,,,,,,10,,7,,,,,,,,,,,,,,,,Standard,,,,,,,,,,,,,,,,,,,,,,,,,,,,,,,,,,,,,,,,,,,,,,,,,,,,,,,,,,,,,,,,,,,,,,,,,,,,,,,,,,,,,,,,,,,,,,,,,,,,,,,,,,,,,,,,,,,,,,,,,,,,,,,,,,,,,,,,,,,,,,,,,,,,,,,,,,,,,,,,,,,,,,,,,,,,,,,,,,,,,,,,,,,,,,,,,,,,,,,,,,,,,,,,,,,,,,,,,,,,,,,,,,,,,,
Honeywell Commercial Grade Turbo Heater HZ-502,74.99, , ,"Used: An item that has been used previously. The item may have some signs of cosmetic wear, but is fully operational and functions as intended. This item may be a floor model or store return that has been used. See the seller’s listing for full details and description of any imperfections. ",Honeywell,Portable Turbo Heater,,,,,,Honeywell HZ502,,,,,,,,,,,,Electric,,,,,,,,,Forced Air/Fan,120 V,,,,,,,,,,,,,,,,,,,,,,,,,,,,,,,,,,,,,,,,,,,,,,,,,,,,,,,,,,,,,,,,,,,,,,,,,,,,,,,,,,,,,,,,,,,,,,,,,,,,,,,,,,,,,,,,,,,,,,,,,,,,,,,,,,,,,,,,,,,,,,,,,,,,,,,,,,,,,,,,,,,,,,,,,,,,,,,,,,,,,,,,,,,,,,,,,,,,,,,,,,,,,,,,,,,,,,,,,,,,,,,,,,,,,,,,,,,,,,,,,,,,,,,,,,,,,,,,,,
Bionaire Silent Micathermic 1500W Console Heater BH3900 - Works Great!,70.0, , ,"Used: An item that has been used previously. The item may have some signs of cosmetic wear, but is fully operational and functions as intended. This item may be a floor model or store return that has been used. See the seller’s listing for full details and description of any imperfections. ",Bionaire,Portable Heater,"Ultra Lightweight Design, Whisper Quiet, Tip Over Protection",,BH3900,,,Bionaire BH3900,,,,,,,,,,,,Electric,Floor,5 or More,,1001-1500 W,Touch,,,,Micathermic,120 V,Gray,,,,,,,,,26 in,Powerline/UPB,20 in,,,,,,,,,,,,,,,9 in,,,,,,,,,,,,,,,,,,,,,,,,,,,,,,,,,,,,,,,,,,,,,,,,,,,,,,,,,,,,,,,,,,,,,,,,,,,,,,,,,,,,,Less Than 2 tons,,,,,,,,,,,,,,,,,,,,,,,,,,,,,,,,,,,,,,,,,,,,,,,,,,,,,,,,,,,,,,,,,,,,,,,,,,,,,,,,,,,,,,,,,,,,,,,,,,,,,,,,,,,,,,,,,,,,,,,,,,,,,,,,,,,,,,,,,,,,,,,,,,
De'Longhi Oil-Filled Radiator Space Heater Adjustable Thermostat 3 Heat Settings,74.02, , ,,De'Longhi,Space Heater,,,TRD40615EBK,,,TRD40615EBK,,,,,,,,,044387347150,,,Corded Electric,,,,,,,,,,,Black,,,TRD40615EBK,,,,,,,,,,,,,,,,,,,,,,,,,,,,,,,,,,Heater,,,,,,,,,,,,,,,,,,,,,,,,,,,,,,,,,,,,,,,,,,,,,,,,,,,,,,,,,,,,,,,,,,,,,,,,,,,,,,,,,,,,,,,,,,,,,,,,,,,,,,,,,,,,,,,,,,,,,,,,,,,,,,,,,,,,,,,,,,,,,,,,,,,,,,,,,,,,,,,,,,,,,,,,,,,,,,,,,,,,,,,,,,,,,,,,,,,,,,,,,,,,,,,,,,,,,,,,,,,,
vornado heater,75.0, , ,"Used: An item that has been used previously. The item may have some signs of cosmetic wear, but is fully operational and functions as intended. This item may be a floor model or store return that has been used. See the seller’s listing for full details and description of any imperfections. ",Vornado,,,,,,,,,,,,,,,,,,,,,,,,,,,,,,,,,,,,,,,,,,,,,,,,,,,,,,,,,,,,,,,,,,,,,,,,,,,,,,,,,,,,,,,,,,,,,,,,,,,,,,,,,,,,,,,,,,,,,,,,,,,,,,,,,,,,,,,,,,,,,,,,,,,,,,,,,,,,,,,,,,,,,,,,,,,,,,,,,,,,,,,,,,,,,,,,,,,,,,,,,,,,,,,,,,,,,,,,,,,,,,,,,,,,,,,,,,,,,,,,,,,,,,,,,,,,,,,,,,,,,,,,,,,,,,,,,,,,,,,,,,,,,,,
Kenmore Cabinet Infrared Heater On Wheels Model 127.96380610 NICE & WORKS,72.95, , ,"Used: An item that has been used previously. The item may have some signs of cosmetic wear, but is fully operational and functions as intended. This item may be a floor model or store return that has been used. See the seller’s listing for full details and description of any imperfections. ",Kenmore,Portable Heater,"Auto Shut-off, Timer",,,,INFRARED,32-96380,,,No,,,,,,,,,Electric,Floor,Variable,,,,,,,Infrared,120 V,Black,,,,,,,,,,Infrared,,,,,,China,,,,,,,Unknown,,,,,UNKNOWN,1-Way,,,,,,110v,,,,,,,,,,None,,,,,,,,,,,,,,,,,,,,,,,,,,,,,,,,,,,,,,,,,,,,,,,,,,,,,,,,,,,,,,,,,,,,,,,,,,,,,,,,,,,,,,,,,,,,,,,,,,,,,,,,,,,,,,,,,,,,,,,,,,,,,,,,,,,,,,,,,,,,,,,,,,,,,,,,,,,,,,,,,,,,,,,,,,,,,,,,,,,,,,,,,,,,,,,,,,,,,,,,,,,,,,,,,,,,
Unbranded Pet Supplies Cozy Safe Chicken Coop Heater 200-Watt Flat Panel Design,71.06,Last item available,"[""We have made a shelter in our garage for a feral cat that we have been feeding for quite a while. It comes into our garage and goes upstairs to an attic . This heater keeps the little shelter box warm and cozy. It works from radiant heat and does not get hot enough to burn anything so I don't have to be concerned about fires. It doesn't use a lot of electricity and works great!"", 'I would not recommend this product for use in a coop. I bought it to use in a 4\'x6\'x3\' coop and it raised the inside temperature by approximately 10 degrees... not very helpful when the outside temperature averages 10 degrees or less all winter. I tried it in the house first and the temperature sticker (heat sensor) glowed after a few minutes. Once I put it outside, the sticker hasn\'t glowed at all and the chicken\'s water has frozen twice - despite being within inches of the heater. I\'m sure it would be fine for indoor brooding, or even in warmer climates, but if you live ""up north"" where winters are long &amp; cold I would definitely look into something which produces significantly more heat.', ""Great for a small indoor space with not a lot of movement of the air.  It doesn't put out a tremendous amount of heat and can actually be touched without any real discomfort. Would be great for a small chicken coop or a heated animal enclosure (like a dog or cat house) but the switch is not waterproof and neither is the heat panel, so avoid wet situations."", 'Warm safe indoor outdoor type of heater that uses little electricity and since it uses little energy it can also run on a small emergency inverter great peace of mind', 'I have no chickens.....I do have an old house that\'s a 100 years old.....Little drafty in a few places... And, I\'m loving these....The low cost to operate hardly taking any space at all to be used in and just taking a chill out of the air....Well my ""Cock"" is gonna be happy this Winter....', ""easy to use, safe, and doesn't take up a lot of room.  It is however hot to the touch unlike it says!"", 'Works great. Only draws 200 watts. Delivered quickly. Chickens love it.', 'Use it inside for my cockatiel. Note that the bird has to be pretty close (within 5-6 inches) to the for them to feel heat but I am very happy with it. It would work outside with my chickens if they needed it.', ""I won't be running this heater all the time, but there are nights here that go below freezing. I've had chicken's combs freeze before, and it's not pretty. This will keep the coop above freezing, and solve the problem! It mounts on the wall, and it's easy to clean. GREAT product~~~"", 'Amazed, after reading a couple other reviews, but mine arrived intact, and is working perfectly, in some really cold conditions.  I have it in a very small coop, but with -35 temps, it is keeping it fine for my girls!Very happy, so far....knock on wood!']","New: A brand-new, unused, unopened, undamaged item in its original packaging (where packaging is applicable). Packaging should be the same as what is found in a retail store, unless the item is handmade or was packaged by the manufacturer in non-retail packaging, such as an unprinted box or plastic bag. See the seller's listing for full details. ",Cozy,"Panel, Flat Panel","Thermostat, Outdoor",,CL-COOP,0706069235246,,CL-COOP,,,,,,,,,0706069235246,,Plastic,Electric,Wall,2,Large,"200, 200W",Switch,,,,Radiant,120 V,Black,,,,,,,,,,,"19 in, 19in.",,,,,,,,,,,,,,,,,,,,,,,,,,,,,,,,,,,,,,,,,,,,,,,,,,,,,,,,,,,,,,,,,,,,,,,,,,,,,,,,,,,,,,,,,,,,,,,,,,,,,,,,,,,,,,,,,,,,,,,,,,,,,,,,,,,,,,,,,,,,,,,,,,,,,,,,,,,,,,,,,,,,,,,,,,,,,,,,,,,,,,,,,,,,,,,,,,,,,,,,,,,,,,,,,,,,,,,,,,,,,,,,,,,,,,,,,,,,,,,,,,,,,,
Antique 1930s Wesix Electric Space Heater RCS-1 1/4 115 Volts 1250 Watts Works!,75.0,30-day returns, ,"Used: An item that has been used previously. The item may have some signs of cosmetic wear, but is fully operational and functions as intended. This item may be a floor model or store return that has been used. See the seller’s listing for full details and description of any imperfections. ",Wesix,Portable Heater,,,,,Coil,RCS-1 1/4,,,,,,,,,,,Steel,Electric,Floor,1,,1001-1500 W,,Steel,,,Radiant,120 V,Silver,,,,,,,,,16 Inches,,10 Inches,,,,,United States,,,,,,,1940,,,6 in,,,1-Way,,,,,,,,,,,,,,,,,,,,,,,,,,,,,,,,,,,,,,,,,,,,,,,,,,,,,,,,,,,,,,,,,,,,,,,,,,,,,,,,,,,,,,,,,,,,,,,,,,,,,,,,,,,,,,,,,,,,,,,,,,,,,,,,,,,,,,,,,,,,,,,,,,,,,,,,,,,,,,,,,,,,,,,,,,,,,,,,,,,,,,,,,,,,,,,,,,,,,,,,,,,,,,,,,,,,,,,,,,,,,,,,,,,,
Electric Heater For Home 900w Mini Fan Heater Home Heating Electric Warm Air Fan,70.99,30-day returns, ,"New: A brand-new, unused, unopened, undamaged item in its original packaging (where packaging is applicable). Packaging should be the same as what is found in a retail store, unless the item is handmade or was packaged by the manufacturer in non-retail packaging, such as an unprinted box or plastic bag. See the seller's listing for full details. ",Unbranded,Portable Heater,Timer,,,,N/A,,,,,,,,,,,,Ceramic,"Electric, Fan",Wall,1,N/A,900W,Remote Control,PCT Ceramic heating,,,Forced Air/Fan,220 V,White and Black,,,,,,,,,13.5 cm,,N/A,,,,,,,,,,,,,,,13.5 cm,,N/A,,,,,,,N/A,N/A,,,,,,,,,,,,,,,,,,,,,,,,,,,,,,,,,,,,,,,,,,,,,,,,,,,,,,,,,,,,,,,,,,,,,,,,,,,,,,,,,,,,,,,,,,,,,,,,,,,,,,,,,,,,,,,,,,,,,,,,,,,,,,,,,,,,,,,,,,,,,,,,,,,,,,,,,,,,,,,,,,,,,,,,,,,,,,,,,,,,,,,,,,,,,,,,,,,,,,,,,,,,,,,,,,,,,,,,,,,,,
Vintage TITAN T761 Portable Electric Space Heater 1500W - Works Great,72.95, , ,,Titan,Portable Heater,,,,,,,,,,,,,,,7427281819689,,,Electric,,,,,,,,,,,,,,,,,,,,,,,,,,,,,,,,,,,,,,,,,,,,,,,,,,,,,,,,,,,,,,,,,,,,,,,,,,,,,,,,,,,,,,,,,,,,,,,,,,,,,,,,,,,,,,,,,,,,,,,,,,,,,,,,,,,,,,,,,,,,,,,,,,,,,,,,,,,,,,,,,,,,,,,,,,,,,,,,,,,,,,,,,,,,,,,,,,,,,,,,,,,,,,,,,,,,,,,,,,,,,,,,,,,,,,,,,,,,,,,,,,,,,,,,,,,,,,,,,,,,,,,,,,,,
Electric Dog House Heater Wall Mounted Outdoor Pet Enclosure Heating Tool 300 W,70.0, , ,"Used: An item that has been used previously. The item may have some signs of cosmetic wear, but is fully operational and functions as intended. This item may be a floor model or store return that has been used. See the seller’s listing for full details and description of any imperfections. ",Does not apply,Does not apply,,,,,,,,,,,,,,,7445048022097,,Metal,Electric,Wall,3 Heat,,,,,,,,,Black,,,,,,,,,,,,,,,,,,,,,,,,,,,,,,,,,,,,,,,,,,,,,,,,Electric,,Outdoor,1.63,Small,"Fan Included,Quiet Operation,Thermostat,Vented",,,300,Other,,"Auto Shut Off,Cool-to-the-Touch",,115 V,Dial,,,,,,,,,,,,,,,,,,,,,,,,,,,,,,,,,,,,,,,,,,,,,,,,,,7.4,96,12,0,1,12.7,Blacks,00854303006784,5.1,ETL Listed,10.3,,,,,,,,,,,,,,,,,,,,,,,,,,,,,,,,,,,,,,,,,,,,,,,,,,,,,,,,,,,,,,,,,,,,,,,,,,,,,,,,,,,,,,,,,,,,,,,,,,,,,,,,,,,,,,,,,,,,,,,,,,,,,,,,,,,,,,,
Electric Remote Insert Log Fireplace Space Heater 3D Flame Stove LH-24,,30-day returns, ,,Unbranded,Electric Fireplace,,,,,,,,,,,,,,,,,,Electric,,,,,,,,,,,Black,,,,,,,,,,,,,,,,,,,,,,,,,,,,,,,,,,,,,,,,,,,,,,,,,,,,,,,,,,,,,,,,,,,,,,,,,,,,,,,,,,,,,,,,,,,,,,,,,,,,,,,,,,,,,,,,,,,,,,,,,,,,,,,,,,,,,,,,,,,,,,,,,,,,,,,,,,,,,,,,,,,,,,,,,,,,,,,,,,,,,,,,,,,,,,,,,,,,,,,,,,,,,,,,,,,,,,,,,,,,,,,,,,,,,,,,,,,,,,,,,,,,,,,,,,,,,,,,,
Pelonis Electric Radiator Heater,70.0, , ,"New: A brand-new, unused, unopened, undamaged item in its original packaging (where packaging is applicable). Packaging should be the same as what is found in a retail store, unless the item is handmade or was packaged by the manufacturer in non-retail packaging, such as an unprinted box or plastic bag. See the seller's listing for full details. ",Pelonis,Portable Oil Filled Radiator,,,,,,PSH0702ABB,,,,,,,,,750545106582,,"Aluminum, Ceramic",Electric,Floor,3,,,Switch,,,,Radiant,,Black,,,,,,,,,,,,,,,,,,,,,,,,,,,,,,,,,,,,,,,,,,,,,,,,,,,,,,,,,,,,,,,,,,,,,,,,,,,,,,,,,,,,,,,,,,,,,,,,,,,,,,,,,,,,,,,,,,,,,,,,,,,,,,,,,,,,,,,,,,,,,,,,,,,,,,,,,,,,,,,,,,,,,,,,,,,,,,,,,,,,,,,,,,,,,,,,,,,,,,,,,,,,,,,,,,,,,,,,,,,,,,,,,,,,,,,,,,,,,,,,,,,,,,,,,,,,,,,,,
Space Heater Oil Filled Electric 3 Setting Low Cost Radiator Wheeled Home Office,75.0, , ,"New: A brand-new, unused, unopened, undamaged item in its original packaging (where packaging is applicable). Packaging should be the same as what is found in a retail store, unless the item is handmade or was packaged by the manufacturer in non-retail packaging, such as an unprinted box or plastic bag. See the seller's listing for full details. ",Does not apply,,,,Does not apply,,,Does Not Apply,,,,,,,,14 x 5.7 x 23 (L x W x H),705353613098,,,,,,,,,,,,,,White,,,,,,Does not apply,,,,,,,,,,,,,,,,,,,,,,,,,,,,,,,,,,,,,,,,,,,,,,,,,,,,,,,,,,,,,,,,,,,,,,,,,,,,,,,,,,,,,,,,,,,,,,,,,,,,,,,,,,,,,,,,,,,,,"600 W (low heat setting), 900 W (medium heat setting), 1500 W (hi",20 lbs,Oil-filled,5.7,1 x oil-filled radiator,4.2 lbs,"120 V AC, 60 Hz",Indoor,,,,,,,,,,,,,,,,,,,,,,,,,,,,,,,,,,,,,,,,,,,,,,,,,,,,,,,,,,,,,,,,,,,,,,,,,,,,,,,,,,,,,,,,,,,,,,,,,,,,,,,,,,,,,,,,,,,,,,,,,,,,,,,
VINTAGE LASALLE Portable Electric Space Heater 195 K1  WORKS WELL NICE SHAPE,75.0, , ,,LASALLE,Portable Heater,,,195K1,,,195 K1,,,,,,,,,Does not apply,,Steel,Electric,,Variable,,,,,,,,120 V,Blue,,,,,,,,,,,,,,,,United States,,,,,,,,,,,,,,,,,,,,,,,,,,,,,,,,,,,,,,,,,,,,,,,,,,,,,,,,,,,,,,,,,,,,,,,,,,,,,,,,,,,,,,,,,,,,,,,,,,,,,,,,,,,,,,,,,,,,,,,,,,,,,,,,,,,,,,,,,,,,,,,,,,,,,,,,,,,,,,,,,,,,,,,,,,,,,,,,,,,,,,,,,,,,,,,,,,,,,,,,,,,,,,,,,,,,,,,,,,,,,,,,,,,,,,,,,,,,,,,,,
Lasko RC Ultra Ceramic Tower Space Heater Extended Heat Zone CT30710,, , ,"Used: An item that has been used previously. The item may have some signs of cosmetic wear, but is fully operational and functions as intended. This item may be a floor model or store return that has been used. See the seller’s listing for full details and description of any imperfections. ",Lasko,Tower Heater,"Auto Shut-off, Oscillation, Timer",,,,na,Lasko CT30710,,,,,,,,,0046013769282,,Ceramic,Electric,na,na,101-150 sq ft,1500 W,na,na,,,na,na,na,,,,,,,,8 hrs,na,,na,,,,,,,,,,,,,,,na,na,na,,,,na,,3 Stars,na,na,,,,,,,,,,,,,,,,,,,,,,,,,,,,,,,,,,,,,A+++ - D,,,,,,,,,,,,,,,,,,,,,,,,,,,,,,,,,,,,,,,,,,,,,,,,,,,,,,,,,,,,,,,,,,,,,,,,,,,,,,,,,,,,,,,,,,,,,,,,,,,,,,,,,,,,,,,,,,,,,,,,,,,,,,,,,,,,,,,,,,,,,,,,,,,,,,,,,,,,,,,,,,,,,,,,,,,,,,,,,,,,,,,,
Lasko Portable Electric Tower Heater 25 in. 1500 W Oscillating Thermostat,74.19,30-day returns, ,"New: A brand-new, unused, unopened, undamaged item in its original packaging (where packaging is applicable). Packaging should be the same as what is found in a retail store, unless the item is handmade or was packaged by the manufacturer in non-retail packaging, such as an unprinted box or plastic bag. See the seller's listing for full details. ",Lasko,Tower Heater,"Handle, Timer, Indoor",,6462,0046013775863,Coil,6462,,,,,,,,,0046013775863,,"Ceramic, Plastic, Metal",Electric,Floor,2,300sq. ft.,1500 W,"Remote Control, Touch",Plastic,,,Ceramic Heater,120V,"Silver, Gray",,,,,,,,,,,11in,,,,,,,,,,,,,,,,3 quiet settings,N/A,,,,N/A,,N/A,,N/A,,,,,,,,,,,,,,,,,,,,,,,,,,,,,,,,,,,,,,,,,,,,,,,,,,,,,,,,,,,,,,,,,,,,,,,,,,,,,,,,,,,,,,,,,,,,,,,,,,,,,,,,,,,,,,,,,,,,,,,,,,,,,,,,,,,,,,,,,,,,,,,,,,,,,,,,,,,,,,,,,,,,,,,,,,,,,,,,,,,,,,,,,,,,,,,,,,,,,,,,,,,,,,,,,,,,,,,,,,,,,
 , , , ,,,,,,,,,,,,,,,,,,,,,,,,,,,,,,,,,,,,,,,,,,,,,,,,,,,,,,,,,,,,,,,,,,,,,,,,,,,,,,,,,,,,,,,,,,,,,,,,,,,,,,,,,,,,,,,,,,,,,,,,,,,,,,,,,,,,,,,,,,,,,,,,,,,,,,,,,,,,,,,,,,,,,,,,,,,,,,,,,,,,,,,,,,,,,,,,,,,,,,,,,,,,,,,,,,,,,,,,,,,,,,,,,,,,,,,,,,,,,,,,,,,,,,,,,,,,,,,,,,,,,,,,,,,,,,,,,,,,,,,,,,,,,,,,,
Lasko Portable Electric Tower Heater 25 in. 1500 W Oscillating Thermostat,74.19,30-day returns, ,"New: A brand-new, unused, unopened, undamaged item in its original packaging (where packaging is applicable). Packaging should be the same as what is found in a retail store, unless the item is handmade or was packaged by the manufacturer in non-retail packaging, such as an unprinted box or plastic bag. See the seller's listing for full details. ",Lasko,Tower Heater,"Handle, Timer, Indoor",,6462,0046013775863,Coil,6462,,,,,,,,,0046013775863,,"Ceramic, Plastic, Metal",Electric,Floor,2,300sq. ft.,1500 W,"Remote Control, Touch",Plastic,,,Ceramic Heater,120V,"Silver, Gray",,,,,,,,,,,11in,,,,,,,,,,,,,,,,3 quiet settings,N/A,,,,N/A,,N/A,,N/A,,,,,,,,,,,,,,,,,,,,,,,,,,,,,,,,,,,,,,,,,,,,,,,,,,,,,,,,,,,,,,,,,,,,,,,,,,,,,,,,,,,,,,,,,,,,,,,,,,,,,,,,,,,,,,,,,,,,,,,,,,,,,,,,,,,,,,,,,,,,,,,,,,,,,,,,,,,,,,,,,,,,,,,,,,,,,,,,,,,,,,,,,,,,,,,,,,,,,,,,,,,,,,,,,,,,,,,,,,,,,
Lifesmart 6-Element Front Air Intake Heater 3-Setting Black Digital Temperature ,74.99, , ,,LIfesmart,Portable Heater,Auto Shut-off,,Does Not Apply,,N/A,N/A,,,,,,,,,817223010026,,Ceramic,Electric,Desk/Tabletop,1,101-150 sq ft,201-300 W,"Digital, Switch",N/A,,,Forced Air/Fan,120 V,Black,,,,,,,,,N/A,,N/A,,,,,,,,,,,,,,,N/A,None,Less Than 80%,,,,2000-2999 BTU,,A++,N/A,3 or Less,,,,,,,,,,,,,,,,,,,,,,,,,,,,,,,,,,,,,A+++ - G,,,,,,,,,,,,,,,,,,,,,,,,,,,,,,,,,,,,,,,,,,,,,,,,,,,,,,,,,,,,,,,,,,,,,,,,,,,,,,,,,,,,,,,,,,,,,,,,,,,,,,,,,,,,,,,,,,,,,,,,,,,,,,,,,,,,,,,,,,,,,,,,,,,,,,,,,,,,,,,,,,,,,,,,,,,,,,,,,,,,,,,,
Thermal Heating Pad Device 200cm Cable Silicone Orange Heater Flexible,73.46,30-day returns, ,"New: A brand-new, unused, unopened, undamaged item in its original packaging (where packaging is applicable). Packaging should be the same as what is found in a retail store, unless the item is handmade or was packaged by the manufacturer in non-retail packaging, such as an unprinted box or plastic bag. See the seller's listing for full details. ",Unbranded,,,,Does Not Apply,,,Heating Pad,,,,,,,,,,,Silicone rubber,,,,,1200W,,,,,,,Orange,,,,,,,,,,,,,,,,,,,,,,,,,,,,,,,,,,,,,,,,,,,,,,,,,,,,,,,,,,,,,,,,,,,,,,,,,,,,,,,,,,,,,,,,,,,1500v / 5s,± 8%,200 cm,,,,,,,,,,,,,,,,,,,,,,,,,,,,,,,,,,,,,,,,,,,,,,,,,,,,,,,,,,,,,,,,,,,,,,,,,,,,,,,,,,,,,,,,,,,,,,,,,,,,,,,,,,,,,,,,,,,,,,,,,,,,,,,,,,,,,,,,,,,,,,,,,,,,,,,,,,,,,,,,,,,,
Holmes High Temp Quartz Space Heater Adjustable Works Great HQH305,, , ,"Used: An item that has been used previously. The item may have some signs of cosmetic wear, but is fully operational and functions as intended. This item may be a floor model or store return that has been used. See the seller’s listing for full details and description of any imperfections. ",Holmes,Portable Heater,na,,,,na,HQH305,,,,,,,,,,,Ceramic,Electric,na,na,100 sq ft or Less,na,na,na,,,na,na,Gray,,,,,,,,,na,,na,,,,,,,,,,,,,,,na,na,na,,,,na,,3 Stars,na,na,,,,,,,,,,,,,,,,,,,,,,,,,,,,,,,,,,,,,A+++ - D,,,,,,,,,,,,,,,,,,,,,,,,,,,,,,,,,,,,,,,,,,,,,,,,,,,,,,,,,,,,,,,,,,,,,,,,,,,,,,,,,,,,,,,,,,,,,,,,,,,,,,,,,,,,,,,,,,,,,,,,,,,,,,,,,,,,,,,,,,,,,,,,,,,,,,,,,,,,,,,,,,,,,,,,,,,,,,,,,,,,,,,,
VINTAGE LASALLE Portable Electric Space Heater 195 K1  WORKS WELL NICE SHAPE,75.0, , ,,LASALLE,Portable Heater,,,195K1,,,195 K1,,,,,,,,,Does not apply,,Steel,Electric,,Variable,,,,,,,,120 V,Blue,,,,,,,,,,,,,,,,United States,,,,,,,,,,,,,,,,,,,,,,,,,,,,,,,,,,,,,,,,,,,,,,,,,,,,,,,,,,,,,,,,,,,,,,,,,,,,,,,,,,,,,,,,,,,,,,,,,,,,,,,,,,,,,,,,,,,,,,,,,,,,,,,,,,,,,,,,,,,,,,,,,,,,,,,,,,,,,,,,,,,,,,,,,,,,,,,,,,,,,,,,,,,,,,,,,,,,,,,,,,,,,,,,,,,,,,,,,,,,,,,,,,,,,,,,,,,,,,,,,
Portable Electric Space Heater w/ Ceramic Heating Element Heavy Duty Steel Base,70.56,30-day returns, ,"New: A brand-new, unused, unopened, undamaged item in its original packaging (where packaging is applicable). Packaging should be the same as what is found in a retail store, unless the item is handmade or was packaged by the manufacturer in non-retail packaging, such as an unprinted box or plastic bag. See the seller's listing for full details. ",DuraHeat,Does not apply,,,,07445039553500,,,,,,,,,,,7445039553500,,Steel,,,Variable,,,,,,,,,Yellow/ Black,,,,,,,Does not apply,,,,,,,,,,,,,,,,,,,,,,,,,,,,,,,,,,,,,,,,,Electric,,Indoor,15 A,Small,"Fan Included,Handle,Portable,Quiet Operation,Thermostat",,,1500 W,,,Auto Shut Off,,120,Dial,,,,,,,,,,,,,,,,,,,,,,,,,,,,,,,,,,,,,,,,,,,,,,,,,,6.25 in,72,250,5120,1,8.4 in,Yellows / Golds,,4.50 lb,ETL Listed,7.75 in,,,,,,,,,,,,,,,,,,,,,,,,,,,,,,,,,,,,,,,,,,,,,,,,,,,,,,,,,,,,,,,,,,,,,,,,,,,,,,,,,,,,,,,,,,,,,,,,,,,,,,,,,,,,,,,,,,,,,,,,,,,,,,,,,,,,,,,
