Lasko Air Motion Technology 175 sq ft Electric Air Mover Heater,69.98, , ,"New: A brand-new, unused, unopened, undamaged item in its original packaging (where packaging is applicable). Packaging should be the same as what is found in a retail store, unless the item is handmade or was packaged by the manufacturer in non-retail packaging, such as an unprinted box or plastic bag. See the seller's listing for full details. ",Lasko,Electric,Portable Heater,Forced Air/Fan,Floor,,Plastic,2,Touch,Lasko CC13251,120 V,"Auto Shut-off, Timer, Cool-Touch Housing, Adjustable Thermostat, Overheat Protection",,1001-1500 W,,Ceramic,,,,251-300 sq ft,10.7 in,CC13251,,6-3/16 in,13-9/16 in,,,,,,,,046013768919,Gray,,,,,,,,,,,,4 hrs,N/A,,,,,N/A,,,,,,,,,,,,,,,,,,,,,,,,,,,,,,,,,,,,,,,,,,,,,,,,,,,,,,,,,,,,,,,,,,,,,,,,,,,,,,,,,,,,,,,,,,,,,,,,,,,,,,,,,,,,,,,,,,,,,,,,,,,,,,,,,,,,,,,,,,,,,,,,,,,,,,,,,,,,,,,,,,,,,
"14"" All Metal Portable 1500 Watt Utility Radiant Electric Milkhouse Heater",65.66, , ,"New: A brand-new, unused, unopened, undamaged item in its original packaging (where packaging is applicable). Packaging should be the same as what is found in a retail store, unless the item is handmade or was packaged by the manufacturer in non-retail packaging, such as an unprinted box or plastic bag. See the seller's listing for full details. ",Comfort Zone,Electric,Radiant Heater,Radiant,Floor,,Metal,2,"Analog/Mechanical, Dial",YESCZ798BKMT,120,"Adjustable thermostat, caution indicator lights, anti-freeze setting, safety tip over switch",,1500 W,,,,,,100 sq ft or Less,14 in,NA,,,,,,,,,,NA,NA,Black,,,,,,,,,,,,,,,,,,,,,,,,,,,,,,,,,,,,,,,,,,,,,,,,,,,,,,,,,,,,,,,,,,,,,,,,,,,,,,,,,,,,,,,,,,,,,,,,,,,,,,,,,,,,,,,,,,,,,,,,,,,,,,,,,,,,,,,,,,,,,,,,,,,,,,,,,,,,,,,,,,,,,,,,,,,,,,,,,,,,,,,
Qmark C1524IFA 1500/1125 Watts 240/208V Fan Forced Wall Heater,69.99, , ,"New: A brand-new, unused, unopened, undamaged item in its original packaging (where packaging is applicable). Packaging should be the same as what is found in a retail store, unless the item is handmade or was packaged by the manufacturer in non-retail packaging, such as an unprinted box or plastic bag. See the seller's listing for full details. ",QMark,Fan,,,Wall,,,,,,208/240 V,,,,,,,,,,,,,,,,,,,,,,,,,,,,,,,,,,,,,,,,,,,,,,,,,,,,,,,,,,,,,,,,,,,,,,,,,,,,,,,,,,,,,,,,,,,,,,,,,,,,,,,,,,,,,,,,,,,,,,,,,,,,,,,,,,,,,,,,,,,,,,,,,,,,,,,,,,,,,,,,,,,,,,,,,,,,,,,,,,,,,,,,,,,,,,,,,,,,,,,,,,,,,,
Mr Heater F242300 Mr Heater 15000 BTU Propane Heater-Cooker,67.43,6 watchers,"['I just replaced this unit after my other unit failed after 40 years.  Most products don’t make it 4 years.  I use it ice fishing for warm lunches, in the ice hut for warmth, tent while hunting for a quick morning coffee and in my truck emergency provisions for driving and living in the high Colorado mountains.  As with any propane product, always properly ventilate and don’t fall asleep while in use.', ""Just used it once briefly and seemed to light easily and generate solid radiant heat for a 1lb cylinder heater.  Nice to have the convertible stand for cooking too but haven't tried that and may not."", 'Got this to heat my ice fishing shelter.. It works great and the three settings make it easy to regulated the temperature', ""We bought this heater for our grandson to use in his deer blind. We have several of these and I and my wife set together in a pop-up blind in any weather and have nothing bad to say about this heater. It allows us to cook lunch make coffee and tea which makes for memorable occasion's.I have had issues in the past with this heater and moisture in the propane hose, I use a Mr. Heater in line filter and have eliminated the problem. this is not and isolated issue with this heater as Mr. Heater recommends the inline filter with the big buddy heater which also works to keep moisture out of the propane line."", ""I have been looking for a decent little heater for my hunting blind. The fact that this one only cost me $36. and that it doubles as a cooker compelled me to try it out. I have only tested it at home but it seems to perform as described and I'm confident it will do the job I bought it for. "", 'I like the fact it heats and can also cook on it boils water fast', 'works great. i use a twenty pound bulk tank with hose but ponnd bottles are fine. ', ""Heater/ cooker works well.  Easy and puts out a good amount of heat.  Kinda large if your using for camping, and don't have a lot of packing room.  Being able to use it as a stove is a bonus.   I purchased this one and the one that attached to the larger propane tanks. Both were worth the price."", 'works great just might have to get another', 'This little heater is quick and easy to set up. A small propane canister will give you lots of heat for about 3 hours on high or 4-5hours on low setting. Great buy!!!']","New: A brand-new, unused, unopened, undamaged item in its original packaging (where packaging is applicable). Packaging should be the same as what is found in a retail store, unless the item is handmade or was packaged by the manufacturer in non-retail packaging, such as an unprinted box or plastic bag. See the seller's listing for full details. ",Mr. Heater,Propane,Portable Stoves & Burners,,,,,1,Dial,,,,,,,,,,,,,F242300,,,,,,,,,,0089301423008,0089301423008,Multicolor,,,,,,,,,,,,,,,,,,,,,,,,,,,,,,,,,,,,,,,,,,,,,,,,,,,,,,,,,,,,,,,,,,,,,,,,,,,,,,,,,,,,,,,,,,,,,,,,,,,,,,,,,,,,,,,,,,,,,,,,,,,,,,,,,,,,,,,,,,,,,,,,,,,,,,,,,,,,,,,,,,,,,,,,,,,,,,,,,,,,,,,
Comfort Zone 1200 Watt SILENT Oil-Filled Electric Safety Radiator Heater CZ7007J,70.0, ,"[""After I received this heater and plugged it in, I then sat here asking myself why I didn't get one of these sooner. Don't let the size fool you because this heater takes care of business. I live in a studio apartment and having this set at medium heat is more than enough to keep the entire apartment comfortable. It's well-built, efficient, and I'm pleased with it."", ""It was fun to build...I was surprised when, in the morning, when I got near the heater it was quite warm.I had turned it off the night before so, in truth, it has 4 settings HighMediumLowPlugged in. If you want to turn it off you must unplug it. Otherwise it's great! "", ""I'm 81 years old and have a 15 1/2 year old dog.  I had a new pellet stove that was defective and refused to work after 2 months.  Used a small gas wall unit, but needed this electric oil filled radiator in my bedroom during single digit cold temperatures to keep warm until I could get a gas furnace installed.  it fulfilled my expectations.    "", 'I am very pleased with this product.  Assembly could not have been easier.  Just involved attaching the wheels.  This item is small and unobtrusive--easy to roll out of the way and tuck into a corner and heats a small drafty room very quickly.  ', ""Great unit and works real good. These type of heaters are more efficient than the radiant infraredheaters since they only heat what's in front of them. This type of heater heats the air and is far moreefficient and cheaper in the long run. "", ""Really nice heater! A little smaller than what I expected, but otherwise it's ok! Good value for the noney"", 'Great price and works great for my children.', 'This was just what I was looking for, it’s quiet and puts out plenty of heat, the adjustment’s are very useful, the radiator part gets very hot so don’t touch!', 'I love it, so very quiet. Does a great job ', 'Light weight, simply to use good product !']","New: A brand-new, unused, unopened, undamaged item in its original packaging (where packaging is applicable). Packaging should be the same as what is found in a retail store, unless the item is handmade or was packaged by the manufacturer in non-retail packaging, such as an unprinted box or plastic bag. See the seller's listing for full details. ",comfort zone,"Oil, Electric",Portable Heater,Radiant,Floor,,"Aluminum, Steel",3,"Dial, Switch",CZ7007,120 V,Timer,,,,Steel,,,,951-1000 sq ft,14in.,CZ7007J,,14in.,9in.,,,,,,,,075877700728,Gray,,,,,,,,,,,,15 Minutes,,2016,,,,,,,,,,,,,,,,,,,,,,,,,,,,,,,,,,,,,,,,,,,,,,,,,,,,,,,,,,,,,,,,,,,,,,,,,,,,,,,,,,,,,,,,,,,,,,,,,,,,,,,,,,,,,,,,,,,,,,,,,,,,,,,,,,,,,,,,,,,,,,,,,,,,,,,,,,,,,,,,,,,,,,,,,
MR. HEATER F276497 Pack of 6,65.78,30-day returns, ,"New: A brand-new, unused, unopened, undamaged item in its original packaging (where packaging is applicable). Packaging should be the same as what is found in a retail store, unless the item is handmade or was packaged by the manufacturer in non-retail packaging, such as an unprinted box or plastic bag. See the seller's listing for full details. ",MR. HEATER,,,,,,,,,,,,,,,,,,,,,F276497,,,,,,,,,,,089301764972,,,,,,,,,,,,,,,,,,,,,,,,,,,,,,,,,,,,,,,,,,,,,,,,,,,,,,,,,,,,,,,,,,,,,,,,,,,,,,,,,,,,,,,,,,,,,,,,,,,,,,,,,,,,,,,,,,,,,,,,,,,,,,,,,,,,,,,,,,,,,,,,,,,,,,,,,,,,,,,,,,,,,,,,,,,,,,,,,,,,,,,,
 , , , ,,,,,,,,,,,,,,,,,,,,,,,,,,,,,,,,,,,,,,,,,,,,,,,,,,,,,,,,,,,,,,,,,,,,,,,,,,,,,,,,,,,,,,,,,,,,,,,,,,,,,,,,,,,,,,,,,,,,,,,,,,,,,,,,,,,,,,,,,,,,,,,,,,,,,,,,,,,,,,,,,,,,,,,,,,,,,,,,,,,,,,,,,,,,,,,,,,,,,,,,,,,,,,,,,,,,,,,,,,
Vornado Velocity 3 Space Heater w/Adjustable Thermostat Advanced Safety Features,67.99, , ,,Vornado,,Does not apply,,,,,,,,,,,,,,,,,,,,,,,,,,,,,,711181781601,White,,,,Vornado,6.24 pounds,,,,,,,,,,,,,,,,,,,,,,,,,,,,,,,,,,,China,,,,,,,,,,,,,,,,,,,,,,,,,,,,,,,,,,,,,,,,,,,,,,,,,,,,7.4 x 9 x 10.6 inches,,7.4 x 9 x 10.6 inches,,Velocity 3,5 year manufacturer,No,No,1,"Velocity 3, Owner's Guide",,,,,,,,,,,,,,,,,,,,,,,,,,,,,,,,,,,,,,,,,,,,,,,,,,,,,,,,,,,,,,,,,,,,,,,,,,,,,,,,,,
"Compact Vornado PVH Fan Heater Auto Shutoff Multi Settings Black 10.9""Dx7.9""Dx11",69.99, , ,,Vornado,Fan,Portable Heater,Electric,Floor,,Plastic,2,Touch,Vornado PVH,750 and 1500 watts,Auto Shut-off,,Electric,Does Not Apply,Does Not Apply,Does Not Apply,None,Less Than 2000 BTU,Small Area,12,Does Not Apply,3 or Less,8,11,1 gal or Less (5 L),A++ - E,,,,,,043765005873,Black,,Compliant,,,,,,,,,,,,,,,,,,,,,,,,,,,,,,,,,,,,,,,,,,,,,,,,,,,,,,,,,,,,,,,,,,,,,,,,,,,,,,,,,,,,,,,,,,,,,,,,,,,,,,,,,,,,,,,,,,,,,,,,,,,,,,,,,,,,,,,,,,,,,,,,,,,,,,,,,,,,,,,,,,,,,,,,,,,,,,,,,,,,,
3-Speed Adjust Heater Household Office Touch Button PTC Heating Cool Dual Use,69.6,30-day returns, ,"New: A brand-new, unused, unopened, undamaged item in its original packaging (where packaging is applicable). Packaging should be the same as what is found in a retail store, unless the item is handmade or was packaged by the manufacturer in non-retail packaging, such as an unprinted box or plastic bag. See the seller's listing for full details. ",Unbranded,,,,,,,,,,,,,,,,,,,,,Does Not Apply,,,,,,,,,,,Does not apply,White,,,,,,,,,,,,,,,,,,,,,,,,,,,,,,,,,,,,,,,,,,,,,,,,,,,,,,,,,,,,,,,,,,,,,,,,,,,,,,,,,,,,,,,,,,120 cm,,,,,,,,,,,,ABS + PPS,AC220V / 50HZ,,,,,,,,,,,,,,,,,,,,,,,,,,,,,,,,,,,,,,,,,,,,,,,,,,,,,,,,,,,,,,,,,,,,,,,,,,,,,,,,
DOUHE Desktop Electric Heater 600W Instant Warmer with Cold Warm Dual RF,69.37,30-day returns, ,"New: A brand-new, unused, unopened, undamaged item in its original packaging (where packaging is applicable). Packaging should be the same as what is found in a retail store, unless the item is handmade or was packaged by the manufacturer in non-retail packaging, such as an unprinted box or plastic bag. See the seller's listing for full details. ",Unbranded,See description,See description,See description,See description,,See description,See description,See description,See description,See description,See description,,See description,See description,See description,,See description,See description,See description,See description,Does Not Apply,,See description,See description,See description,See description,,,,,,,,,See description,,,,,,,,,,,See description,,,,,,,,,,,,,,,,,,,,,,,,,,,,,,,,,,,,,,,,,,,,,,,,,,,,,,,,,,,,,,,,,,,,,,,,,,,,,,,,,,,,,,,,,,,See description,See description,Tempreture Control,Supply Mini Heater,Douhe Desktop,,,,,,,,,,,,,,,,,,,,,,,,,,,,,,,,,,,,,,,,,,,,,,,,,,,,,,,,,,,,,,,,,,,,,,,,,,,
220v Electric Heater PTC Incubator Industrial Heating Element Surface Insulation,,Free shipping and returns, ,"New: A brand-new, unused, unopened, undamaged item in its original packaging (where packaging is applicable). Packaging should be the same as what is found in a retail store, unless the item is handmade or was packaged by the manufacturer in non-retail packaging, such as an unprinted box or plastic bag. See the seller's listing for full details. ",Unbranded,Electric,Electric Heater Parts,Forced Air/Fan,"Desk/Tabletop, Wall, Window",,Ceramic,1,"Digital, Push Button, Remote Control",3494641660,220 V,,,500W,None,PTC Thermistor,None,None,None,None,See picture,3494641681,None,6 in,See picture,See picture,A+++ - D,,,,,,354482671716,Multicolor,None,A++,,,,,,China,No,,Other: See Item Description,None,,2021,None,,,,,None,None,,,,,,,,,,,,,,,,,,,,,,,,,,,,,,,,,,,,,,,,,,,,,,,,,,,,,,,,,,,,,,,,,,,,,,,,,,,,,,,,,,,,,,,,,,,,,,,,,,,,,,,,,,,,,,,,,,,,,,,,,,,,,,,,,,,,,,,,,,,,,,,,,,,,,,,,,,,,,,,,,,
Lasko Portable Space Heater 500-Watt Electric Convection Tip-Over Safety Switch,68.41,Last item available,"[""With the cold grip of a long winter making the house too chilly to stay comfortable, I looked for some space heaters to help out the central A/C system. After checking out just about all of the available products on the market, I spotted the Lasko 5812 heater on Ebay- the ONLY one I could find that directs warm air into the room from the bottom of the unit at floor level. For its size, this compact ceramic heater does a good job of keeping my feet warm and taking the chill out of any room where it is employed. A bigger than expected fan motor, quiet operation and good performance makes this a 'top pick' portable heater for the price."", ""Best heater on the market, so far. Heat where ever you put it very efficiently to the point, at times, I findmyself turning it down. Have one in my room, and the bathroom, which I let my brother hold for his room, so gonna get another for the bathroom, and one for the kitchen, because we're rarely in the living room. We're able to turn the gas hear off for the entire winter, and use it only to cook and wash clothes, with agas bill of less than $40 a month. The electric is a little higher than normal due to the heater, but nowherenear what utilities would normally cost with the gas included. So yes, this heater does actually save you a lot of money in other areas. And it's extremely sturdy, with a tip over mechanism that works even if the heater is slightly tilted.  Highly recommend. "", ""This has been the very best room heater i have ever purchased it keeps the whole room very warm i can even feel it from 5 feet away constructed like a regular furnace but much smaller don't let the size fool you this little heater will put out the heat baby and i will be buying more of them if they are still in stock i would recommend the Lasko 5812 anytime. thanks guys for a great deal that was well worth every penny."", 'It is the most powerful heater I have owned. The first Lasko 5812 lasted 8 and one half years. It gives more heat on high as the duraflame cabinet heater I purchased for $100.00 this past fall. I should have bought another one of these to heat my larger room.', ""This is a great little heater. It takes the chill out of a room. It is small so it doesn't take up much room and has a safety feature which turns it off when tipped over."", 'i like that the heat comes outof the bottom at floor level . heats the room very fast.so far no problems.like the heat control thermostat.', 'great space heater! - compact, easy on-off switch and setting dial, strong flow, quiet, and best of all, even distribution of soft, warm heat. - very satisfied, AAA+. thank you.', 'Great heaters to heat rooms that you are occupying without breaking your bank account.', 'Using this in bathroom on winter mornings; does not get too hot as some can - safer to use.', 'I just got it yesterday.']","New: A brand-new, unused, unopened, undamaged item in its original packaging (where packaging is applicable). Packaging should be the same as what is found in a retail store, unless the item is handmade or was packaged by the manufacturer in non-retail packaging, such as an unprinted box or plastic bag. See the seller's listing for full details. ",Lasko,Electric,,,,,,Variable,"Dial, Switch",5812,120 V,Timer,,,,,,,,,,5812,,,,,,,,,,0046013760425,0046013760425,"Brown, Gray, Multicolor",,,,,,,,,,,,,,,,,,,,,,,,,,,,,,,,,,,,,,,,,,,,,,,,,,,,,,,,,,,,,,,,,,,,,,,,,,,,,,,,,,,,,,,,,,,,,,,,,,,,,,,,,,,,,,,,,,,,,,,,,,,,,,,,,,,,,,,,,,,,,,,,,,,,,,,,,,,,,,,,,,,,,,,,,,,,,,,,,,,,,,,
"Mr. Heater 15,000 BTU Propane Heater/Cooker Safety Shut-Off 3 Settings Radiant",65.99, ,"['I just replaced this unit after my other unit failed after 40 years.  Most products don’t make it 4 years.  I use it ice fishing for warm lunches, in the ice hut for warmth, tent while hunting for a quick morning coffee and in my truck emergency provisions for driving and living in the high Colorado mountains.  As with any propane product, always properly ventilate and don’t fall asleep while in use.', ""Just used it once briefly and seemed to light easily and generate solid radiant heat for a 1lb cylinder heater.  Nice to have the convertible stand for cooking too but haven't tried that and may not."", 'Got this to heat my ice fishing shelter.. It works great and the three settings make it easy to regulated the temperature', ""We bought this heater for our grandson to use in his deer blind. We have several of these and I and my wife set together in a pop-up blind in any weather and have nothing bad to say about this heater. It allows us to cook lunch make coffee and tea which makes for memorable occasion's.I have had issues in the past with this heater and moisture in the propane hose, I use a Mr. Heater in line filter and have eliminated the problem. this is not and isolated issue with this heater as Mr. Heater recommends the inline filter with the big buddy heater which also works to keep moisture out of the propane line."", ""I have been looking for a decent little heater for my hunting blind. The fact that this one only cost me $36. and that it doubles as a cooker compelled me to try it out. I have only tested it at home but it seems to perform as described and I'm confident it will do the job I bought it for. "", 'I like the fact it heats and can also cook on it boils water fast', 'works great. i use a twenty pound bulk tank with hose but ponnd bottles are fine. ', ""Heater/ cooker works well.  Easy and puts out a good amount of heat.  Kinda large if your using for camping, and don't have a lot of packing room.  Being able to use it as a stove is a bonus.   I purchased this one and the one that attached to the larger propane tanks. Both were worth the price."", 'works great just might have to get another', 'This little heater is quick and easy to set up. A small propane canister will give you lots of heat for about 3 hours on high or 4-5hours on low setting. Great buy!!!']","New: A brand-new, unused, unopened, undamaged item in its original packaging (where packaging is applicable). Packaging should be the same as what is found in a retail store, unless the item is handmade or was packaged by the manufacturer in non-retail packaging, such as an unprinted box or plastic bag. See the seller's listing for full details. ",Mr. Heater,Propane,Radiant,,,,,1,Dial,F242300,,"Cooker, Safety Shut-Off, 3 Heat Settings",,,,,,,15000 BTU,,,F242300,,,,,,,,,,089301423008,089301423008,Chrome,,,,,3.5 lbs,,,,No,,,,,,,,,,,,,,,,,,,,,,,,,,,,,,,,,,,,,,,,,,,,,,,,Outdoor,,,,,,,,,,,,,,,,,,,,,,,,,,,,,,,,,,,,,,,,,,,,,,,,,,,,Propane,,,,,,,,,,,,,,,,,,,,,,,,,,,,,,,,,,,,,,,,,,,,,,,,,,,,,,,,,,,,,,,,,,,,,,,,,,
"Isphording REMOTE CONTROL FOR INFRARED, BBQ, FIREPLACE LOGS, HEATER ???",68.0, , ,"Used: An item that has been used previously. The item may have some signs of cosmetic wear, but is fully operational and functions as intended. This item may be a floor model or store return that has been used. See the seller’s listing for full details and description of any imperfections. ",Isphording,Battery,Remote Control Replacement Part,,,,,,Remote Control,,,,,,,,,,,,,,,,,,,,,,,,Does Not Apply,Black,,,,,,,,,,,,,,,,,,,,,,,,,,,,,,,,,,,,,,,,,,,,,,,,,,,,,,,,,,,,,,,,,,,,,,,,,,,,,,,,,,,,,,,,,,,,,,,,,,,,,,,,,,,,,,Remote Control,,,,,,,,,,,,,,,,,,,,,,,,,,,,,,,,,,,,,,,,,,,,,,,,,,,,,,,,,,,,,,,,,,,,,,,,,
Honeywell EnergySmart Cool Touch Oscillating Portable Compact Tower Heater Black,65.4,Last item available, ,"New: A brand-new, unused, unopened, undamaged item in its original packaging (where packaging is applicable). Packaging should be the same as what is found in a retail store, unless the item is handmade or was packaged by the manufacturer in non-retail packaging, such as an unprinted box or plastic bag. See the seller's listing for full details. ",Unknown,,Does not apply,,,,,,,HZ7300,,,,,,,,,,,,HZ7300,,,,,,,,,,0313055669697,313055669697,Black,,,HZ7300,Honeywell,,,,,,,,,,,,Does not apply,,,,,,,,,,,,,,,,,,,,,,,,,,,,,,Electric,,,Indoor,,,,,,,,,,,,,,,,,,,,,,,,,,,,,,,,,,,,,,,,,,,,,,,,,,,,,,,,,,,,,,,,,,,,,,,,,,,,,,,,,,,,,,,,,,,,,,,,,,,,,,,,,,,,,,,,,,,,,,,,,,,,,,,,,,,,,,
Electric Heater 1500-Watt Quartz Radiant Heating Adjustable Thermostat Black,65.59,30-day returns,"[""This a very cost effective space heater to warm any area during a chilly winter, or - as we had during the early part of the Wisconsin spring - a slightly nippy start to spring. It works to warm a bedroom, normal sized living room (unsure of those with an open plan large setting), or a small area of a basement that you are working in. It has three settings, and has tip-over &amp; overheat protection. I like this product an awful lot, and thus I'll give it 4.5 stars. It does NOT have a remote, but I bought a separate one for that purpose. I am taking a half of a star off because EVEN though it does have tip over protection (meaning it shuts off in that case), it is slightly more easy to tip over than I thought it was. So if you have pets, it might NOT be the BEST idea to use it when they are out playing - NOT so much for safety sake, but to prevent your fur baby from getting injured stepping on it."", 'Works very well and set up takes only a few minutes...', ""This will be my last one. The last one I bought. Lasted one heating season.then quit. Everyone I've ever bought.never makes it through 2 heating season.and I've bought several.over the years. I'm done."", 'I am very happy with this portable heater it works awesome and provides heat to my bedroom, it feels confortable now, thanks so muchGreat Product at a nice PriceTotally Recommended', ""I've bought two of these heaters .Two years in a row . I live in Florida the winters aren't that long . The first one tipped over started making a loud rattling noise .Sent it back to manufacter to repair or replace according to warranty. Never heard from them .Second heater just stopped working I don't  know why .How ever when a pinch and finances are limited .I guess it will have to do .Survivor"", 'Has operated as advertised with one exception. The thermostat doesn’t function properly. It may be a problem with this unit only, difficult to say. This is not a deal breaker for me, only do to the way it’s used. ', 'This is a smaller version and much louder than the one I have ""like"" it, however it works ok, just not as elegantly because the fan even on low is VERY loud.. (great for passive aggressive people...) or loud locations anyway...sounds like a muffled vacuum cleaner.. ', 'Solid heat..Twice the cost of what the CZ550 1500w used to be but has increased to be in just a year &amp; only lasts 1 year or more if used daily during the cold season; so will see how long this model lasts with the same use. ', 'Was used, no just open box as stated.  Works fine but has something melted on the top.', 'I like the safety features and it can fit in just about any room and look nice.']","New: A brand-new, unused, unopened, undamaged item in its original packaging (where packaging is applicable). Packaging should be the same as what is found in a retail store, unless the item is handmade or was packaged by the manufacturer in non-retail packaging, such as an unprinted box or plastic bag. See the seller's listing for full details. ",comfort zone,Electric,"Tower Heater, Radiant Quartz Heater",Radiant,"Under Desk, Desk/Tabletop",,"Ceramic, Plastic, Metal",2,"Rotary Knob, Switch, Touch, Analog/Mechanical",CZQTV007BK,12 V,"Nonslip Base, Portable, COMFORT ZONE CZQTV007BK 1,500-Watt Radiant Quartz Tower Heater, Thermostat, Automatic Shutoff,Nonslip Base, Heater, Oscillation, Automatic Shutoff, Indoor, Quartz, Adjustable Thermostat",,1500 W,,,,,,Large,13.50 in,CZQTV007BK,,,23.60 in,,,,,,,0075877251473,0075877251473,Black,,,,,,,,,,,,15 Minutes,Infrared,,,Does not apply,,,,,,,,,,,,,,,,,,,,,,,,,,,Quartz,,,,,,,,,,,,,Large,Indoor,12.5 in,"Handle,Thermostat",1500 W,Blacks,800,Dial,7.5 in,,ETL Listed,"Cool-to-the-Touch,Tip-Over Safety Switch",23.4 in,,,Electric,6.2 lb,,,,,5120,,12.5 in,,,,,,,,,,,,,,,,,,,,,,,,,,,,,,,,Freestanding,1,,,,,,,,,,,,,,,,,,,,,,,,,,,,,,,,,,,,,,,,,,,,,,,,,,,,,,,,,,,,,,,,,,,,,,,
Vintage Dearborn Gas Heater Ceramic Brick Surround Ceramic Surround,65.0,8 watchers, ,"Used: An item that has been used previously. The item may have some signs of cosmetic wear, but is fully operational and functions as intended. This item may be a floor model or store return that has been used. See the seller’s listing for full details and description of any imperfections. ",Dearborn,,,,,,,,,,,,,,,,,,,,,,,,,,,,,,,,,,,,,,,,,,,,,,,,,,,,,,,,,,,,,,,,,,,,,,,,,,,,,,,,,,,,,,,,,,,,,,,,,,,,,,,,,,,,,,,,,,,,,,,,,,,,,,,,,,,,,,,,,,,,,,,,,,,,,,,,,,,,,,,,,,,,,,,,,,,,,,,,,,,,,,,,,,,,,,,,,,,,,,,,,,,,,,,,,,,,,,,,
