Title,Price,Sold,Reviews,Condition,Brand,Type,Features,Power (W),MPN,EAN,Heating Element Format,Model,Colour,Control Type,Custom Bundle,Location,Manufacturer Colour,Modified Item,Width,Size,UPC,Non-Domestic Product,Material,Power Source,Mounting Location,Number of Heat Settings,Area Covered,Power,Control Style,Heating Element Material,Height,Depth,Heating System,Voltage,Color,Assembled Product Dimensions (L x W x H),Power Type,Manufacturer Part Number,Recommended Location,Assembled Product Weight,Manufacturer,ISBN,Timer Control,Item Length,Smart Home Protocol,Item Width,Bundle Listing,Unit Quantity,Unit Type,Bundle Description,Country/Region of Manufacture,Customized,Item Weight,Modification Description,Motorized,Personalized,Cable Length,Year Manufactured,Design,Voltage Supply,Item Depth,Operating Sound Rating,Annual Fuel Utilization Efficiency (AFUE),Air Direction,Number of Cool Speeds,Heating Technology,BTU Heating Rating,Room Coverage Area,Energy Star,Tank Capacity,Energy Efficiency Ratio (EER),Style,Noise Level,Manufacturer Color,OutOfStockControl,Item Height,Prop65_fl,Prop65Warning,Current Rating,Manufacturer Warranty,Connectivity,Product Weight (lb.),Power/Fuel Type,Product Width (in.),Indoor/Outdoor,Amperage (amps),Room Size,Portable Heater Features,Product Depth (in.),Area Heated (Sq. Ft.),Wattage (watts),Heater Type,Product Height (in.),Portable Heater Safety Features,Cord Length (in.),Voltage (volts),Heater Controls,Smart Home Compatibility,Heating Method,Item Dimensions LxWxH,Assembled Height (Inches),Use Location,Current Rating (Amps),Lowe's Exclusive,Energy Saving Setting,Thermostat,Warranty,EC Range,Manufacturer Color/Finish,Anti-Freeze Setting,Remote Control Included,Portable,Timer,Package Quantity,Series Name,CA Residents: Prop 65 Warning(s),Suitable for Safe Rooms,Wattage,Application,Certifications,Clearance,Heating Wattage,Maintained Operational Temperature,Recommended Environment,Remote Control,Compressive strength,Power deviation,Cable length,Product Name,Thickness,Shipping,Heat Output,Country of Origin,Compatible Brand,Voltage / Wattage / Amperage,Poultry Species,Hatching Egg Breed,Built In Thermostat,Clearance to Combustible Materials,Product Color / Weight,Product Dimensions,Programmable Timer,Remote Control / In-Cord Switch,RESTOCK FEE,Heating BTU,Tonnage,Product Width (in),Cord Length (in),Area Heated (Sq Ft),Heat rating (BTU/hour),Pack Size,Product Height (in),Color Family,globalTradeItemNumber (GTIN),Product Weight (lb),Certifications and Listings,Product Depth (in),Power consumption,Product weight,Heater type,Fins width,Package includes,Oil volume,Power supply,Indoor/outdoor,Item model number,Warranty Description,Department,Finish Types,Number of Pieces,Volume,Is Discontinued By Manufacturer,Batteries Required,Import Designation,item_length,item_width,Accessory Type,Use,Price,Seller,Returns,Service,Satisfaction,USA Shipping,Customer service,Shipping Exclusions,Topic,Language,Age Level,Refrigerant,PackQty,Compressor Type,style,Heater Style,Date Made,Dimensions,Features 1,Features 2,Source,2 heat settings,Carry Handle,Mount Location,Product Length (in),Bulb Type,Number of Elements,Energy Rating,manufacturer_part_number,Origin,Certification,Model Number,Insulation,Pattern Name,Battery Capacity,Battery Life,Weight,Length,Number of Batteries,Battery Size,Battery Included,Motor Type,SKU,StoreCategoryID,Output Power,Gift,Hight,UPC/GTIN Code,Mor Electric Heating SKU,Assembly Required,Firmness,Mount Type,Number of Items in Set,Product,Set Includes,Binding,Studio,Publisher,ProductTypeName,ProductGroup,PackageQuantity,NumberOfItems,Label,Model No.,Application/Usage,Area Coverage,Form Factor,Heating Element,Input Current,Input Voltage,Maximum Heat Power,Oscillation,Power Consumption,Product Model,Product Type,Weight (Approximate),Time Control,Room,Contents of the package,Rated power,Direction adjustment,Power cord length,brand name,Heating method,Overall Height,Overall Width,Heating Element Type,Cord Length,Plug Type,UL Listing,Minimum Heat Power,Baseboard Heating Type,Hydronic,Heating Technology Type,Vented,Heating Product Type,Home Decor Style,Price Per Unit UOM,Fuel Type,Count Per Pack,Country of Origin - Textiles,Finish,Is Portable,Count,Age Group,Color Category,Contained Battery Type,Recommended Use,PPU Quantity of Units,Piece Count,"Cleaning, Care & Maintenance",Shape,Maximum Room Size,Power Options
Portable 7 Fin 1500w Electric OIL FILLED RADIATOR Heater With 24 Hour Timer,56.99,766 sold,"[""I love this radiator it's very portable smart looking simple to use and gives out a great heat perfect for every room in the house of medium size the thermostat is a very good feature I certainly recommend this to anyone and I love the colour "", 'I had been looking for an heater for my kitchen, most seem to have been 2kw or 3kw, which was more than I needed, then I saw this with it only being 1.5kw with the flexibility to be 900w or 600w  and with both a thermostat and 24h control, it fitted my needs perfectly, also thinking it was white in colour,  it was nice to find it was grey in colour.', ""I used to have a smaller one of these, by a different brand which quite frankly doesn't do the job unless you are in a box room, so bought one of these and I was really impressed with how quickly it heated the room. I wouldn't say it was overly hot but it made the room to at least a comfortable temperature. "", ""What I like most about his is:1a) it is a colour1b) it is red. Why do we not have a whole rainbow of colours for this type of heater?2) it gives out a hefty amount of heat. I have only ever needed to use it at the lowest setting to heat my bathroom.3) It has character. The design of this heater actually adds to the interest of the room. It doesn't try to be a hidden addition.Warning! - It creaks and clicks while it is heating up, so be aware of this if you are a light sleeper and it is close to your bed. Update - now I've used it daily for 2½ months, it seems to have completely stopped clicking and ticking."", 'Very good, gives adjustable heat and pretty quick,  for a small rad it is surprisingly good.  Great features also, and easy to manoeuvre by carrying or wheeling.    ', 'A Quality Product at a Bargain Price.  Minimal Assembly needed to fix Castors - everything just screws on with fingers, not even a Screwdriver required.  It is painted a Beautiful Ferrari Red &amp; totally Portable.   Having a Timer is a great Extra &amp; it throws out a lot of Heat - my 15 year old Cat Loves it &amp; is currently curled-up in front of it, fast asleep.  Ideal for Large Rooms.  I would Recommend it very highly indeed.', ""I really recommend it to anyone who needs a radiator It is so good and easy to use It won't burn any of your furniture or clothes as long as you don't use it uv"", 'good heater', 'Easy to set up and use, great heater for a camper van :}', 'No more coming home to a cold room. Thought I’d be put off with the fact it’s red, but my rooms not cold no more &amp; my bills gone down since I replaced this with the electric fan. ']","New: A brand-new, unused, unopened, undamaged item in its original packaging (where packaging is applicable). Packaging should be the same as what is found in a retail store, unless the item is handmade or was packaged by the manufacturer in non-retail packaging, such as an unprinted box or plastic bag. See the seller's listing for full details. ",ULTRA MAX,Oil-Filled Radiator,"Overheat Protection, Portable, Thermostat, Timer",1500,HTRUMXOR02T-7,Does not apply,,,,,,,,,,,,,,,,,,,,,,,,,,,,,,,,,,,,,,,,,,,,,,,,,,,,,,,,,,,,,,,,,,,,,,,,,,,,,,,,,,,,,,,,,,,,,,,,,,,,,,,,,,,,,,,,,,,,,,,,,,,,,,,,,,,,,,,,,,,,,,,,,,,,,,,,,,,,,,,,,,,,,,,,,,,,,,,,,,,,,,,,,,,,,,,,,,,,,,,,,,,,,,,,,,,,,,,,,,,,,,,,,,,,,,,,,,,,,,,,,,,,,,,,,,,,,,,,,,,,,,,,,,,,,,,,,,,,,,,,,,
Bitzong Ceramic Heater Energy Saving Electric Swing Portable Home Office Camper,98.95,100 sold, ,New,Bitzong,Fan Heater,"Automatic Shut-Off, Cool-Touch Exterior, Humidity Resistant, Oscillating, Overheat Protection, Portable, Power Indicator",,HA0001B,,ceramic,HA0001BK,Black,Thermostat,No,Bedroom,Black,No,125mm,1.1kg,600158371818,No,Metal/Plastic,Electric,"Desk/Tabletop, Floor",2,11 - 20 sq m,801-900 W,Switch,Ceramic,205mm,125mm,Forced Air/Fan,240,,,,,,,,,,,,,,,,,,,,,,,,,,,,,,,,,,,,,,,,,,,,,,,,,,,,,,,,,,,,,,,,,,,,,,,,,,,,,,,,,,,,,,,,,,,,,,,,,,,,,,,,,,,,,,,,,,,,,,,,,,,,,,,,,,,,,,,,,,,,,,,,,,,,,,,,,,,,,,,,,,,,,,,,,,,,,,,,,,,,,,,,,,,,,,,,,,,,,,,,,,,,,,,,,,,,,,,,,,,,,,,,,,,,,,,,,,,,,,,,,,,,,,,,,,,,,,,,,,
"Vornado Heat, VH5, Black, Personal Vortex Heater",74.99, , ,"New: A brand-new, unused, unopened, undamaged item in its original packaging (where packaging is applicable). Packaging should be the same as what is found in a retail store, unless the item is handmade or was packaged by the manufacturer in non-retail packaging, such as an unprinted box or plastic bag. See the seller's listing for full details. ",Vornado Heat,Portable Heater,,,EH1-0133-06,,,Vornado VH200,,,,,,,,,043765011935,,,,,,,,,,,,,,Black,,,,,,,,,,,,,,,,,,,,,,,,,,,,,,,,,,,,,,,,,,,,,,,,,,,,,,,,,,,,,,,,,,,,,,,,,,,,,,,,,,,,,,,,,,,,,,,,,,,,,,,,,,,,,,,,,,,,,,,,,,,,,,,,,,,,,,,,,,,,,,,,,,,,,,,,,,,,,,,,,,,,,,,,,,,,,,,,,,,,,,,,,,,,,,,,,,,,,,,,,,,,,,,,,,,,,,,,,,,,,,,,,,,,,,,,,,,,,,,,,,,,,,,,,,,,,,,,,
RINNAI PANEL HEATER P Series 2200W LIKE NEW RRP $269 + FREE SURGE PLUG,99.99, , ,Used,Rinnai,Portable Heater,"Auto Shut-off, Timer",,,,,Rinnai PEPH22PEW,,,,,,,,,,,,Electric,"Floor, Wall",,,,,,,,Panel,,,,,,,,,,,,,,,,,,,,,,,,,,,,,,,,,,,,,,,,,,,,,,,,,,,,,,,,,,,,,,,,,,,,,,,,,,,,,,,,,,,,,,,,,,,,,,,,,,,,,,,,,,,,,,,,,,,,,,,,,,,,,,,,,,,,,,,,,,,,,,,,,,,,,,,,,,,,,,,,,,,,,,,,,,,,,,,,,,,,,,,,,,,,,,,,,,,,,,,,,,,,,,,,,,,,,,,,,,,,,,,,,,,,,,,,,,,,,,,,,,,,,,,,,,,,,,,,,,,
Electric Radiant Tower Heater 1500W For Indoor Use Small Room Office Portable US,70.99,30-day returns,"[""This a very cost effective space heater to warm any area during a chilly winter, or - as we had during the early part of the Wisconsin spring - a slightly nippy start to spring. It works to warm a bedroom, normal sized living room (unsure of those with an open plan large setting), or a small area of a basement that you are working in. It has three settings, and has tip-over &amp; overheat protection. I like this product an awful lot, and thus I'll give it 4.5 stars. It does NOT have a remote, but I bought a separate one for that purpose. I am taking a half of a star off because EVEN though it does have tip over protection (meaning it shuts off in that case), it is slightly more easy to tip over than I thought it was. So if you have pets, it might NOT be the BEST idea to use it when they are out playing - NOT so much for safety sake, but to prevent your fur baby from getting injured stepping on it."", 'Works very well and set up takes only a few minutes...', ""This will be my last one. The last one I bought. Lasted one heating season.then quit. Everyone I've ever bought.never makes it through 2 heating season.and I've bought several.over the years. I'm done."", 'I am very happy with this portable heater it works awesome and provides heat to my bedroom, it feels confortable now, thanks so muchGreat Product at a nice PriceTotally Recommended', ""I've bought two of these heaters .Two years in a row . I live in Florida the winters aren't that long . The first one tipped over started making a loud rattling noise .Sent it back to manufacter to repair or replace according to warranty. Never heard from them .Second heater just stopped working I don't  know why .How ever when a pinch and finances are limited .I guess it will have to do .Survivor"", 'Has operated as advertised with one exception. The thermostat doesn’t function properly. It may be a problem with this unit only, difficult to say. This is not a deal breaker for me, only do to the way it’s used. ', 'This is a smaller version and much louder than the one I have ""like"" it, however it works ok, just not as elegantly because the fan even on low is VERY loud.. (great for passive aggressive people...) or loud locations anyway...sounds like a muffled vacuum cleaner.. ', 'Solid heat..Twice the cost of what the CZ550 1500w used to be but has increased to be in just a year &amp; only lasts 1 year or more if used daily during the cold season; so will see how long this model lasts with the same use. ', 'Was used, no just open box as stated.  Works fine but has something melted on the top.', 'I like the safety features and it can fit in just about any room and look nice.']","New: A brand-new, unused, unopened, undamaged item in its original packaging (where packaging is applicable). Packaging should be the same as what is found in a retail store, unless the item is handmade or was packaged by the manufacturer in non-retail packaging, such as an unprinted box or plastic bag. See the seller's listing for full details. ",comfort zone,"Tower Heater, Radiant Quartz Heater","Nonslip Base, Portable, COMFORT ZONE CZQTV007BK 1,500-Watt Radiant Quartz Tower Heater, Thermostat, Automatic Shutoff,Nonslip Base, Heater, Oscillation, Automatic Shutoff, Indoor, Quartz, Adjustable Thermostat",,CZQTV007BK,0075877251473,,CZQTV007BK,,,,,,,,,0075877251473,,"Ceramic, Plastic, Metal",Electric,"Under Desk, Desk/Tabletop",2,Large,1500 W,"Rotary Knob, Switch, Touch, Analog/Mechanical",,,,Radiant,12 V,Black,12.50 x 8.30 x 22.80 Inches,Electric,CZQTV007BK,Indoor,6.6 lb,World and Main,Does not apply,15 Minutes,23.60 in,Infrared,13.50 in,,,,,,,,,,,,,,,,,,,,,,,,,,,,,,,,,,,,,,,,,,,,,,,,,,,,,,,,,,,,,,,,,,,,,,,,,,,,,,,,,,,,,,,,,,,,,,,,,,,,,,,,,,,,,,,,,,,,,,,,,,,,,,,,,,,,,,,,,,,,,,,,,,,,,,,,,,,,,,,,,,,,,,,,,,,,,,,,,,,,,,,,,,,,,,,,,,,,,,,,,,,,,,,,,,,,,,,,,,,,,,,,,,,,,,,,,,,,,,,,,,,,,,
Far Infrared Heater Panel Picture. Portable Heater 450W. Heating area 8-12m2.,54.0,814 sold, ,"New: A brand-new, unused, unopened, undamaged item in its original packaging (where packaging is applicable). Packaging should be the same as what is found in a retail store, unless the item is handmade or was packaged by the manufacturer in non-retail packaging, such as an unprinted box or plastic bag. See the seller's listing for full details. ",Unbranded,Infrared,"Portable, Wall-Mountable",450W,Does Not Apply,,,,transparent,,,,,,,,,,,Electric,Wall,,,,,,,,Infrared,,,,,,,,,,,,,,Yes,1,kg,,,,,,,,,,,,,,,,,,,,,,,,,,,,,,,,,,,,,,,,,,,,,,,,,,,,,,,,,,,,,,,,,,,,,,,,,,,,,,,,,,,,,,,,,,,,,,,,,,,,,,,,,,,,,,,,,,,,,,,,,,,,,,,,,,,,,,,,,,,,,,,,,,,,,,,,,,,,,,,,,,,,,,,,,,,,,,,,,,,,,,,,,,,,,,,,,,,,,,,,,,,,,,,,,,,,,,,,,,,,,,,,,,,,,,,,,,,,,,,,,,,
Mr. Heater MH4GC 4000 BTU Radiant Propane Portable Golf Cart Cup Holder Heater,73.29,281 sold,"['the actual heater is great. Easy to use and works every time. Problem is with the lower portion that fits into the cup holder. Entire unit is extremely top heavy and can very easily tip out of the cup holder. The fit into the cup holder in my club car golf car is loose and poorly designed. I would not reccomend this item.', 'Have bought 3 different style heaters in 3 years to use golfing (with cart covers) and this Mr. Heater unit is the best. Regarding cost, starting ease, overall warmth, and quality construction this is by far the best heater on the market. Four players in my gaggle of friends (playing in the winter) own this unit and are thoroughly pleased with its performance and durability. If you winter golf, Buy It!', 'I last owned a Coleman brand Golf Cart Heater....it lasted about 10 years and finally died. I purchased this MH4GC unit next and it is not as good as the Coleman unit, but the Coleman unit is no longer made, so I\'m stuck with this one. Couple of issues...first and foremost, this heater is way top heavy so it will NOT stay put in a golf cart cup holder...the slightest bump and it flies right out of the cart\'s cup holder and if it lands on a person, they will get burned....I know, because it happened to me! I now have it ""tied"" in place with a bungee cord when I use it. No way could the manufacturer have tested this properly...my golf carts are 2017 model electric EZ Go Golf Carts. Second, there is no variable control on the heat...it\'s either wide open or shut off. I\'m not crazy about that, it does consume fuel at a higher rate than one with an adjustable propane flow valve, but you\'re compelled to live with it if you want heat. If I can find another option when this one dies, I will undoubtedly try it.', ""Pretty simple to operate. Screw in 1 lb camper gas canister, press 'on' button a couple of times until it lights and you have heat. To turn it off hit the 'off' button. I ordered it for use in a golf cart.  Nothing to put together other than putting the canister into the holder and setting it into a cup holder."", ""I had to ding this product because the poorly designed tip-over switch defeats the premise of the product.At even the tiniest bump in the cart path or fairway this heater turns itself off -- you will have to re-light 30+ times per round.It's a shame because it does put out nice heat and is otherwise effective and generally a fair price.The manufacturer missed the mark here."", 'Used it in my side by side this past week while hunting. Takes the rocky roads really well, the stiff north wind did blow it out a couple of times while driving around but overall it worked really well. I would recommend it and it really helps keep you warm while driving around the deer lease.', 'This heater works great in a covered cart, in fact it can get too warm, even when the outside temps  are in upper 30s and lower 40s.  In an open cart you feel the heat when the cart is stationery, however when moving or winds over 10 mph you can feel the heat.  The holder works in the smaller cart cup.Suggest they need to have an adjustable temp knob.All in all, I like the Mr. Heater portable golf cart heater.   ', ""I have something similar to this in my shop, but they are bigger, but when they heat up the screens glow orange, this little one doesn't do that so I thought it wasn't working correctly. But if you do like the instructions say and make sure the pilot is lit. Then leave it alone it will start producing heat. "", ""Mr. Heater that I got was brand new and worked great.  I even got it 1 day earlier than expected.  I've already used it 3 times and it has worked great!"", ""I read all the reviews I could find on this heater before purchase, so expected a good product.  It had to sit under the tree for a few days but Christmas morning it was installed in the cart!  It has been out on one excursion and all the guys wanted to 'ride in the warm cart'.  The hubbby is more than pleased!It sits steady in the front cup holder, is cool to the touch on all sides (well not the front of course), and works instantly!  More than pleased hubby here...........""]","New: A brand-new, unused, unopened, undamaged item in its original packaging (where packaging is applicable). Packaging should be the same as what is found in a retail store, unless the item is handmade or was packaged by the manufacturer in non-retail packaging, such as an unprinted box or plastic bag. See the seller's listing for full details. ",Mr. Heater,Propane,,,F242010,0089301000223,,MH-F242010,,,No,,,No,,,0089301000223,,Plastic,Propane,,1,,,Switch,,,,Radiant,,Black,,,,,,,,,37.5 in,,,,,,No,Unknown,No,5.95 lb,No,Yes,No,0in.-14in.,1998,,,,,,,,,,,,,,,,,,,,,,,,,,,,,,,,,,,,,,,,,,,,,,,,,,,,,,,,,,,,,,,,,,,,,,,,,,,,,,,,,,,,,,,,,,,,,,,,,,,,,,,,,,,,,,,,,,,,,,,,,,,,,,,,,,,,,,,,,,,,,,,,,,,,,,,,,,,,,,,,,,,,,,,,,,,,,,,,,,,,,,,,,,,,,,,,,,,,,,,,,,,,,,,,,,,,,,,,,,,,,,,,,,,,,,,,,,
Pro-Com Propane Heater 10000 BTU model ML100HPA tested,74.95, , ,"Used: An item that has been used previously. The item may have some signs of cosmetic wear, but is fully operational and functions as intended. This item may be a floor model or store return that has been used. See the seller’s listing for full details and description of any imperfections. ",Pro-Com,,,,,,,,,,,,,,,,,,,Propane,,,,,,,,,,,,,,,,,,,,,,,,,,,,,,,,,,,,,,,,,,,,,,,,,,,,,,,,,,,,,,,,,,,,,,,,,,,,,,,,,,,,,,,,,,,,,,,,,,,,,,,,,,,,,,,,,,,,,,,,,,,,,,,,,,,,,,,,,,,,,,,,,,,,,,,,,,,,,,,,,,,,,,,,,,,,,,,,,,,,,,,,,,,,,,,,,,,,,,,,,,,,,,,,,,,,,,,,,,,,,,,,,,,,,,,,,,,,,,,,,,,,,,,,,,,,,,,,,,,,,,,,,,,,
28X28CM 600W@220V KEENOVO Silicone Heater Cube 3D Printer Heated Bed Plate Pad,57.14,9 watchers, ,"New: A brand-new, unused, unopened, undamaged item in its original packaging (where packaging is applicable). Packaging should be the same as what is found in a retail store, unless the item is handmade or was packaged by the manufacturer in non-retail packaging, such as an unprinted box or plastic bag. See the seller's listing for full details. ",KEENOVO,,,,K28002800600220NP,603629512390,,,,,,,,,,,,,,,,,,,,,,,,,,,,,,,,,,,,,,,,,,,,,,,,,Custom Design Welcome,"120V available, 220V by default",,,,,,,,,,,,,,,,,,,,,,,,,,,,,,,,,,,,,,,,,,,,,,,,,,,,,,,,,,,,,,,,,,,,,,,,,,,,,,,,,,,,,,,,,,,,,,,,,,,,,,,,,,,,,,,,,,,,,,,,,,,,,,,,,,,,,,,,,,,,,,,,,,,,,,,,,,,,,,,,,,,,,,,,,,,,,,,,,,,,,,,,,,,,,,,,,,,,,,,,,,,,,,,,,,,,,,,,,,,,,,,,,,,,,,,,
METRO Replacement Heater for Kotatsu Table U-shaped quartz tube MSU-501H (K),70.47,Free shipping and returns,"['Great heating performance even for a large table. Easy to install and use.', 'If you want to make your own Kotatsu I defenitly recommend getting this. Make sure to read the instructions and take note of all of the warnings, though they are all pretty common sense. Would recommend :)￼', 'I have been using this Metro replacement heater for more than 10 years, and it has been trouble free, and electrioc bill is so low.   I deeply appreciated.', 'The kotatsu heater was exactly what I needed. It shipped super fast and works perfectly!', 'It works.', 'Es un muy buen producto, funciona a la perfección y de muy buena calidad']","New: A brand-new, unused, unopened, undamaged item in its original packaging (where packaging is applicable). Packaging should be the same as what is found in a retail store, unless the item is handmade or was packaged by the manufacturer in non-retail packaging, such as an unprinted box or plastic bag. See the seller's listing for full details. ",Metro Electric Industry,U-shaped quartz tube heater,Replacement heater for  kotatsu,,B01K1NPSDY,,,MSU-501H (K),,,,,,,,,4948309101430,,,Electric,,,,510W,Dial,,,,,AC100V,Black,,,,,,,,,29cm,,29cm,,,,,,,,,,,,,,,4.1cm,None,,,,,,,,,,,,,,,,,,,,,,,,,,,,,,,,,,,,,,,,,,,,,,,,,,,,,,,,,,,,,,,,,,,,,,,,,,,,,,,,,,,,,,,,,,,,,,,,,,,,,,,,,,,,,,,,,,,,,,,,,,,,,,,,,,,,,,,,,,,,,,,,,,,,,,,,,,,,,,,,,,,,,,,,,,,,,,,,,,,,,,,,,,,,,,,,,,,,,,,,,,,,,,,,,,,,,,,,,,,,,,,,,,,,,,
"SEALEY Propane GAS Bottle Mounted Space Warmer Heater,10,250-15,354 Btu/hr LP13",73.21,30-day returns, ,"New: A brand-new, unused, unopened, undamaged item in its original packaging (where packaging is applicable). Packaging should be the same as what is found in a retail store, unless the item is handmade or was packaged by the manufacturer in non-retail packaging, such as an unprinted box or plastic bag. See the seller's listing for full details. ",Sealey,,,,LP13,5024209328708,Coil,,,,,,,,,,Does not apply,,,Propane,"Baseboard, Wall, Floor",2,,Less Than 10 W,"Rotary Knob, Analog/Mechanical",Brass,,,Boiler,12 V,Silver,,,,,,,,,,,,,,,,,,,,,,,2000,,,,None,Less Than 80%,1-Way,1,Infrared,Less Than 2000 BTU,,,,,,,,,,,,,,,,,,,,,,,,,,,,,,,,,,,,,,,,,,,,,,,,,,,,,,,,,,,,,,,,,,,,,,,,,,,,,,,,,,,,,,,,,,,,,,,,,,,,,,,,,,,,,,,,,,,,,,,,,,,,,,,,,,,,,,,,,,,,,,,,,,,,,,,,,,,,,,,,,,,,,,,,,,,,,,,,,,,,,,,,,,,,,,,,,,,,,,,,,,,,,,,,,,,,,,,,,,,,,,,,,
"Hylite Ecoheaters 1ft 45W, 2ft 80W, 3ft 135W, 4ft 180W, 5ft 225W, 6ft 270W ",15.1,150 sold, ,"New: A brand-new, unused, unopened, undamaged item in its original packaging (where packaging is applicable). Packaging should be the same as what is found in a retail store, unless the item is handmade or was packaged by the manufacturer in non-retail packaging, such as an unprinted box or plastic bag. See the seller's listing for full details. ",Hylite Ecoheaters,Tubular Heater,,,,,,Hylite Ecoheaters,White,,,"Greenhouse, Kennel, Shed, Caravan, Garage, Greenhouse",,,,,,,Steel,Electric,"Floor, Wall",1,,,Plug In,,,,Immediate Area,240 V,,,,,,,,,,,,,,,,,,,,,,,,,,,,,,,,,,,,,,,,,,,,,,,,,,,,,,,,,,,,,,,,,,,,,,,,,,,,,,,,,,,,,,,,,,,,,,,,,,,,,,,,,,,,,,,,,,,,,,,,,,,,,,,,,,,,,,,,,,,,,,,,,,,,,,,,,,,,,,,,,,,,,,,,,,,,,,,,,,,,,,,,,,,,,,,,,,,,,,,,,,,,,,,,,,,,,,,,,,,,,,,,,,,,,,,,,,,,,,,,,,,,,,,,,,,,,,,,,,
