LASKO 5775 PRODUCTS OSCIL. CERAMIC TOWER HEATER,73.48,30-day returns,"['The tower was new ""opened box"" performs great.  I use it in our living room to supplementfurnace heat and save money.  The oscillation is a good  feature.', 'This  heater has some great features. Puts out an sufficient amount of heat for one room. Great buy! ', 'Fan is very fast at heating our bathroom.  Adjustable temperatures makes it nice.', 'I love my new Lasko Ceramic HeaterHeats the entire room quickly and quietly. I just bought another. I love this. ', 'This is such a cute heater and performs great. Love it in my kitchen, is just perfect.Loving it.', 'I had one of these for 10 years before it died. I looked for the same model seeing as the first one worked so well for so long. This one is just as good as the first one was. Hopefully it will last just as long.', 'Heats quickly, lightweight, and puts off a good amount of heat, love putting it in the bathroom before I shower!', 'Works well on my enclosed porch exactly as advertised. Especially like the oscillating fan.', ""Heats my son's approximately 500 square ft bedroom in a matter of minutes on the low setting. The high setting is almost too hot to run for long periods this thing works so good. Definitely a great buy for rooms with a draft or just looking to lower heat cost in the winter."", 'Gives out Great Heat and Is Temperature Controlled.']","New: A brand-new, unused, unopened, undamaged item in its original packaging (where packaging is applicable). Packaging should be the same as what is found in a retail store, unless the item is handmade or was packaged by the manufacturer in non-retail packaging, such as an unprinted box or plastic bag. See the seller's listing for full details. ",Lasko,Tower Heater,"Timer, Oscillation",,"LASKO5775, 378, 5775",0046013761798,,5775,,,,,,,,,0046013761798,,Ceramic,Electric,,2,,,"Push Button, Digital",,,,Convection,,"Silver, Gray, White, Black",,,,,,,,,,,,,,,,,,,,,,,,,,,,,,,,,,,,,,,,,,,,,,,,,,,,,,,,,,,,,,,,,,,,,,,,,,,,,,,,,,,,,,,,,,,,,,,,,,,,,,,,,,,,,,,,,,,,,,,,,,,,,,,,,,,,,,,,,,,,,,,,,,,,,,,,,,,,,,,,,,,,,,,,,,,,,,,,,,,,,,,,,,,,,,,,,,,,,,,,,,,,,,,,,,,,,,,,,,,,,,,,,,,,,,,,,,,,,,,,,,,,,,,,,,,,,,,,,
Marley QMark MPDS-25 Power Disconnect 3 Pole 25 AMP 600VAC For MHU SERIES HEATER,75.0, , ,"Open box: An item in excellent, new condition with no wear. The item may be missing the original packaging or protective wrapping, or may be in the original packaging but not sealed. The item includes original accessories. The item may be a factory second. See the seller's listing for full details and description. ",Marley QMark,Wall Heater,NA,,MPDS-25,,NA,MPDS25,,,,,,,,,Does not apply,,Steel,Electric,Wall,NA,NA,NA,Switch,NA,,,Forced Air/Fan,230 V,Black,,,,,,,,,NA,,NA,,,,,,,,,,,,,,,NA,NA,NA,,,,NA,,A,NA,NA,,,,,,,,,,,,,,,,,,,,,,,,,,,,,,,,,,,,,A - G,,,,,,,,,,,,,,,,,,,,,,,,,,,,,,,,,,,,,,,,,,,,,,,,,,,,,,,,,,,,,,,,,,,,,,,,,,,,,,,,,,,,,,,,,,,,,,,,,,,,,,,,,,,,,,,,,,,,,,,,,,,,,,,,,,,,,,,,,,,,,,,,,,,,,,,,,,,,,,,,,,,,,,,,,,,,,,,,,,,,,,,,
Electric Cast Heating Plate Aluminum Round Shape Heater Temperature Thickness ,,Free shipping and returns, ,"New: A brand-new, unused, unopened, undamaged item in its original packaging (where packaging is applicable). Packaging should be the same as what is found in a retail store, unless the item is handmade or was packaged by the manufacturer in non-retail packaging, such as an unprinted box or plastic bag. See the seller's listing for full details. ",Unbranded,Electric Water Heater Parts,Timer,,1867168631,,Strip,1867168606,,,No,,,,,,,,Aluminum,Electric,"Cabinet, Desk/Tabletop, Wall",1,100 sq ft or Less,Less Than 10 W,"Digital, Push Button, Switch",PTC Thermistor,,,Forced Air/Fan,220 V,Multicolor,,,,,,,,None,See Picture,Clear Connect,Electric Brass Band Heaters Temperature Water Heat,,,,,China,,,,,,None,2021,,,Electric Brass Band Heaters Temperature Water Heat,Standard,Less Than 80%,None,,,None,,A++,1 gal or Less (5 L),3 or Less,,,,,,,,Less Than 5 A,Other: See Item Description,,,,,,,,,,,,,,,,,,Amazon Alexa,,,,,,,,,,A+++ - D,,,,,,,,,,,,,,,,,,,,,Cast Aluminum  Heater Heating Plate,20mm,,,,,,,,,,,,,,,,None,,,,,,,,,,,,,,,,,,,,,,,,,,,,,,,,,,,,,,,,,,,,R-11,,,,,,,,,,,,,,,,,,,,,,,,,,,,,,,,,,,,,,,,,,,,,,,,,,,,,,,,,,,,,,,,,,,,,,,,,,,,,,,,,,,,,,,,,,,,,,,,,,,,,,
Heller 2000W Electric Ceramic Oscillating Mini Tower Heater+Thermostat HTF2000,99.99, , ,New,Heller,Tower Heater,"Auto Shut-Off, Oscillation, Timer",,does not apply,,n/a,HTF2000,whte,,,,,,,,9312737101464,,"plastic, Ceramic","Electric, Fan",Floor,2,11 - 20 sq m,1501-2000 W,Rotary Knob,n/a,,,Forced Air/Fan,240 V,,,,,,,,,,n/a,,n/a,,,,,,,,,,,,2000,,,n/a,Standard,Less Than 80%,,,,n/a,,,n/a,n/a,,,,,,,,,,,,,,,,,,,,,,,,,,,,,,,,,,,,,A+++ - D,,,,,,,,,,,,,,,,,,,,,,,,,,,,,,,,,,,,,,,,,,,,,,,,,,,,,,,,,,,,,,,,,,,,,,,,,,,,,,,,,,,,,,,,,,,,,,,,,,Compliant,,,,,,,,,,,,,,,,,,,,,,,,,,,,,,,,,,,,,,,,,,,,,,,,,,,,,,,,,,,,,,,,,,,,,,,,,,,,,,,,,,,,,,
Lasko Oscillating Electric Style Ceramic Space Heater with Remote Control,48.09, , ,"New: A brand-new, unused, unopened, undamaged item in its original packaging (where packaging is applicable). Packaging should be the same as what is found in a retail store, unless the item is handmade or was packaged by the manufacturer in non-retail packaging, such as an unprinted box or plastic bag. See the seller's listing for full details. ",Lasko,,,,6435,07445005118139,,6435,,,,,,,,,7445049660618,,,,,,,,,,,,,,Does not apply,8.25 x 3.00 x 16.05 Inches,Electric,,Indoor,3 lbs,Lasko,Does not apply,,,,,,,,,,,,,,,,,,,,,,,,,,,,,,,,,,,,,,,,,,,,,,,,,,,,,,,,,,,,,,,,,,,,,,,,,,,,,,,,,,,,,,,,,,,,,,,,,,,,,,,,,,,,,,,,,,,,,,,,,,,,,,,,,,,,,,,,,,,,,,,,,,,,,,,,,,,,,,,,,,,,,6435,,,,,,,,,,,,,,,,,,,,,,,,,,,,,,,,,,,,,,,,,,,,,,,,,,,,,,,,,,,,,,,,,,,,,,,,,,,,,,,,,,,,,
Dreo Space Heater 70° Oscillating PTC Ceramic Heater 1500W Electric Heater wi...,71.99,30-day returns, ,"New: A brand-new, unused, unopened, undamaged item in its original packaging (where packaging is applicable). Packaging should be the same as what is found in a retail store, unless the item is handmade or was packaged by the manufacturer in non-retail packaging, such as an unprinted box or plastic bag. See the seller's listing for full details. ",Dreo,,,,Does not apply,Does not apply,,Does not apply,,,,,,,,10.3 inch,850032505857,,,,,,,,,,,,,,Space Gray,,,,,,,0850032505857,,,,,,,,,,,,,,,,,,,,,,,,,,,,,,,,,,,,,,,,,,,,,,,,,,,,,,,,,,,,,,,,,,,,,,,,,,,,,,,,,,,,,,,,,,,,,,,,,,,,,,,,,,,,,,,,,,,,,,,,,,,,,,,,,,,,,,,,,,,,,,,,,,,,,,,,,,,,,,,,,,,,,,,,,,,,,,,,,,,,,,,,,,,,,,,,,,,,,,,,,,,,,,,,,,,,,,,,,,,,,,,,,,,,,,,,,,,,,,,,,,,,,,,,,,
Heating Pad Side Bending Thermal Mat Device Silicone Orange Heater Flexible,,30-day returns, ,"New: A brand-new, unused, unopened, undamaged item in its original packaging (where packaging is applicable). Packaging should be the same as what is found in a retail store, unless the item is handmade or was packaged by the manufacturer in non-retail packaging, such as an unprinted box or plastic bag. See the seller's listing for full details. ",Unbranded,,,,Does Not Apply,,,Heating Pad,,,,,,,,,,,Silicone rubber,,,,,1200W,,,,,,,Orange,,,,,,,,,,,,,,,,,,,,,,,,,,,,,,,,,,,,,,,,,,,,,,,,,,,,,,,,,,,,,,,,,,,,,,,,,,,,,,,,,,,,,,,,,,,1500v / 5s,± 8%,200 cm,,,,,,,,,,,,,,,,,,,,,,,,,,,,,,,,,,,,,,,,,,,,,,,,,,,,,,,,,,,,,,,,,,,,,,,,,,,,,,,,,,,,,,,,,,,,,,,,,,,,,,,,,,,,,,,,,,,,,,,,,,,,,,,,,,,,,,,,,,,,,,,,,,,,,,,,,,,,,,,,,,,,
Presto Heat Dish Plus Parabolic Electric Heater 0792401 - TESTED WORKING ,74.99, ,"[""I use this heater in my clinic and my patients absolutely love it. It's amazing how quickly it heats a room without air blasting or noise. It has a nice safety feature where it makes a horrible noise if it's tipping over (it only happens if I'm moving it when it's on). In fact several of my patients have gone out and bought their own for home. I should get a commission."", 'I have an old 1911 craftsman style house with no insulation.  My heating system is an outdated oil furnace.  As we all know the price of fuel is always fluctuating and seems like it is going to stay that way.  It costs me about $300.00 a month in the winter.  Which is ridiculous, especially when the heat just does not stay in the house for long.I needed a knew plan and changing out the heat system or insulating the house is not an option at this time.  So I went out and bought the presto heatdish.  It produces so much heat that during the winter I no longer had to heat the entire house to stay warm.  I would just carry the heatdish around with me, saving me hundreds of dollars month to month.  I had a few other electric heaters before I purchased this one and the difference is night and day.I  have had this heater for almost 3 years now and it still works as well as the day I purchased it.  It paid for itself in its first week work.  With as much use as this gets I would of expected it to burn out a while ago, but that is not the case.The drawbacks: It does not have an automatic turn off system if it were to fall over, but it does have an alarm that is unmistakably loud.   There is also a footlight that you cannot turn off or on, but you can just take out the lightbulb if that bothers you.Great product and highly recommended. Thanks for reading.', ""Proven, ancient technology that outperforms the daylights of newer, highly rated products. It's effective (heats the room quickly and thoroughly), efficient (only 1,000 watts), safe (automatic shut-off features), and built to last. Sometimes a product cannot be improved upon.  "", 'It gives off a good amount of heat but it has one big design flaw where the dish can not be tilted. This means the dish is in a fixed position which points into the air slightly. So if the surface you place it on is taller than you are while seated you will struggle to feel it. The safety tip over buzzer also prevents you from sliding something underneath it to tilt it yourself.', ""This is a wonderful heater.  I am a smoker and visit my family a lot.  I choose to smoke in the garage there and my sister in law bought this for me to use in the garage. It warms up quickly for the immediate area and it doesn't take long for the surrounding areas to warm up either. Once this gets going I don't even need a coat.  (Ohio area)  I have a house with very tall ceilings in the master bedroom and living area.  In the winter this little heater warms up quickly, even going right to the high setting.  I always have to turn it way back too.  I am widowed now and I don't need to keep the entire house warm, just where I am.  I do recommend this.  Oh, it is safe, if you move it at all when it is on you get a loud buzz sound!  If on the fence about it I would go with it."", 'Great price, lightweight, energy efficient. It has worked very well so far. The price was the best I found on Ebay. I think the design is very good. The shape of the dish plus the shiny interior helps it be much more efficient than a regular space heater. It gets very hot very fast. It also has a buzzer in case it tips over. A great all around heater to warm a person up fast.', ""These are fabulous heaters (radiant warmth, like the sun) and are in great condition.At first they didn't quite meet my needs, because I needed them to point straight ahead, whereas they are angled slightly upward and this is not adjustable. However, I set each heater on a slanted platform (which I made out of heavy cardboard), and now they meet my needs perfectly. (Parabolic heat dish heaters warm whatever is directly in front of them, within about, say, 15 feet.) You won't believe how much glowing warmth they put out!Also, Rob was great to do business with."", ""I live in a 1920's craftsman style house with poor insulation. This heater is wonderful and has allowed me to turn my thermostat down several degrees and still be comfortable here in Minnesota. I would give it 4 1/2 stars if I could because it is actually a little bit large to walk around in a small house with small rooms.  But that said, even set as low as it will go, it still puts out a lot of heat. In fact, I have to be careful not to put it in a room near my thermostat because the furnace will not come on at all if I do!  I have already recommended it to friends."", 'This heat dish pumps out heat so intensely it’s like a dryer for your cloths if sitting in front of it. I could feel it’s radiant heat from about 15ft away. Wayyyy better than other heat dish I had no contest. It does not oscillate and no remote only 2 features not on this probably because it is heavy duty. This is the best heat dish, look no further. ', ""I had a socially distanced bourbon tasting party for four on my back patio during January 2021 in Chicago. My neighbor had two of the Presto dishes so I ordered two more. Even though the evening's temperature dipped into the mid-20s, all four of us were completely comfortable sitting in our patio chairs with a our own Presto dish to keep us warm. The next day I ordered two more dishes to complete my set.""]","Used: An item that has been used previously. The item may have some signs of cosmetic wear, but is fully operational and functions as intended. This item may be a floor model or store return that has been used. See the seller’s listing for full details and description of any imperfections. ",Presto,Portable Heater,"Auto Shut-off, Timer",,1327704,,Coil,0792401,,,,,,,,,0075741079172,,"Aluminum, Steel",Electric,"Floor, Wall, Desk/Tabletop, Cabinet",3,451-500 sq ft,,"Dial, Switch, Push Button",Steel,,,Radiant,120 V,Black,,,,,,,,,,Infrared,,,,,,,,,,,,do not apply,2019,,,,None,Less Than 80%,,,,2000-2999 BTU,,,1 gal or Less (5 L),3 or Less,,,,,,,,,,,,,,,,,,,,,,,,,,,,,,,,,,,,,,,,,,,,,,,,,,,,,,,,,,,,,,,,,,,,,,,,,,,,,,,,,,,,,,,,,,,,,,,,,,,,,,,,,,,,,,,,,,,,,,,,,,,,,,,,,,,,,,,,,,,,,,,,,,,,,,,,,,,,,,,,,,,,,,,,,,,,,,,,,,,,,,,,,,,,,,,,,,,,,,,,,,,,,,,,,,,,,,,,,,,,,
"CZ250 Shop Heater, Flex-Mount - Quantity 1",72.0, , ,"New: A brand-new, unused, unopened, undamaged item in its original packaging (where packaging is applicable). Packaging should be the same as what is found in a retail store, unless the item is handmade or was packaged by the manufacturer in non-retail packaging, such as an unprinted box or plastic bag. See the seller's listing for full details. ",comfort zone,Portable Heater,n/a,,CZ250,0075877250766,Coil,CZ250,,,,,,,,,0075877250766,,"Aluminum, Steel","Fan, Battery, Electric","Baseboard, Floor, Wall, Desk/Tabletop, Cabinet",1,351-400 sq ft,1001-1500 W,"Dial, Rotary Knob, Switch, Analog/Mechanical",Brass,,,Forced Air/Fan,120 V,Black,,,,,,,,,10 in.,,7 in.,,,,,China,,,,,,1000 sq. ft,,,,11.5 in.,None,Less Than 80%,,,,2000-2999 BTU,,,1 gal or Less (5 L),3 or Less,,,,,,,,,,,,,,,,,,,,,,,,,,,,,,,,,,,,,,,,,,,,,,,,,,,,,,,,,,,,,,,,,,,,,,,,,,,,,,,,,,,,,,,,,,,,,,,,,,,,,,,,,,,,,,,,,,,,,,,,1,,,,,,,,,,,,,,,,,,,,,,,,,,,,,,,,,,,,,,,,,,,,,,,,,,,,,,,,,,,,,,,,,,,,,,,,,,,,,,,,,,,,,,,,,,,,,,,,,,,,,
Honeywell Energy Smart Electric Radiator Heater Black,70.0, , ,"Used: An item that has been used previously. The item may have some signs of cosmetic wear, but is fully operational and functions as intended. This item may be a floor model or store return that has been used. See the seller’s listing for full details and description of any imperfections. ",Honeywell,,,,,,,,,,,,,,,,092926007898,,,Electric,,,,,,,,,,,Black,,,,,,,,,,,,,,,,,,,,,,,,,,,,,,,,,,,,,,,,,,,,,,,,,,,,,,,,,,,,,,,,,,,,,,,,,,,,,,,,,,,,,,,,,,,,,,,,,,,,,,,,,,,,,,,,,,,,,,,,,,,,,,,,,,,,,,,,,,,,,,,,,,,,,,,,,,,,,,,,,,,,,,,,,,,,,,,,,,,,,,,,,,,,,,,,,,,,,,,,,,,,,,,,,,,,,,,,,,,,,,,,,,,,,,,,,,,,,,,,,,,,,,,,,,,,,,,,,
Industrial Cabinet Heater Anti-condensation air heater HVL031-100W-400W,39.09,30-day returns, ,"New: A brand-new, unused, unopened, undamaged item in its original packaging (where packaging is applicable). Packaging should be the same as what is found in a retail store, unless the item is handmade or was packaged by the manufacturer in non-retail packaging, such as an unprinted box or plastic bag. See the seller's listing for full details. ",Unbranded,,,,,,,Does  not  Apply,,,,,,,,,,,,,,,,,,,,,,,,,,,,,,,,,,,,,,,,,,,,,,,,,,,,,,,,,,,,,,,,,,,,,,,,,,,,,,,,,,,,,,,,,,,,,,,,,,,,,,,,,,,,,,,,,,,,,,,,,,,,,,,,,,,,,,,,,,,,,,,,,,,,,,,,,,,,,,,,,,,,,,,,,,,,,,,,,,,,,,,,,,,,,,,,,,,,CN(Origin),NONE,fan heater,,,,,,,,,,,,,,,,,,,,,,,,,,,,,,,,,,,,,,,,,,,,,,,,,,,,,,,,,,,,,,,,,,,,,,,,,,,,,,,,,,
Lasko Electronic Ceramic Heater With Warm Air Motion Technology - Ceramic -,72.19,30-day returns, ,"New: A brand-new, unused, unopened, undamaged item in its original packaging (where packaging is applicable). Packaging should be the same as what is found in a retail store, unless the item is handmade or was packaged by the manufacturer in non-retail packaging, such as an unprinted box or plastic bag. See the seller's listing for full details. ",Lasko,,"Timer, Auto Shut-off",,CC13251,0046013768919,,Lasko CC13251,,,,,,,,,0046013768919,,Ceramic,"Battery, Electric",Floor,2,251-300 sq ft,1001-1500 W,Touch,,,,Convection,12 V,Black,,,,,,,,,,,,,,,,,,,,,,6.2,,,,,Standard,,,,,5000-5999 BTU,,,,,,,,,,,,10.1-15 A,,,,,,,,,,,,,,,,,,,,,,,,,,,,,,,,,,,,,,,,,,,,,,,,,,,,,,,,,,,,,,,,,,,,,,,,,,,,,,,,,,,,,,,,,,,,,,,,,,,,,,,,,,,,,,,,,,,,,,,,,,,,,,,,,,,,,,,,,,,,,,,,,,,,,,,,,,,,,,,,,,,,,,,,,,,,,,,,,,,,,,,,,,,,,,,,,,,,,,,,,,,,,,,,,,,,,
220V Thermostat PTC Insulated Type Ceramic Air Heating Element Electric Heater,,Free shipping and returns, ,"New: A brand-new, unused, unopened, undamaged item in its original packaging (where packaging is applicable). Packaging should be the same as what is found in a retail store, unless the item is handmade or was packaged by the manufacturer in non-retail packaging, such as an unprinted box or plastic bag. See the seller's listing for full details. ",Unbranded,Electric Heater Parts,"Auto Shut-off, Timer",,1829030357,,Strip,1829030335,,,No,,,,,,354482671778,,Ceramic,Electric,"Desk/Tabletop, Wall",1,None,3000W,"Digital, Push Button, Remote Control",PTC Thermistor,,,Forced Air/Fan,220 V,Multicolor,,,,,,,,None,See picture,"Clear Connect, Infrared",See picture,,,,,China,,,,,,See picture,2021,,,6 in,11-20 dB,None,None,,,Less Than 2000 BTU,,A+++,1 gal or Less (5 L),None,,,,,,,,None,Other: See Item Description,,,,,,,,,,,,,,,,,,Amazon Alexa,,,,,,,,,,A+++ - D,,,,,,,,,,,,,,,,,,,,,,,,,,,,,,,,,,,,,,None,,,,,,,,,,,,,,,,,,,,,,,,,,,,,,,,,,,,,,,,,,,,,,,,,,,,,,,,,,,,,,,,,Insulated,,,,,,,,,,,,,,,,,,,,,,,,,,,,,,,,,,,,,,,,,,,,,,,,,,,,,,,,,,,,,,,,,,,,,,,,,,,,,,,,,
Heated Foot Warmer Black Cozy Toasty Toes 105 Watt 120 Volt New and Improved,70.0,30-day returns,"[""First, a Toasty Toes draws 105 watts (not 90) and is warranted for ONLY 6 MONTHS (not 1 year).OK, so the minimal warranty, particularly on this basic an item, suggests that you're probably not getting a first class product, and its shoddy factory packaging which makes you look twice to make sure you haven't gotten open-box merchandise - The tape doesn't even stick to the cardboard! - confirms it.I called the company and was told that my Toasty Toes should get to 120º on its low heat setting and 140º on high.Nope!!! I've had two of them: the first one didn't get much past 100º...went back, and the second one got to 120º, but no higher...also went back. (The high heat option may work only when the unit is vertical, but I obviously haven't been able to find out.)As far as I can tell, they're using an unique design/cute name combo as an excuse to charge WAAAY TOO MUCH MONEY for an INFERIOR PRODUCT! :(My observations about my Toasty Toes insofar as it worked: I was hoping it would compensate for a cold floor draft, but I found that in its horizontal position it warmed the bottoms of my feet while leaving the tops cold, which left them pretty uncomfortable...not at all what I had hoped for.And in its vertical position it was inadequate on its low heat setting, and I'm not about to buy a third one (Softball rules: two strikes, and you're out!) in the hope that it may actually work both as it's supposed to and as I'd like.Looks like it's back to my ancient, reliable 600 watt radiant jobby, and damn the electricity bills, full comfort ahead! :)"", 'I read previous reviews of the earlier model of this item saying it did not get warm enough to feel through your shoes. (It worked OK with socks or bare feet).  That is why I bought the newer model having 104 Watts. (The box design is different than the older model.)  It does keep your feet warm even with shoes on.  (It takes a few minutes to warm up.)  It is sturdy, has two heat settings, and can be used in three positions.  (The two different pairs of legs fold out from the bottom.)  It does everything it is supposed to do.  I can not want more than that.  It has a six month warranty.', 'Actually keeps your feet warm.  I do a lot of computer work and my feet get sooooooo cold.  When your feet are warm, the rest of you stays warm.  Best with slippers.   tested with killawat tester.  97 watts at medium, 195 watts at high.  to stay warm for less than a hundred watts is a miracle.   I use as medium and have to take feet off periodically to cool down.  This is so wonderful. Thanks Cozy Products.', ""The product is sturdy and works well.  It includes two legs that let it incline at a sharper angle.  The legs don't latch very well but if don't need that feature, it is very good."", 'It does the job keeping my feet warm.Would be improved if it had an automatic off after x hours and/or more than one temperature setting.', 'This is exactly what I needed for my office in the winter.Even on low I sometime need to take my shoes off the footrest to let them cool off!I have been using it two weeks and so far even forgetting to turn it off over night has not hurt it at all.', ""It's made well but wow, does this get hot!  Even on low it gets uncomfortably hot - I haven't even tried the High setting.  I would not recommend this product."", 'Works as advertised. Wish the selector switch could be foot operated.', 'Bought it for my home office and it is perfect for the windy and cold corner where my desk sits.  Keeps me warm but not overheated.', 'Works as described so far, with Toasty feet !']","New: A brand-new, unused, unopened, undamaged item in its original packaging (where packaging is applicable). Packaging should be the same as what is found in a retail store, unless the item is handmade or was packaged by the manufacturer in non-retail packaging, such as an unprinted box or plastic bag. See the seller's listing for full details. ",Cozy,"Panel, Electric Portable Heater","Timer, Portable, Indoor, Heated, Heating, Automatic Shutoff,Nonslip Base,Thermostat,Timer,Adjustable Height, Adjustable Height, Heater, Thermostat,Nonslip Base,Automatic Shutoff,Timer,Adjustable Height",,COZYFOOTREST,,,TT,,,No,,,No,,,706069232610,,Plastic,"90W, Electric","Floor, Portable",2 Heat,,90,Dial,,,,Radiant,120 V,Black,,,,,,,,None,,,18 mm,,,,,China,,,,,,,,,,,Quiet,,,,,,,Not Compliant,,,Modern,,Black,,,,,,,,,,,,,,,,,,,,,,,,,,,,,,,,,"Yes, 6 Months, Manufacturer’s Warranty",,,,,,,,,,Yes,,Personal Space Heater & Foot Rest,ETL Certified Zero-Clearance Item,No Clearance Required,,,,,,,,,,,,,,,,,,,,"18.03"" x 12.41"" x 1.77""",No,,,,,,,,,,,,,,,,,,,,,,,,,,,,,,,,,,,,,,,,,,,,,,,,,,,,Flat Panel,,,,,,,,,,,,,,,,,,,,,,,,,,,,,,,,,,,,,,,,,,,,,,,,,,,,,,,,,,,,,,,,,,,,,,,,,,,,,,,,,,,,,,,,,,,,,,,,,,
"Lasko 6405 Designer Oscillating Heater,Gold",71.67, , ,"New: A brand-new, unused, unopened, undamaged item in its original packaging (where packaging is applicable). Packaging should be the same as what is found in a retail store, unless the item is handmade or was packaged by the manufacturer in non-retail packaging, such as an unprinted box or plastic bag. See the seller's listing for full details. ",Unknown,Does not apply,,,Does Not Apply,0711181385793,,6405,,,,,,,,,744110960754,,,,,,,,,,,,,,Gold,,,,,,Lasko,,,,,,,,,,,,,,,,,,,,,,,,,,,,,,,,,,,,,,,,,,,,,,,,,,,,,,,,,,,,,,,,,,,,,,,,,,,,,,,,,,,,,,,,,,,,,,,,,,,,,,,,,,,,,,,,,,,,,,,,,,,,,,,,,,,,,,100,160,,,,,,,,,,,,,,,,,,,,,,,,,,,,,,,,,,,,Heater,,,,,,,,,,,,,,,,,,,,,,,,,,,,,,,,,,,,,,,,,,,,,,,,,,,,,,,,,,,,,,,,,,,,,,,,,,,,,,,,
PELONIS CUBE HEATER,75.0, , ,"Used: An item that has been used previously. The item may have some signs of cosmetic wear, but is fully operational and functions as intended. This item may be a floor model or store return that has been used. See the seller’s listing for full details and description of any imperfections. ",Pelonis,,,,UN KNOWN,,,,,,,,,,,,Does not apply,,,,,,,,,,,,,,,,,,,,,,,,,,,,,,,,,,,,,,,,,,,,,,,,,,,,,,,,,,,,,,,,,,,,,,,,,,,,,,,,,,,,,,,,,,,,,,,,,,,,,,,,,,,,,,,,,,,,,,,,,,,,,,,,,,,,,,,,,,,,,,,,,,,,,,,,,,,,,,,,,,,,,,,,,,,,,,,,,,,,,,,,,,,,,,,,,,,,,,,,,,,,,,,,,,,,,,,,,,,,,,,,,,,,,,,,,,,,,,,,,,,,,,,,,,,,,,,,,,,,,,,,,,,,,,,
"Qmark B10 Mounting Bracket,3-10 Kw Heaters",71.99, , ,,QMark,HVAC Parts,When you need to install a MUH unit heater in a new location or a,,B10,,,BRACKET,,,,,,,,,0685360036540,,Steel,Electric,Wall,1,,,,,,11.000,,N/A,Black,,,,,,,,,,,11.000,,,,,,,,,,,N/A,,,,,,,,,,,,,,,,,,,,,,,,,,,,,,,,,,,,,,,,,Universal,,,,,,,,,,,,,,,,,,,,,,,,,,,,,,,,,,,,,,,,,,,,,,,,,,,,,,,,,,,,,,,,,,,,,,,,,,,,,,,,,,,,,,,,,,,,,,,,,,,,,,,,,,,,,,,,,,,N/A,N/A,7,21.000,N/A,N/A,No,N/A,,,,,,,,,,,,,,,,,,,,,,,,,,,,,,,,,,,,,,,,,,,,,,,,,,,,,,,,,,,,,,,,,,,,,,,,
