"CZ707 Power Zone Fan Heater, Gray, 750/1500-Watt - Quantity 1",68.47, ,"['Pros:Cranks out so much heat that lower setting is good enough.Cons:* Too small.* Coating on grill began chipping off in a few days.* Heating elements have a dark area in lower quarter, suggesting a short (maybe just mine?)* Carrying handle detached first day (could have dropped to floor).', ""Probably a good size for a hobbit, or a small child's play house.  For adult human, not so much.Within a few weeks the heater began cranking up to HIGH without being told to,and lost the ability to be turned off--had to unplug.Basically a splendid little fire bomb just waiting for its chance to be left unattended for a while. "", 'pros: Showed up within a few days of ordering. Good price, brand new, compact design, decent quality and works well. I use it everyday and if it lasts 6 months I will buy another.cons: The top handle could be bigger and better (obviously not a deal breaker for me). The fan could be a little quieter.over all: A good deal.', ""Purchased this heater 14 years ago and used it every winter since then.  It is small, but BTUs are BTUs regardless of size and it heats my cabin bathroom just fine in the winter.  Mine does not have the newer tip over safety switch.  I've never had any paint chipping issues and it looks as new as it did the day I purchased it. My only complaint is that the heater, hi/lo fan selector switch is very tight to turn, but I've learned to live with it.  The cord is also long enough that I do not need an extension cords which makes portable electrical heaters even more unsafe.  Hope this helps with your decision."", ""small but put's 0ut a lot of heat and runs quietly"", ""This heater is comparable to the older Big Heat cube and the knobs are easier to adjust' I am pleased with both types of heaters because I needed a compact heater.Thi"", 'Great deal', 'Its very small and I need it to warm /dry carpet in a jeep ...', 'A OK ***********************************', 'Compact heater works as advertised. Great low price.']","New: A brand-new, unused, unopened, undamaged item in its original packaging (where packaging is applicable). Packaging should be the same as what is found in a retail store, unless the item is handmade or was packaged by the manufacturer in non-retail packaging, such as an unprinted box or plastic bag. See the seller's listing for full details. ",comfort zone,"Fan, Electric",Portable Heater,Convection,"Baseboard, Floor",,Steel,1,"Dial, Rotary Knob",Comfort Zone CZ707,120 V,Auto Shut-off,,1001-1500 W,Coil,,Less Than 80%,Standard,Less Than 2000 BTU,100 sq ft or Less,6,CZ707,3 or Less,,n/a,,,,,,,,075877070708,Gray,,,,,,,,China,,,,,HomePlug,,,,,,,,,,,,,,,,,,,,,,,,,,,,,,,,,,,,,,,,,,,,,,,,,,,,,,,,,,,,,,,,,,,,,,,,,,,,,,,,,,,,,,,,,,,,,,,,,,,,,,,,,,,,1,,,,,,,,,,,,,,,,,,,,,,,,,,,,,,,,,,,,,,,,,,,,,,,,,,,,,,,,,,,,,,
"HHF360WV3 360-Degree Surround Heater, Fan-Forced, White - Quantity 1",66.71, , ,"New: A brand-new, unused, unopened, undamaged item in its original packaging (where packaging is applicable). Packaging should be the same as what is found in a retail store, unless the item is handmade or was packaged by the manufacturer in non-retail packaging, such as an unprinted box or plastic bag. See the seller's listing for full details. ",HONEYWELL,n/a,HOME COMFORT APPLIANCES,,,,n/a,,,,n/a,n/a,,,,,,,,,9.020,HHF360WV3,,,n/a,,,,,,,,092926193607,,,,,,,,,China,,,,,,,,,,,,,,,,,,,,,,,,,,,,,,,,,,,,,,,,,,,,,,,,,,,,,,,,,,,,,,,,,,,,,,,,,,,,,,,,,,,,,,,,,,,,,,,,,,,,,,,,,,,,,,,,,1,,,,,,,,,,,,,,,,,,,,,,,,,,,,,,,,,,,,,,,,,,,,,,,,,,,,,,,,,,,,,,
"Lorell 17"" Ceramic Tower Heater - Ceramic - Electric - Electric - 1 Kw To 1.50",67.93,30-day returns, ,"New: A brand-new, unused, unopened, undamaged item in its original packaging (where packaging is applicable). Packaging should be the same as what is found in a retail store, unless the item is handmade or was packaged by the manufacturer in non-retail packaging, such as an unprinted box or plastic bag. See the seller's listing for full details. ",Lorell,,,,,,,,,,,,,,,,,,,,,llr-33558,,,,,,,,,,,035255335584,,,,,,,,,,,,,,,,,,,,,,,,,,,,,,,,,,,,,,,,,,,,,,,,,,,,,,,,,,,,,,,,,,,,,,,,,,,,,,,,,,,,,,,,,,,,,,,,,,,,,,,,,,,,,,,,,,,,,,,,,,,,,,,,,,,,,,,,,,,,,,,,,,,,,,,,,,,,,,,,,,,,,,,,,,,,,,,,,,,,,,,,
Indoor 1500 Watt Electric Baseboard Convection Space Heater with Digital Thermos,67.28, , ,"New: A brand-new, unused, unopened, undamaged item in its original packaging (where packaging is applicable). Packaging should be the same as what is found in a retail store, unless the item is handmade or was packaged by the manufacturer in non-retail packaging, such as an unprinted box or plastic bag. See the seller's listing for full details. ",Thermos,Electric,Baseboard Heater,Convection,,,,,Digital,,,,,,,,,,,,,Does not apply,,,,,,,,,,,Does not apply,White,,,,,,,,,,,,,,,,,HEATER CONVECTION BASEBOARD,,,,,,,,,,,,,,,,,,,,,,,,,,,,,,,,,,,,,,,,,,,,,,,,,,,,,,,,,,,,,,,,,,,,,,,,,,,,,,,,,,,,,,,,,,,,,,,,,,,,,,,,,,,,,,,,,,,,,,,,,,,,,,,,,,,,,,,,,,,,,,,,,,,,,,,,,,,,,,,,,,,,,,
Comfort Zone Electric Portable Heater 5120-BTU Convection Thermostat Black,68.8,30-day returns,"['excellent convection heater , low power draw than my smaller electric portable space heaters. the thermostat though lower setting; the actual temperature register or indicated on display is often 10 degree higher and needs to be re-set via turning off/on the heater. jeg70', ""It's awesome.  Very efficient, dead silent and with the thermostat and trimmer I can precisely set the room temp I want for the time I want. "", 'Perfect for our walk-in closet that is always freezing in winter.  I really like the feature that allows you to automatically control the temperature of the room.  It keeps the closet from getting too hot. ', ""I had another heater in the room that just wasn't doing the trick. Fan would run all the time and not produce enough heat. Replaced it with this unit and am so happy with it. Nice and quiet , too !!"", 'something inside of unit was rtling and could not set the unit to work to opperate! tosed out and got another similar unit, could have been due to shipping?', 'This heater works excellent! Maintains set temperature and makes the whole room feel comfy and warm.', 'Working great puts out good heat ', 'I do like it very much.  Great in my home office when I need extra heat!', 'It works great after it’s broken in . My daughter Loves it.', 'Great controls']","New: A brand-new, unused, unopened, undamaged item in its original packaging (where packaging is applicable). Packaging should be the same as what is found in a retail store, unless the item is handmade or was packaged by the manufacturer in non-retail packaging, such as an unprinted box or plastic bag. See the seller's listing for full details. ",comfort zone,Electric,"Baseboard Heater Heaters, Baseboard Heater",Convection,,,Metal,1,"Switch, Remote Control, Digital",CZ650,120 V,"Timer, Indoor",,,,,,,,,7.4,CZ650B,,,,,,,,,,0075877125521,0075877125521,Black,,,,,,,,,,,,,,,,,,,,,,,,,,,,,,,,,,,,,,,,,,,,,,,,,,,,,,,,,,,,,,,,,,,,,,,,,,,,,,,,,,,,,,,,,,,,,,,,,,,,,,,,,,,,,,,,,,,,,,,,,,,,,,,,,,,,,,,,,,,,,,,,,,,,,,,,,,,,,,,,,,,,,,,,,,,,,,,,,,,,,,,
FAHRENHEAT 4' 120V Baseboard Heater,65.75,30-day returns, ,"New: A brand-new, unused, unopened, undamaged item in its original packaging (where packaging is applicable). Packaging should be the same as what is found in a retail store, unless the item is handmade or was packaged by the manufacturer in non-retail packaging, such as an unprinted box or plastic bag. See the seller's listing for full details. ",FAHRENHEAT,,,,,,,,,,,,,,,,,,,,,F2514,,,,,,,,,,,Does not apply,,,,,,,,,,,,,,,,,,,,,,,,,,,,,,,,,,,,,,,,,,,,,,,,,,,,,,,,,,,,,,,,,,,,,,,,,,,,,,,,,,,,,,,,,,,,,,,,,,,,,,,,,,,,,,,,,,,,,,,,,,,,,,,,,,,,,,,,,,,,,,,,,,,,,,,,,,,,,,,,,,,,,,,,,,,,,,,,,,,,,,,,
Slant/Fin Hydronic Baseboard 4 ft. with Enclosure/Assembled Element in Nu White,65.95,30-day returns, ,"New: A brand-new, unused, unopened, undamaged item in its original packaging (where packaging is applicable). Packaging should be the same as what is found in a retail store, unless the item is handmade or was packaged by the manufacturer in non-retail packaging, such as an unprinted box or plastic bag. See the seller's listing for full details. ",Slant/Fin,,,,,,,,,101-401-4,,,,,,,,,,,,101-401-4,,,,,,,,,,0042541000910,0042541000910,NU WHITE,,,,,,,,,,,,,,,,,,,,,,,,,,,,,,,,,,,,,,,,,,,,,,,,,,,,,,,,,,,,,,,,,,,,,,,,,,,,,,,,,,,,,,,,,,,,,,,,,,,,,,,,,,,,,,,,,,,,,,,,,,,,,,,,,,,,,,,,,,,,,,,,,,,,,,,,,,,,,,,,,,,,,,,,,,,,,,,,,,,,,,,
UTILITY SPACE HEATER ,65.0,30-day returns, ,,UTILITY HEATER,Electric,Fan Heater,Radiant,Floor,,Steel,2 ADJUSTABLE KNOBS,"Dial, Rotary Knob",DQ1702,120 V,"Analog Thermostat, Carrying Handle, Cool-Touch Exterior, Auto Shut-off",,,Coil,Stainless Steel,Less Than 80%,None,Less Than 2000 BTU,Under 150 sq ft,14 in,DOES NOT APPLY,3 or Less,16 in,26 in,NONE,A+++ - D,,,,,,DOES NOT APPLY,Gray,,Compliant,,,,,,China,No,,,,,2017,,,,,,,,,,,,,,,,,,,,,14 INCHES,,,,,,,,,,,,,,,,,,,,,,,,,,,,,,,,,,,,,,,9 INCHES,,,,,,,,,,,,,,,,,,,,,,,,,,,,,,,,,,,,,,,,,,,,,,,,,,,,,,,,,,,,,,,,,,,Metallic,1500-1999 W,,,,,,,,,,,,,,,,,,,,,,,,,,,,,,,,,,,,,,,,,
"INKBIRDPLUS Space Electric Heater for Indoor Use, PTC Ceramic Portable Room Heat",66.54,30-day returns, ,"New: A brand-new, unused, unopened, undamaged item in its original packaging (where packaging is applicable). Packaging should be the same as what is found in a retail store, unless the item is handmade or was packaged by the manufacturer in non-retail packaging, such as an unprinted box or plastic bag. See the seller's listing for full details. ",Does not apply,Corded Electric,Does not apply,,,,,,,,,,,,,,,,,,,,,,,,,,,,,07445057515573,7445057515573,,,,,,,,,,,,,,,,,Does not apply,,,,,,,,,,,,,,,,,,,,,,,,,,,,,,,,,,,,,,,,,,,,,,,,,,,,,,,,,,,,,,,,,,,,,,,,,,,,,Convection,,,,,,,,,,,,,,,,,,,,,,,,,,,,,,,,,,,,,,,,,,,,,,,,,,1200 Watts,,,,,,,,,,,,,,,,,,,,,,,,,,,,,,,,,,,,,,,,
WAPEMORK Space Heater for Indoor Use - Portable Personal Electric Heaters Sma...,65.34, , ,"Open box: An item in excellent, new condition with no wear. The item may be missing the original packaging or protective wrapping, or may be in the original packaging but not sealed. The item includes original accessories. The item may be a factory second. See the seller's listing for full details and description. ",WAPEMORK,,,,,,,,,Does not apply,,,,,,,,,,,,Does not apply,,,,,,,,,,Does not apply,736112950413,White-black,,,,,,,,,,,,,,,,0736112950413,,,,,,,,,,,,,,,,,,,,,,,,,,,,,,,,,,,,,,,,,,,,,,,,,,,,,,,,,,,,,,,,,,,,,,,,,,,,,,,,,,,,,,,,,,,,,,,,,,,,,,,,,,,,,,,,,,,,,,,,,,,,,,,,,,,,,,,,,,,,,,,,,,,,,,,,,,,,,,,,,,,,,,,
Lasko 5409 Ceramic Portable Space Heater with Adjustable Thermostat-Features ...,68.05, ,"['This is a very good small heater, I have 2 of them. I believe when used properly they can save on heating costs.They are not meant to heat large areas like central heating.', 'This is a great little heater.  Love the handle on the top....so handy.  It is just the right size of a heater for my needs.  Would definitely recommend.', ""Very pleased. I have a small one bedroom apartment and it keeps it warm enough to where I don't even have to always run the furnace."", 'Heats fast, light, easy to carry and quiet', 'Nice heater.  I paid $30 and saw it at Family Dollar for $33.  Use it in my bedroom.', 'This is a good little heater, and does the job its meant to do.But, Its quite NOISY !.....So, not really suitable for bedroom.', 'Looks new and works as new, happy with item.', ""It's perfect small strong rotates light moves easily."", 'It’s small and works like a big heater !']","New: A brand-new, unused, unopened, undamaged item in its original packaging (where packaging is applicable). Packaging should be the same as what is found in a retail store, unless the item is handmade or was packaged by the manufacturer in non-retail packaging, such as an unprinted box or plastic bag. See the seller's listing for full details. ",Lasko,Electric,,Convection,Desk/Tabletop,,,3,"Remote Control, Digital, Touch, Push Button",,,,,,,,,,5000-5999 BTU,,,5409,,,,,,,,,,0046013766267,0046013766267,Gray,,,,,,,,,,,,,Infrared,2016,8.66in,,,,,,,,,,,,,,,,,,,,,,,,,,,,,,,,,,,,,,,,,,,,,,,,,,,,,,,,,,,,,,,,,,,,,,,,,,,,,,,,,,,,,,,,,,,,,,,,,,,,,,,,,,,,,,,,,,,,,,,,,,,,,,,,,,,,,,,,,,,,,,,,,,,,,,,,,,,,,,,,,,,,,,,,
Presto Heat Dish Plus Parabolic Electric Heater WORKS GREAT,69.99, , ,"Used: An item that has been used previously. The item may have some signs of cosmetic wear, but is fully operational and functions as intended. This item may be a floor model or store return that has been used. See the seller’s listing for full details and description of any imperfections. ",Presto,Electric,Portable Heater,Parabolic,Floor,,Aluminum,3,Rotary Knob,0790801,120 V,Na,,Electrical Plug,Coil,Na,Na,Na,Na,Na,,Na,Na,,,Na,,,,,,,Does not apply,Multicolor,,Not Compliant,,,,,,United States,,,,,,,,,,,,,,,,,,,,,,,,,,,,,,,,,,,,,,,,,,,,,,,,,,,,,,,,,,,,,,,,,,,,,,,,,,,,,,,,,,,,,,,,,,,,,,,,,,,,,,,,,,,,,,,,,,,,,,,,,,,,,,,,,,,,,,,,,,,,,,,,,,,,,,,,,,,,,,,,,,,,,,,,,,,,,,,
"Dimplex, Towel Warmer 200W Energy Efficient NEW !",69.99, , ,"New: A brand-new, unused, unopened, undamaged item in its original packaging (where packaging is applicable). Packaging should be the same as what is found in a retail store, unless the item is handmade or was packaged by the manufacturer in non-retail packaging, such as an unprinted box or plastic bag. See the seller's listing for full details. ",Dimplex,Electric,Towel Warmer,,,,,,,DCTW300,120 V,,,101-200 W,,,,,,,,,,,,,,,,,,,Does not apply,White,,,,,,,,,,,,,,,,,,,,,,,,,,,,,,,,,,,,,,,,,,,,,,,,,,,,,,,,,,,,,,,,,,,,,,,,,,,,,,,,,,,,,,,,,,,,,,,,,,,,,,,,,,,,,,,,,,,,,,,,,,,,,,,,,,,,,,,,,,,,,,,,,,,,,,,,,,,,,,,,,,,,,,,,,,,,,,,,,,,,,,,
Car Cooling Cup Heating 12v Heater Warmer Holder Fan Cooler Mug Defroster ,64.99,30-day returns, ,"New: A brand-new, unused, unopened, undamaged item in its original packaging (where packaging is applicable). Packaging should be the same as what is found in a retail store, unless the item is handmade or was packaged by the manufacturer in non-retail packaging, such as an unprinted box or plastic bag. See the seller's listing for full details. ",Unbranded,Fan,Portable Heater,Forced Air/Fan,Desk/Tabletop,,"Aluminum, Steel",1,Switch,,12 V,,,21-50 W,,,,32db,,,6.8cm,Does Not Apply,,,13.4cm,,,,,,,,,,,,,,,,,,,,,,,,,,,,,,,,,,,,,,,,,,,,,,,,,,,,,,,,,,,,,,,,,,,,,,,,,,,,,,,,,,,,,,,,,,,,,,,,,,,,,,,,,,,,,,,,,,,,,,,,,,,,,,,,,,,,,,,,,,,,,,,,,,,,,,,,,,,,,,,,,,,,,,,,,,,,,,,,,,,,,,,,,,,,,,,,
Winter Heater Household Heating Cool Dual Use 3-Speed Adjustment Touch Button,69.4,30-day returns, ,"New: A brand-new, unused, unopened, undamaged item in its original packaging (where packaging is applicable). Packaging should be the same as what is found in a retail store, unless the item is handmade or was packaged by the manufacturer in non-retail packaging, such as an unprinted box or plastic bag. See the seller's listing for full details. ",Unbranded,,,,,,,,,,,,,,,,,,,,,Does Not Apply,,,,,,,,,,,Does not apply,White,,,,,,,,,,,,,,,,,,,,,,,,,,,,,,,,,,,,,,,,,,,,,,,,,,,,,,,,,,,,,,,,,,,,,,,,,,,,,,,,,,,,,,,,,,120 cm,,,,,,,,,,,,ABS + PPS,AC220V / 50HZ,,,,,,,,,,,,,,,,,,,,,,,,,,,,,,,,,,,,,,,,,,,,,,,,,,,,,,,,,,,,,,,,,,,,,,,,,,,,,,,,
Air Choice OH907R Oil Filled Radiator Electric Heater Whole Room Black 1500W,70.0, , ,,Air Choice,"Electric, Oil",,,,,,,Digital,,,,,,,,,,,,,,,,,,,,,,,,Does not apply,,,,,,,,,,,,,,,,,,,,,,,,,,,,,,,,,,,,,,,,,,,,,,,,,,,,,,,,,,,,,,,,,,,,,,,,,,,,,,,,,,,,,,,,,,,,,,,,,,,,,,,,,,,,,,,,,,,,,,,,,,,,,,,,,,,,,,,,,,,,,,,,,,,,,,,,,,,,,,,,,,,,,,,,,,,,,,,,,,,,,,,,
110V-220V Heating pad Heater Mat Thermal Orange Controller Replacement,,30-day returns, ,"New: A brand-new, unused, unopened, undamaged item in its original packaging (where packaging is applicable). Packaging should be the same as what is found in a retail store, unless the item is handmade or was packaged by the manufacturer in non-retail packaging, such as an unprinted box or plastic bag. See the seller's listing for full details. ",unbranded,Electric,Silicone Heater Mat Pad,,,,Silicone,,,Heating Pad,110/220 V,,,1400W,,,,,,,,Does Not Apply,,,,,,,,,,,,As Pictures Show,,,,,,,,,,,,,,,,,400 * 400 * 1.5mm,,,,,,,,,,,,,,,,,,,,,Heating Pad,75.63 (Ω),,,,,,,,,,,,,,,,,,,,,,,,,,,,,,,,,,,,,,,,,,,,,,,,,,,,,,,,,,,,,,,,,,,,,,,,,,,,,,,,,,,,,,,,,,,,,,,,,,,,,,,,,,,,,,,,,,,,,,,,,,,,,,,,,,,,,,,,,,,,,,,,
MR. HEATER 13.42 In. Replacement Thermocouple F237349 Pack of 6,66.75,30-day returns,"['Factory replacement part, installed in minutes, its 17 degrees outside and Mr. Heater keeps me from freeing.', 'great replacement part that works well. Just follow the instructions and make sure  the tip touches the housing in order for it to absorb the heat and activate the gas valve.', 'This repair kit easily fixed my problem. My shop heater was getting hard to light now it lights up first time every time.', 'all local stores say no parts available so they can sell whole new burner but I got correct parts fast and great deal and quality ', 'It fit my heater (SRC15T Sunrite )but the safety tip-over wire was a little short.  Too relieve the strain on the wire I had too bend the connecting spade.', 'easy to replace , got my heater working again', 'Installed and heater works good.  Time will tell how long they last. ', 'Fixed my problem. My unit was not staying lit after release of the starter button.', 'It was shipped in good package where it could not be damaged and it exactly the part I needed', 'mr heater thermocouple. Looked great, exact match with my model, plugged in and heater worked, its a miracle. ']","New: A brand-new, unused, unopened, undamaged item in its original packaging (where packaging is applicable). Packaging should be the same as what is found in a retail store, unless the item is handmade or was packaged by the manufacturer in non-retail packaging, such as an unprinted box or plastic bag. See the seller's listing for full details. ",Mr. Heater,"Propane, Gas",Portable Heater,,,,Steel,2,Switch,,,,,,,,,None,,,,F237349,,11 in,,,,,,,,0089301373495,089301373495,Multicolor,,,,,,,,,,,,,Thread,2012,5.75,,,,,,,,,,,,,,,,,,,,,,,,,,,,,,,,,,,,,,,,,,,,,,,,,,,,,,,,,,,,,,,,,,,,,,,,,,,,,,,,,,,,,,,,,,,,,,,,,,,,,,,,,,,,,,,,,,,,,,,,,,,,,,,,,,,,,,,,,,,,,,,,,,,,,,,,,,,,,,,,,,,,,,,,
Handy Heater Heatwave Portable with Parabolic Space Heating Technology,68.87, , ,"Open box: An item in excellent, new condition with no wear. The item may be missing the original packaging or protective wrapping, or may be in the original packaging but not sealed. The item includes original accessories. The item may be a factory second. See the seller's listing for full details and description. ",Handy Heater,Electric,Portable Heater,"Radiant, Convection",Floor,,Ceramic,2,,HEATP-MC1,,Auto Shut-off,,350 W,,,,,,201-250 sq ft,,HEATP-MC1,,,,,,,,,,,0735541181207,Black,,,,,,,,,,,,,,,,,,,,,,,,,,,,,,,,,,,,,,,,,,,,,,,,,,,,,,,,,,,,,,,,,,,,,,,,,,,,,,,,,,,,,,,,,,,,,,,,,,,,,,,,,,,,,,,,,,,,,,,,,,,,,,,,,,,,,,,,,,,,,,,,,,,,,,,,,,,,,,,,,,,,,,,,,,,,,,,,,,,,,,,
Hongso Replacement Vent-Free Wall Heater Fan Vent Free Blower Accessory Kit f...,65.45,30-day returns, ,"New: A brand-new, unused, unopened, undamaged item in its original packaging (where packaging is applicable). Packaging should be the same as what is found in a retail store, unless the item is handmade or was packaged by the manufacturer in non-retail packaging, such as an unprinted box or plastic bag. See the seller's listing for full details. ",Hongso,,,,,,,,,Does not apply,,,,,,,,,,,,Does not apply,,,,,,,,,,Does not apply,Does not apply,black,,,,,,,,,,,,,,,,,,,,,,,,,,,,Free Shipping,,,,,,,,,,,,,,,,,,,,,,,,,,,,,,,,,,,,,,,,,,,,,,,,,,,,,,,,,,,,,,,,,,,,,,,,,,,,,,,,,,,,,,,,,,,,,,,,,,,,,,,,,,,,,,,,,,,,"Cute,Best,Funny,Girls,Kids,Boy,Girls",,,,,,,,,,,,,,,,,,,,,,,,,,,,,,,,,,,,,,,
Impress Dual Setting Fan Heater with Adjustable Thermostat,68.65,30-day returns, ,"New: A brand-new, unused, unopened, undamaged item in its original packaging (where packaging is applicable). Packaging should be the same as what is found in a retail store, unless the item is handmade or was packaged by the manufacturer in non-retail packaging, such as an unprinted box or plastic bag. See the seller's listing for full details. ",Impress!,Electric,Fan Heater,Forced Air/Fan,"Floor, Wall, Desk/Tabletop",,"Ceramic, Steel",2,"Dial, Switch",IM701,120 V,Thermostat,,1500W,Coil,Stainless Steel,80-85%,Standard,5000-5999 BTU,101-150 sq ft,5in.,IM701,3 or Less,,3in.,,,,,,,0636555997016,0636555997016,Gray,2-Way,,,,,,,,,,,15 Minutes,HomePlug,2019,,,,,,,,,,,,,,,,,,,,,,,,,,,,,,,,,,,,,,,,,,,,,,,,,,,,,,,,,,,,,,,,,,,,,,,,,,,,,,,,,,,,,,,,,,,,,,,,,,,,,,,,,,,,,,,,,,,,,,,,,,,,,,,,,,,,,,,,,,,,,,,,,,,,,,,,,,,,,,,,,,,,,,,,,
Nordic Hygge Värme Portable Heater with Hand Warmer,69.0, , ,"New: A brand-new, unused, unopened, undamaged item in its original packaging (where packaging is applicable). Packaging should be the same as what is found in a retail store, unless the item is handmade or was packaged by the manufacturer in non-retail packaging, such as an unprinted box or plastic bag. See the seller's listing for full details. ",Nordic Hygge Värme,Electric,Portable Heater,,"Floor, Desk/Tabletop",,,,,,,,,,,,,,,,,,,,,,,,,,,,,,,,,,,,,,,,,,,,,,,,,,,,,,,,,,,,,,,,,,,,,,,,,,,,,,,,,,,,,,,,,,,,,,,,,,,,,,,,,,,,,,,,,,,,,,,,,,,,,,,,,,,,,,,,,,,,,,,,,,,,,,,,,,,,,,,,,,,,,,,,,,,,,,,,,,,,,,,,,,,,,,,,,,,,,,,,,,,,,,,,,,,,
 , , , ,,,,,,,,,,,,,,,,,,,,,,,,,,,,,,,,,,,,,,,,,,,,,,,,,,,,,,,,,,,,,,,,,,,,,,,,,,,,,,,,,,,,,,,,,,,,,,,,,,,,,,,,,,,,,,,,,,,,,,,,,,,,,,,,,,,,,,,,,,,,,,,,,,,,,,,,,,,,,,,,,,,,,,,,,,,,,,,,,,,,,,,,,,,,,,,,,,,,,,,,,,,,,,,,,,,,,,,,,,
Protemp 5 kW Electric Fan Heater  PT-05-400-EU (NO PLUG),70.0,30-day returns, ,,Protemp,"Electric, Fan",,,,,,,,,,,,,,,,,,,,DOES NOT APPLY,,,,,,,,,,,Does not apply,,,,,,,,,,,,,,,,,,,,,,,,,,,,,,,,,,,,,,,,,,,,,,,,,,,,,,,,,,,,,,,,,,,,,,,,,,,,,,,,,,,,,,,,,,,,,,,,,,,,,,,,,,,,,,,,,,,,,,,,,,,,,,,,,,,,,,,,,,,,,,,,,,,,,,,,,,,,,,,,,,,,,,,,,,,,,,,,,,,,,,,,
"Optimus 18"" Oscillating Tower Heater with Thermostat",69.99, , ,,Optimus,Electric,Tower Heater,Internal heat limiting thermostat,Floor,,Plastic,2,,H-7234,120 V,Oscillation,,120 V,,,,,,,18 in,H-7234,,7.2,18.3,,,,,,,,630326172343,Black,,,,,,,,,No,,None,,,,,,,,,,,,,,,,,,,,,,,,,,,,,,,,,,,,,,,,,,,,,,,,,,,,,,,,,,,,,,,,,,,,,,,,,,,,,,,,,,,,,,,,,,,,,,,,,,,,,,,,,,,,,,,,,,,,,,,,,,,,,,,,,,,,,,,,,,,,,,,,,,,,,,,,,,,,,,,,,,,,,,,,,,,,
"Dreo 24"" Space Heater, 10ft/s Fast Quiet Heating Portable Electric Heater with R",70.0, , ,,Dreo,Electric,Portable Heater,,,,,,,DR-HSH001,,,,,,,,,,,,,,,,,,,,,,,na,Black,,,,,,,,,,,,,,,,,,,,,,,,,,,,,,,,,,,,,,,,,,,,,,,,,,,,,,,,,,,,,,,,,,,,,,,,,,,,,,,,,,,,,,,,,,,,,,,,,,,,,,,,,,,,,,,,,,,,,,,,,,,,,,,,,,,,,,,,,,,,,,,,,,,,,,,,,,,,,,,,,,,,,,,,,,,,,,,,,,,,,,,
"BASEBOARD HEATER 30""",65.62,30-day returns,"[""I was looking for a heater that would go well in our mud room. After looking through a bunch of baseboard heaters, i came across this one. It fits perfectly in the space we have and is very easy to install. It works best with the cadet thermostat which I'm waiting for. (I ordered from two separate sellers) The heater arrived early, and the stat should be here today, per the tracking orders. The stat connects right on the heater, so if you have already installed the 120v wire, you won't need to install low voltage wire to work the baseboard heater. "", ""Price is great, and installation was simple.. Purchased the separate, attached thermostat with OFF mode. Double pole thermostat - yes, works for 110V just fine.  Wiring instructions included with thermostat. Using it to heat a 10'x17' laundry room.  Works very well.  I'm also not one to have it heat to 80 degrees in the winter..  68 to 70 degrees is fine.  Temperatures go down to the upper 30s to 40s."", ""Great Heater's perfect for on demand heat where u have access to electricity. They give off a smell for the first use so I would recommend leaving a window open and let them run to vent off that first time use smell. "", 'Simple heat source made as well as is needed for most situations. Not over built, but safe and it works.', 'Was not damaged in shipment, exactly the correct product needed for the job, it has been installed and is working well.', 'Good product, easy to install ', 'This doesnt heat the room as expected. It barely heats at all . I will never buy this product again and to be honest I regret buying it.', 'This item is the heater only it does not come with a thermostat or anything!! ThT should be made clear. You have to buy additional things for it to work properly.', 'good service']","New: A brand-new, unused, unopened, undamaged item in its original packaging (where packaging is applicable). Packaging should be the same as what is found in a retail store, unless the item is handmade or was packaged by the manufacturer in non-retail packaging, such as an unprinted box or plastic bag. See the seller's listing for full details. ",Cadet,Electric,Baseboard Heater,,Wall,,Steel,1,Switch,,120 V,,,,,,,,,,30,"2F500-1W, 2F5001W",,,2.5,,,6.75,,,,0027418055309,27418055309,White,,,,,6.3,,,,,,,,,2018,,,"120 Volt, 500 Watt, White",,,,,,,,,,,,,,,,,,,,,,,,,,,,,,,,,,,,Modern/Contemporary,,,,,,,,,,,,,,,,,,,,,,,,,,,,,,,,,,,,,,,,,,,,,,,,,,,,,,,,,,,,,,,,,,,,,,,Space Heater,,,,,,,,,,,,,,,,,,,,,4253209,,,,,,,,,,,,,,,,,,,,,,,,,,,,,,,,,,,,,,
