 Lasko Ceramic Electric Tower Heater with Multi-function Remote Control Portable,44.98,30-day returns,"[""Background: We moved into a basement after our previous residence caught fire. The basement is unfinished with one bedroom and a half bath, while the remainder of this exceptionally large space remains concrete floors and walls. The main area where we watch TV and interact together is significantly cold, usually around the low to mid-60s. I cannot handle cold, so after reading some reviews, I grabbed this. Note that the basement we are now residing in has a temporary wall set up to cut off about 2/3 of the basement, and again, it's a relatively large basement. (You could roller skate a little bit in the area behind the temporary wall). ReviewPROGRAMMABLE HEATER? No, this is not programmable in the manner in which I understood, though it's obviously possible that I could have mis-read. That said, there is a remote that allows you to set up a TIMER for the heater to remain running. It is not one that you can literally schedule/program heating times. SAFETY: More often, portable heaters have safety shut-off devices that kick in if the heater has been knocked over or if it is picked up. This does not. I would not dare leave this running unattended, regardless of what you are thinking reading this review, we all tend to run out of the room for a minute or two. Regardless, lack of safety feature is definitely a disadvantage.WARMTH: By itself, this made somewhat of a difference, but ultimately, it still was not very effective. We bought a second stationary heater from Costco and, when ran simultaneously with this rotating heater, the basement gets mostly comfortable after a couple hours. If you have the heater near you, it's definitely warm, but it may not be effective for a space much larger than what we are sitting at now with the temporary wall. POWER BILL: After approximately 2 weeks, we could not take the cold anymore with just one heater running, so we did have to purchase a second that is a stable heater found at Costco (small black and gray box with vents). I had not seen the power bill prior to us moving in; however, my assumption is that the jump was significant as our roommate was beside himself when he saw the power bill. CONCLUSION: I would say if you cannot access stable oil heaters or are wary of them, this is a good option, especially if you are dealing with a normal sized bedroom or mid-sized living area. The power bill definitely goes up. As far as price goes, I found out later that I could have purchased this for about 2/3 the price elsewhere, so before you buy, check prices on different websites. "", 'It really warms the area and the remote is great, as is the oscillating feature...I have had a Lasko heater like this and was so happy to see one like it for sale. The ceramic shell allows the heater itself to stay cool.. Lightweight and easy to move!  Just love it!', ""This is a good tower heater. Simple user-friendly controls on the unit's top and on the remote. Don't use it in a small room 'cause it could be overkill. Get it and stay warm as it oscilates."", 'I have 3 of these heaters and they work great!  They are not digital, so the thermostat settings are in increments of 5. There is also a timer that can be set as well.  I use all of mine as supplemental heat to my propane   whole house heat.  This has kept our house cozy and the propane bill down.  It only raised our electric bill by about $20 a month.  We live in the midwest.', 'This heater is great! I was skeptical at first but felt more comfortable when I read some of the reviews. Well let me tell you, the reviews are spot on and this heater gets the job done. ', 'I was so happy to see these heaters !! Had one for ten years...works just as well as the day I bought it. Price is still low too.', ""I can't believe how quick I received my heater!! This is a great product. Heats a room quickly. Very happy!!"", ""This heater is great for heating up a one bedroom room in no time or just keeping it next to you to instantly warm you up ....This is a great heater during the winter time and also very quite. I don't get a burning smell either and i run it as high as it will go.."", 'Heater is working great. My concern is that the newness ceramic smell is not going away.  Its not very strong but am hoping that it dissipates.', 'for use only in a Small Space! does put out a lot of Air, not enough heat to go with the Air!I read the reviews before purchase, but I was disappointed with the heating Results, Great, fora Small Bathroom.']",,,,,,,,,,,,,,0046013775238,,,,0046013775238,,,,,,,,,,,,,,,,,,,,,,,,,,,,,,,,,,,,,,,,,,,,,,,,,,,,,,,,,,,,,,,,,,,,,,,,,,,,,,,,,,,,,,,,,,,,,,,,,,,,,,,,,,,,,,,,,,,,,,,,,,,,,,,,,,,,,,,,,,,,,,,,,,,,,,,,,,,,,,,,,,,,,,,,,,,,,,,,,,,,,,,,,,,,,,,,,,,,,,,,,,,,,,,,,,,,,,,,,,,
Vintage Pelonis/Del-Rain Corp Original Ceramic Space Heater Disc Furnace 1500 ,45.0, ,"['This heater is a little power house.  It\'s a 6"" cube that will heat up our 1964 Airstream Trailer (152 square feet).  It\'s well designed and well built.  It shuts off if tipped over.  It\'s all metal.  My only quibble is that it\'s a little loud (the fan), but that would not stop me from buying another.', 'Works great - small to medium room no problem. The older ones are better than new - too much plastic.', ""Best little heater you will ever buy. Don't let the size fool you. I use one of these in my 32ft travel trailer when it is cold rather than use my propane furnace and it keeps my whole trailer toasty. Between family we own a total of 4 of these. Would I buy again DEFINETELY!!!Beats the heck out of the crappy ones in the stores now!!"", 'This is my second one. The first one I bought it 30 years ago and still works wanders. Had to get another one', 'These vintage heaters work really well.. love it', 'Instant heat. Instant turn off if knocked over.  Compact.  Built when things were metal and built to last. ', 'That cliche of ‘they don’t make them like they use too~’ applies to this product.  Top quality through and through.', 'Works fine', 'These vintage Pelonis disc furnaces are the best!', 'All good.']","Used: An item that has been used previously. The item may have some signs of cosmetic wear, but is fully operational and functions as intended. This item may be a floor model or store return that has been used. See the seller’s listing for full details and description of any imperfections. ",Pelonis,Portable Heater,"Dial, Rotary Knob, Switch",Electric,Furnace,Brown,120 V,1500 IV,5 or More,Auto Shut-off,"Desk/Tabletop, Floor",1001-1500 W,,,Ceramic,N/A,,,N/A,,100 sq ft or Less,5000-5999 BTU,Copper,,N/A,,,Coil,,N/A,"72""",N/A,Standard,No,,,none,,,,,,,,,Unknown,,,,,,,,,,,,,HomePlug,,N/A,N/A,,,,,,,,,,,,,,,,,,,,,,,,,,,,,,,,,,,,,,,,,,,,,,,,,,,,,,,,,,,,,,,,,,,,,,,,,,,,,,,,,,,,,,,,,,,,,,,,,,,,,,,,,,,,,,,,,,,,,,,,,,,,,,,,,,,,,,,,,,,,,,,,,,,,,,,,,,,,,,,,,,,,,,,,,,,,,,
Mr. Heater F273737 2-Tank Hook Up Kit with Excess Flow Soft Nose P.O.L.,41.01,22 sold,"['Great product, as-described and new in the package.  Shipped very quickly, great eBayer.', 'I had three propane tanks to connect together, so bought two of these.  They worked great with no leaks.  Very satisfied customer.', 'Thank you for the gift, my family appreciate it.', 'it worked will, god the job done. ', 'exactly what I needed']","New: A brand-new, unused, unopened, undamaged item in its original packaging (where packaging is applicable). Packaging should be the same as what is found in a retail store, unless the item is handmade or was packaged by the manufacturer in non-retail packaging, such as an unprinted box or plastic bag. See the seller's listing for full details. ",Mr. Heater,Two Tank Hook Up Kit,,,,Black,,Mr. Heater,,,,,089301737372,,Brass and Plastic,,,,,6.25000,,,,,,,,,,,,2.80,,,,,,,,1.45000,,,,,,,,,F273737,,,,,,8.00,,,,,,,,,,,,MR. HEATER,,Y,California residents see Prop 65 WARNINGS: This pr,,,,,,,,,,,,,,,,,,,,,,,,,,,,,,,,,,,,,,,,,,,,,,,,,,,,,,,,,,,,,,,,,,,,,,,,,,,,,,,,,,,,,,,,,,New,,,,,,,,,,,,,,,,,,,,,,,,,,,,,,,,,,,,,,,,,,,,,,,,,,,,,,,,,,,,,,,,,,,,,,,,,,,,
Kismile Electric Portable Space Heater Ceramic for Office w/Adjustable Thermosta,26.95,30-day returns, ,"New: A brand-new, unused, unopened, undamaged item in its original packaging (where packaging is applicable). Packaging should be the same as what is found in a retail store, unless the item is handmade or was packaged by the manufacturer in non-retail packaging, such as an unprinted box or plastic bag. See the seller's listing for full details. ",Kismile,Does not apply,,Corded Electric,,,,,,,,,,,,,,,,,,,,,,,,,,,,,,,,,,,,,Convection,,,,,,,,,,,,,,,,,,,,,,,,,,,,,,,,,,,,,,,,,,,,,,,,,,,,,,,,,,,,,,,,,,,,,,,,,,,,,,,,,,,,,,,,,,,,,,,,,,,,,,,,,,,,,,,,,,,,,,,,,,,,,,,,,,,,,,,,,,,,,,,,,,,,,,,,,,,,,,,,,,,,,,,,,,,,,,,,,,,,,,,,,,,,,,,,,,,
"Mini Space Heater, 400W Low Wattage Personal Desk Heater with Tip Over",40.03,30-day returns, ,"New: A brand-new, unused, unopened, undamaged item in its original packaging (where packaging is applicable). Packaging should be the same as what is found in a retail store, unless the item is handmade or was packaged by the manufacturer in non-retail packaging, such as an unprinted box or plastic bag. See the seller's listing for full details. ",Does not apply,Does not apply,,Corded Electric,,Orange-400W,,,,,,,744759321886,,,,0744759321886,,,,,,,,,,,,,,,,,,,,,PTC-002,6.3 x 3.15 x 6.3 inches,1.48 pounds,Convection,6.3 x 3.15 x 6.3 inches,Does not apply,,,,,,,,,,,,,,,,,,,,,,,,,,,,,,,,,,,,,,,,,,,,,,,,,,,,,,,,,,,,,,,,,,,,,,,,,,,,,,,,,,,,,,,,,,,,,,,,,,,,,,,,,,,,,,,,,,,,,,,,,,,,,,,,,,,,,,,,,,,,,,,,,,,,,,,,,,,,,,,,,,,,,,,,,,,,,,,,,,,,,,,,,,,,,,,,,
Honeywell Heater Slim Compact Ceramic Design Oscilltes 2 Heat Settings HCE309B,40.0, ,"['I purchased this little heater for my son and his stray cat. The cat lives on his back porch in the cold, wintery upstate New York. My son leaves food and a shelter of coats and blankets for the cat, but all attempts to approach the cat have failed.The heater gives the cat some warmth on the frigid winter nights. ', 'Absolutely A Small But Mighty Heater! Puts out a lovely amount of heat; to be so small is an awesome plus! ', 'It is great it works perfect I love it ', 'Nice design with digital display button and it creates true\xa0air circulation very hot.', 'Good heater', 'Bought as a gift for a senior citizen', 'good ;keeps small /medium areas warm', 'Works well. Gets hot fast ', 'works great so far', 'This is a hater with lots of extras.']","New: A brand-new, unused, unopened, undamaged item in its original packaging (where packaging is applicable). Packaging should be the same as what is found in a retail store, unless the item is handmade or was packaged by the manufacturer in non-retail packaging, such as an unprinted box or plastic bag. See the seller's listing for full details. ",Honeywell,Compact,,,Forced Air/Fan,Black,110 V,HCE309B,2,"Automatic Shutoff, Cool-to-Touch, Thermostat, Tip-Over Safety Switch, Oscillation",Tabletop,,328785001815,,Ceramic,HCE309B,,,,,,,,,,,,,,,,,,,,,,,,,,,,,,,,,,,,,,,,,,,,,,,,,,,,,,,,,1500 Watts,,,,,,,,,,,,,,,,,,,,,,,,,,,,,,,,,,,,,,,,,,,,,,,,,,,,,,,,,,,,,,,,,,,,,,,,,,,,,,,,,,,,,,,,,,,,,,,,,,,,,,,,,,,,,,,,,,,,,,,,,,,,,,,,,,,,,,,,,,,,,,,,,,,,,,,,,,,,,,,,,,,
Mr. Heater F271149-144 12-Foot Hose Assembly with 3/8-Inch Female Flare,41.42,5 watchers, ,"New: A brand-new, unused, unopened, undamaged item in its original packaging (where packaging is applicable). Packaging should be the same as what is found in a retail store, unless the item is handmade or was packaged by the manufacturer in non-retail packaging, such as an unprinted box or plastic bag. See the seller's listing for full details. ",Mr. Heater,,,,,,,,,,,,089301491441,,,F271149-144,,,,,,,,,,,,,,,,,,,,,,,,,,,,,,,,,,,,,,,,,,,,,,,,,,,,,,,,,,,,,,,,,,,,,,,,,,,,,,,,,,,,,,,,,,,,,,,,,,,,,,,,,,,,,,,,,,,,,,,,,,,,,,,,,,,,,,,,,,,,,,,,,,,,,,,,,,,,,,,,,,,,,,,,,,,,,,,,,,,,,,,,,,,,,,,,,,,,,,,,,,,,,,,,,,,,,,,,,,,,
 , , , ,,,,,,,,,,,,,,,,,,,,,,,,,,,,,,,,,,,,,,,,,,,,,,,,,,,,,,,,,,,,,,,,,,,,,,,,,,,,,,,,,,,,,,,,,,,,,,,,,,,,,,,,,,,,,,,,,,,,,,,,,,,,,,,,,,,,,,,,,,,,,,,,,,,,,,,,,,,,,,,,,,,,,,,,,,,,,,,,,,,,,,,,,,,,,,,,,,,,,,,,,,,,,,,,,,,,,,,,,,,,,,,,,,,,,,,,,,,,,
"TEMPCO SHS80397 Strip Heater,9 In. L,Silicone Rubber",42.17, , ,"New: A brand-new, unused, unopened, undamaged item in its original packaging (where packaging is applicable). Packaging should be the same as what is found in a retail store, unless the item is handmade or was packaged by the manufacturer in non-retail packaging, such as an unprinted box or plastic bag. See the seller's listing for full details. ",TEMPCO,Flexible Strip Heaters,,,,,120,SHS80397,,,,,,,,SHS80397,,,,,,,,,,,,,,,,,,,,,,,,,,,,,,,,,,,,,,,,,,,,,,,,,,,,,,,,,,,,,,,,,,,,,,,,,,,,,,,,,,,,,,,,,,,,,,,,,,,,,,,,,,,,,,,,,,,,,,,,,,,,,,,,,,,,,,,,,,,,,,,,,,,,,,,,,,,,,,,,,,,,,,,,,,,,,,,,,,,,,,,,,,,,,,,,,,,,,,,,,,,,,,,,,,,,,,,,,,,,
"Mr. Heater, Propane Steak Saver Adapter, Female Throwaway Cylinder",, , ,"New: A brand-new, unused, unopened, undamaged item in its original packaging (where packaging is applicable). Packaging should be the same as what is found in a retail store, unless the item is handmade or was packaged by the manufacturer in non-retail packaging, such as an unprinted box or plastic bag. See the seller's listing for full details. ",Mr. Heater,Infrared,Analog/Mechanical,Propane,Convection,Multicolor,,F273071,4,,Wall,,0089301761711,,Brass,F276171,,,,,,,,,,,,,,,,14 in,,,,,,,,,,,,,,,,,,,,,,,,,,,Thread,,,,,,,,,,,,,,,,,,,,,,,,,,,,,,,,,,,,,,,,,,,,,,,,,,,,,,,,,,,,,,,,,,,,,,,,,,,,,,,,,,,,,,,,,,,,,,,,,,,,,,,,,,,,,,,,,,,,,,,,,,,,,,,,,,,,,,,,,,,,,,,,,,,,,,,,,,,,,,,,,,,,,,,,,,,,,,,,,
Westpointe 1500 Watt Compact Heater Fan WCH4051,, , ,"Used: An item that has been used previously. The item may have some signs of cosmetic wear, but is fully operational and functions as intended. This item may be a floor model or store return that has been used. See the seller’s listing for full details and description of any imperfections. ",Westpointe,Portable Heater,na,Fan,na,na,na,na,na,na,na,1001-1500 W,,,na,,,,na,na,100 sq ft or Less,na,na,A+++ - D,na,,na,na,,na,,na,na,,,,,,,,,,,,,,,,,,,,,,,,,3 Stars,,,,,,,,,,,,,,,,,,,,,,,,,,,,,,,,,,,,,,,,,,,,,,,,,,,,,,,,,,,,,,,,,,,,,,,,,,,,,,,,,,,,,,,,,,,,,,,,,,,,,,,,,,,,,,,,,,,,,,,,,,,,,,,,,,,,,,,,,,,,,,,,,,,,,,,,,,,,,,,,,,,,,,,,,,,,,,,,,,
2022 Portable Electric Air Heater Plug in Wall Heater Room Heating With Remote,38.0,30-day returns, ,"New: A brand-new, unused, unopened, undamaged item in its original packaging (where packaging is applicable). Packaging should be the same as what is found in a retail store, unless the item is handmade or was packaged by the manufacturer in non-retail packaging, such as an unprinted box or plastic bag. See the seller's listing for full details. ",yourhil,Portable Heater,"Remote Control, Switch",Electric,Heater air,,220V,Portable Heater Wall Plug-in Heater,3,,Wall,<800W,,,plastic,does not apply,,,,20cm,<20㎡,,,,,2022,,,,,,500g,,No,,3-Way,,,,,,,,,,China,,,,,,,,,,,,,,,,,,,,,,,,,,,,,,,,,,,,,,,,,,,,,,,,,,"RoHS, CE",,,,,,,,,,,,,,,,,PTC,,,,<20㎡,Wall Electric Heater,,,,,"BATHROOM, living room, garden, bed room etc",,,,,,,,,,,,,,,,,,,,,,,,,,,,,,,,,,,,,,<10㎡,"AC110-240V, 50Hz/60HZ","US ,eu,uk PLUG",Wall Heater,Mini Electric Heater Portable Room Warmer Heating,,,,,,,,,,,,,,,,,,,,,,,,,,,,,,,,,,,,,,,,,,,,,,,,,,,,,,,,,,,,,,,,,,,,,,,
"Wall Heater Blower Accessory Kit, Vent-Free, 20,000 to 30,000 BTU -F299201",40.07,30-day returns,"['I bought this with the false expectation that it would blow heat straight out. It does not blow it anywhere. called **.****** and they told me I am right, but it is supposed to keep the heat lower in the room. there is absolutely no difference. I also paid 30 some dollars for it on ****, when it is for sale everywhere else for $20 (Mr. heater brand).Shame on me! you can buy other heaters that blow heat straight out, I guess I just bought the name brand.', ""Keep expectations of a 3 to 4 inch plastic fan in check. And you will be happy with your purchase. Does not move much air. But the install was easy. And it's better than no fan. Install took 15 min. Remove metal plate on Mr.Heater install the fan. Attach thermostat wires inside unit. Screw in the 4 bolts that hold unit in place. Done. You got a fan in your Mr Heater Unit. I'm my opinion unit should be sold with fan installed. But they get an extra 30 bucks or so out of you by doing it this way. Overall I'm pleased though. The Heater works great along with Fan. I'd recommend it.  Heats the 800 square feet up quite well. Even on the lowest setting. No vent is nice. And no fumes. Clean burning. Excellent Very Happy. Thanks!"", ""Works very well on auto.  its not going to circulate the air in your garage, I have a small box fan 8ft above the heater blowing down across the garage for that.  I also shimmed my heater out 4in from the wall or the fan wouldn't be able to get air to blow any out.  It made a big difference"", 'It’s better than having the heater without the fan it does move some air but not a lot. The automatic function does not work on it with the heater for some reason, incompatibility or something? At full retail price it’s not a very good value. Don’t stand too close to the heater see photo.', 'Blower is a little loud but bearable but the biggest problem is this model will not work on auto feature in wall heaters made before 2015 so if you have an older stove the auto feature will not work because it does not have the thermostat built in the fan', 'Works as good as can be expected for its size. Helps distribute the heat but not with great force', 'Fan is quite and smooth but does not move much air.', 'The Mr. Heater is Great. I have it in a large room in my shed. It kicks on and off by thermostat.  The Fan is a wonderful Addition. Easy to Install,  and it also kicks on and off by thermostat.  Highly recommend it. ', ""It was an easy install but the switch has a position for auto and on and haven't got the auto mode working on it."", 'The fan is not very powerful I find a regular fan placed behind the unit blowing down just as effective but does take more space.']","New: A brand-new, unused, unopened, undamaged item in its original packaging (where packaging is applicable). Packaging should be the same as what is found in a retail store, unless the item is handmade or was packaged by the manufacturer in non-retail packaging, such as an unprinted box or plastic bag. See the seller's listing for full details. ",Mr. Heater,"Heater, Fan",Switch,"Electric, Propane",Convection,Beige,,F299201,1,,Portable,,0089301001183,,Steel,F299201,0089301001183,,,,,20k-30k,,,,2016,,,,,,15cm,,,,,,,,,,,,,,,,,,,,,,,,,,,,,24hr.,,,,,,,,,,,,,,,,,,,,,,,,,,,,,,,,,,,,,,,,,,,,,,,,,,,,,,,,,,,,,,,,,,,,,,,,,,,,,,,,,,,,,,,,,,,,,,,,,,,,,,,,,,,,,,,,,,,,,,,,,,,,,,,,,,,,,,,,,,,,,,,,,,,,,,,,,,,,,,,,,,,,,,,,,,,,,,,
Graphene Heating Hand Warmer Intelligent Constant Temperature Hand Heater New,41.32,60-day returns, ,"New: A brand-new, unused, unopened, undamaged item in its original packaging (where packaging is applicable). Packaging should be the same as what is found in a retail store, unless the item is handmade or was packaged by the manufacturer in non-retail packaging, such as an unprinted box or plastic bag. See the seller's listing for full details. ",Unbranded,,,,,,,,,,,,Does not apply,,,Does not apply,Does not apply,,,,,,,,,,,,,,,,,,,,,,,,,,,,,,,,,,,,,,,,,,,,,,,,,,,,,,,,,,,,,,,,,,,,,,,,,,,,,,,,,,,,,,,,,,,,,,,,,,,,,,,,,,,,,,,,,,,,,,,,,,,,,,,,,,,,,,,,,,,,,,,,,,,,,,,,,,,,,,,,,,,,,,,,,,,,,,,,,,,,,,,,,,,,,,,,,,,,,,,,,,,,,,,,,,,,,,,,,,,
Indus-Tool CL-150 Under Desk Space Heater 150 Watt,45.0, , ,"Used: An item that has been used previously. The item may have some signs of cosmetic wear, but is fully operational and functions as intended. This item may be a floor model or store return that has been used. See the seller’s listing for full details and description of any imperfections. ",INDUS-TOOL,,,,Radiant,,115 V,,,,,150w,Does not apply,,,,,,,,,,,,,,,,,,,,,,,,,,,,,,,,,,,,,,,,,,,,,,,,,,,,,,,,,,,,,,,,,,,,,,,,,,,,,,,,,,,,,,,,,,,,,,,,,,,,,,,,,,,,,,,,,,,,,,,,,,,,,,,,,,,,,,,,,,,,,,,,,,,,,,,,,,,,,,,,,,,,,,,,,,,,,,,,,,,,,,,,,,,,,,,,,,,,,,,,,,,,,,,,,,,,,,,,,,,,,,,
PTC Fan Heater Insulated Heating Constant Temperature AC110V‑230V 500W WPD,44.27,60-day returns, ,"New: A brand-new, unused, unopened, undamaged item in its original packaging (where packaging is applicable). Packaging should be the same as what is found in a retail store, unless the item is handmade or was packaged by the manufacturer in non-retail packaging, such as an unprinted box or plastic bag. See the seller's listing for full details. ",Unbranded,,,,,,,,,,,,Does not apply,,,Does not apply,Does not apply,,,,,,,,,,,,,,,,,,,,,,,,,,Does Not Apply,,,,,,,,,,,,,,,,,,,,,,,,,,,,,,,,,,,,,,,,,,,,,,,,,,,,,,,,,,,,,,,,,,,,,,,,,,,,,,,,,,,,,,,,,,,,,,,,,,,,,,,,,,,,,,,,,,,,,,,,,,,,,,,,,,,,,,,,,,,,,,,,,,,,,,,,,,,,,,,,,,,,,,,,,,,,,,,,,,,,,,,,,,,,,,,,,
King Electric K Series 4 White 240 Volt Electric Baseboard Heater ,44.99,60-day returns, ,"Open box: An item in excellent, new condition with no wear. The item may be missing the original packaging or protective wrapping, or may be in the original packaging but not sealed. The item includes original accessories. The item may be a factory second. See the seller's listing for full details and description. ",King Electric,Baseboard Heater,Analog/Mechanical,Electric,Radiant,White,240 V,3B2405,Variable,NA,"Baseboard, Wall",401-500 W,Does not apply,,"Aluminum, Steel",2B2405,,,NA,72 in,NA,NA,Stainless Steel,A+++ - D,NA,,3 in,Strip,,NA,,8 in,None,,,,,,,,,,,,,United States,,,,,,,,,,,,Compliant,,,,,,,,,,,,,,,,,,,,,,,,,,,,,,,,,,,,,,,,,,,,,,,,,,,,,,,,,,,,,,,,,,,,,,,,,,,,,,,,,,,,,,,,,,,,,,,,,,,,,,,,,,,,,,,,,,,,,,,,,,,,,,,,,,,,,,,,,,,,,,,,,,,,,,,,,,,,,,,,,,,,,,,,,,,,,,,,,,
1000W Portable Electric Simulation Stove Remote Control Wall-mounted Heater,43.98,30-day returns, ,"New: A brand-new, unused, unopened, undamaged item in its original packaging (where packaging is applicable). Packaging should be the same as what is found in a retail store, unless the item is handmade or was packaged by the manufacturer in non-retail packaging, such as an unprinted box or plastic bag. See the seller's listing for full details. ",Unbranded,Portable Heater,Push Button,Electric,Forced Air/Fan,,110-240 V,,,Auto Shut-Off,"Baseboard, Desk/Tabletop, Floor",901-1000 W,,,"ABS, Brass",Does Not Apply,,,,12cm,100 sq ft or Less,Less Than 2000 BTU,Brass,,95-100%,,18cm,Coil,,,1M,5cm,21-30 dB,No,,,,,,,,,,,,China,,,,,,,,,,,,Compliant,,,,,,,,,,,,,,,,,,,,,,,,,,,,,,,,,,,,,,,,,,,,,,,,,,,,,,,,,,,,,,,,,,,,,,,,,,,,,,,,,,,,,,,,,,,,,,,,,,,,,,,,,,,,,,,,,,,,,,,,,,,,,,,,,,,,,,,,,,,,,,,,,,,,,,,,,,,,,,,,,,,,,,,,,,,,,,,,,,
[EU PLUG] InnovaGoods Home Climate Mini Ceramic Plug Heater With Remote Control,44.95,30-day returns, ,"New: A brand-new, unused, unopened, undamaged item in its original packaging (where packaging is applicable). Packaging should be the same as what is found in a retail store, unless the item is handmade or was packaged by the manufacturer in non-retail packaging, such as an unprinted box or plastic bag. See the seller's listing for full details. ",InnovaGoods,,Remote Control,Battery,,,220-240 V,,2 levels of intensity,,Wall,600 W,8435527814045,,"ABS, PA and PBT",,,,,,,,,,,,,,,,,,,,,,,,,,,,,,,,,,,,,,,,,,,,,,,,,,,,,,,,,,,,,,,,,,,,,,,,,,,,,,,,,,,,,,,,,,,,,,,,,,,,,,,,,,,,,,,,,,,,,,,,,,,,,,,,,,,,,,,,,,,,,,,,,,,,,,,,,,,,,,,,,,,,,,,,,,,,,,,,,,,,,,,,,,,,,,,,,,,,,,,,,,,,,,,,,,,,,,,,,,,,,
BLAUX Heatcore Electric Portable Space Heater - 1200W for Home or Office Desk,44.95,30-day returns, ,"New: A brand-new, unused, unopened, undamaged item in its original packaging (where packaging is applicable). Packaging should be the same as what is found in a retail store, unless the item is handmade or was packaged by the manufacturer in non-retail packaging, such as an unprinted box or plastic bag. See the seller's listing for full details. ",BLAUX,Portable Heater,Touch,Electric,Radiant,White,110 V,B08LMZ8TSC,3,Auto Shut-off,Desk/Tabletop,1200w,Does not apply,,Ceramic,Does not apply,Does not apply,,,,,5000-5999 BTU,Ceramic,,,,,,,9.1-10,,,,,,,,,,,,,Does not apply,,,,,,,,,,,,,,,,,,,,,,,,,,,,,,,,,,,,,,,,,,,,,,,,,,,,,,,,,,,,,,,,,,,,,,,,,,,,,,,,,,,,,,,,,,,,,,,,,,,,,,,,,,,,,,,,,,,,,,,,,,,,,,,,,,,,,,,,,,,,,,,,,,,,,,,,,,,,,,,,,,,,,,,,,,,,,,,,,,,,,,,,,,,,,,,,,
Vornado VH202 Personal Space Heater Black With 2 Quiet Efficient Heat Settings,41.95,Last item available, ,"New: A brand-new, unused, unopened, undamaged item in its original packaging (where packaging is applicable). Packaging should be the same as what is found in a retail store, unless the item is handmade or was packaged by the manufacturer in non-retail packaging, such as an unprinted box or plastic bag. See the seller's listing for full details. ",Vornado,Personal Space Heater,,Corded Electric,,Black,,,,,,,744110503302,,,,0744110503302,,,,,,,,,,,,,,,,,,,,,,,,Forced Air,7.2 x 7.9 x 7.1 inches,Does not apply,,,,,,,,,,,,,,,,,,,,,,,,,,,,,,,,,,,,,,,,,,,,,,,,,,,,,,,,,,,,,,,,,,,,,,,,,,,,,,,,,,,,,,,,,,,,,,,,,,,,,,,,,,,,,,,,,,,,,,,,,,,,,,,,,,,,,,,,,,,,,,,,,,,,,,,,,,,,,,,,,,,,,,,,,,,,,,,,,,,,,,,,,,,,,,,,,
