Space Heaters 400 to 900W Portable Mini Heaters 24 sq yd 2 Heat Settings OM,44.15,30-day returns, ,"New: A brand-new, unused, unopened, undamaged item in its original packaging (where packaging is applicable). Packaging should be the same as what is found in a retail store, unless the item is handmade or was packaged by the manufacturer in non-retail packaging, such as an unprinted box or plastic bag. See the seller's listing for full details. ",Unbranded,See description,See description,See description,See description,,See description,See description,See description,See description,See description,See description,,,See description,Does Not Apply,,,See description,See description,See description,See description,See description,See description,,,See description,See description,,,,See description,See description,,,,,,,,,,,,,,,,,,,,,,,,,See description,,,,,,,,,,,,,,,,,,,,,,,,,,,,,,,,,,,,,,,,,,,,,,,,,,,,,,,,,,,,,,,,,,,,,,,,,,,,,,,,,,,,,,,,,,,,,,,,See description,See description,Sports & Outdoor,Office Indoor Use,Space Heaters 400 To,S Paceheater,,,,,,,,,,,,,,,,,,,,,,,,,,,,,,,,,,,,,,,,,,,,,,,,,,,,,,,,,,,,,,,,,,,,,,,,,,,,,
Lasko CT22445 Ceramic Tower Heater with Remote - Black, , ,"['I had gotten this one as a replacement for the same one I had that died and am so pleased it is just as great! It was hard finding this specific one, but luckily I found it for a good price on here. ', 'Just works great and I love it!', 'for a smaller Lasko it really heats up room in no time at all , love this model!', ""Haven't had a chance to use in really cold weather, but it warms our family room adequately without any noise."", 'It heats great and arrived on time', 'Nice product 👌', 'Works well and the price was right, I bought two.', 'Good product ']","New: A brand-new, unused, unopened, undamaged item in its original packaging (where packaging is applicable). Packaging should be the same as what is found in a retail store, unless the item is handmade or was packaged by the manufacturer in non-retail packaging, such as an unprinted box or plastic bag. See the seller's listing for full details. ",Lasko,Tower Heater,"Remote Control, Digital",Electric,Forced Air/Fan,Black,,Lasko CT22445,3,"Digital Display, Timer","Floor, Desk/Tabletop",1001-1500 W,0046013777775,,Ceramic,,,,,,,,Ceramic,,,,,,,,,,Standard,,,,,,,,,,,,,,,,,,,,,,,,,,,,8 hrs,,,,,,,,,,,,,,,,,,,,,,,,,,,,,,,,,,,,,,,,,,,,,,,,,,,,,,,,,,,,,,,,,,,,,,,,,,,,,,,,,,,,,,,,,,,,,,,,,,,,,,,,,,,,,,,,,,,,,,,,,,,,,,,,,,,,,,,,,,,,,,,,,,,,,,,,,,,,,,,,,,,,,,,,,,,,,,,
 Electric Heater Automatic Temperature Control Hot Warm Air Space Radiator for  ,40.99, , ,"New: A brand-new, unused, unopened, undamaged item in its original packaging (where packaging is applicable). Packaging should be the same as what is found in a retail store, unless the item is handmade or was packaged by the manufacturer in non-retail packaging, such as an unprinted box or plastic bag. See the seller's listing for full details. ",Unbranded,Portable Heater,"Analog/Mechanical, Push Button, Switch",Electric,Forced Air/Fan,White,120 V,,2,"Auto Shut-off, Oscillation, Timer","Floor, Wall",500W-800W,,,Ceramic,Does Not Apply,,,,245mm,,,Copper,,,2021,120 mm,Coil,,,,250mm,Low Noice,No,,,None,,,,,,,,,China,,,,,,,,,,,,,,,,,,,,,,,,,,,,,,,,,,,,,,,,,,,,,,,,,,,,,,,,,,,,,,,,,,,,,,,,,,,,,,,,,,,,,,,,,,,,,,,,,,,,,,,,,,,,,,,,,,,,,,,,,,,,,,,,,,,,,,,,,,,,,,,,,,,,,,,,,,,,,,,,,,,,,,,,,,,,,,,,,,,,,,,,,,,,,,
Pelonis Turbo Fan & Heater Heat + Cool Black PSF10M6ASB,41.66,30-day returns, ,"Used: An item that has been used previously. The item may have some signs of cosmetic wear, but is fully operational and functions as intended. This item may be a floor model or store return that has been used. See the seller’s listing for full details and description of any imperfections. ",Pelonis,,,Fan,,Black,,,,,,,750545105677,,,Does not apply,,,,,,,,,,,,,,,,,,,,,,,,,,,,,,,,,,,,,,,,,,,,,,,,,,,,,,,,,,,,,,,,,,,,,,,,,,,,,,,,,,,,,,,,,,,,,,,,,,,,,,,,,,,,,,,,,,,,,,,,,,,,,,,,,,,,,,,,,,,,,,,,,,,,,,,,,,,,,,,,,,,,,,,,,,,,,,,,,,,,,,,,,,,,,,,,,,,,,,,,,,,,,,,,,,,,,,,,,,,,
Ceramic Space Heater 750W 1500W Portable Electric Heater,40.99, , ,"New: A brand-new, unused, unopened, undamaged item in its original packaging (where packaging is applicable). Packaging should be the same as what is found in a retail store, unless the item is handmade or was packaged by the manufacturer in non-retail packaging, such as an unprinted box or plastic bag. See the seller's listing for full details. ",Does not apply,Does not apply,,Corded Electric,,Silver,,,,,,,7445033481465,,,,07445033481465,,,,,,,,,,,,,,,,,,,,,PTC-903,7.2 x 6.3 x 9.2 inches,2.95 pounds,"Forced Air, Convection",7.2 x 6.3 x 9.2 inches,Does not apply,,,,,,,,,,,,,,,,,,,,,,,,,,,,,,,,,,,,,,,,,,,,,,,,,,,,,,,,,,,,,,,,,,,,,,,,,,,,,,,,,,,,,,,,,,,,,,,,,,,,,,,,,,,,,,,,,,,,,,,,,,,,,,,,,,,,,,,,,,,,,,,,,,,,,,,,,,,,,,,,,,,,,,,,,,,,,,,,,,,,,,,,,,,,,,,,,
Honeywell 360 Degree Surround Heat BLACK Heater Electric 1500W Portable,, , ,"New: A brand-new, unused, unopened, undamaged item in its original packaging (where packaging is applicable). Packaging should be the same as what is found in a retail store, unless the item is handmade or was packaged by the manufacturer in non-retail packaging, such as an unprinted box or plastic bag. See the seller's listing for full details. ",Honeywell,Portable Heater,,Electric,,Black,,,,,,,092926493608,,,HHF360VWM,,,,,,,,,,,,,,,,,,,,,,,,,,,,,,,,,,,,,,,,,,,,,,,,,,,,,,,,,,,,,,,,,,,,,,,,,,,,,,,,,,,,,,,,,,,,,,,,,,,,,,,,,,,,,,,,,,,,,,,,,,,,,,,,,,,,,,,,,,,,,,,,,,,,,,,,,,,,,,,,,,,,,,,,,,,,,,,,,,,,,,,,,,,,,,,,,,,,,,,,,,,,,,,,,,,,,,,,,,,,
Pelonis 1500W Electric Infrared Quartz Heater - 3 Heat Settings -  NIB. White.,44.0, , ,"New: A brand-new, unused, unopened, undamaged item in its original packaging (where packaging is applicable). Packaging should be the same as what is found in a retail store, unless the item is handmade or was packaged by the manufacturer in non-retail packaging, such as an unprinted box or plastic bag. See the seller's listing for full details. ",Pelonis Technologies,Radiant Heater,,Electric,Radiant,White,120 V,,3,,Floor,1500W,750545106568,,,PSH20Q3AWW,Does not apply,,,"23.11""",,,,,None,,"8.58""",,,,,"12.99""",,,,,,,,,,,Does not apply,,,,,,,,,,,,,,,,,,,,,,,,,,,,,,,,,,,,,,,,,,,,,,,,,,,,,,,,,,,,,,,,,,,,,,,,,,,,,,,,,,,,,,,,,,,,,,,,,,,,,,,,,,,,,,,,,,,,,,,,,,,,,,,,,,,,,,,,,,,,,,,,,,,,,,,,,,,,,,,,,,,,,,,,,,,,,,,,,,,,,,,,,,,,,,,,,
"Portable Electric Space Heater for Office, 1500W Small Room Heaters for Indoor U",42.63,30-day returns, ,"New: A brand-new, unused, unopened, undamaged item in its original packaging (where packaging is applicable). Packaging should be the same as what is found in a retail store, unless the item is handmade or was packaged by the manufacturer in non-retail packaging, such as an unprinted box or plastic bag. See the seller's listing for full details. ",Does not apply,Does not apply,,Corded Electric,,Black,,,,,,,7445038629688,,,,07445038629688,,,,,,,,,,,,,,,,,,,,,,,,Convection,6 x 5 x 9.3 inches,Does not apply,,,,,,,,,,,,,,,,,,,,,,,,,,,,,,,,,,,,,,,,,,,,,,,,,,,,,,,,,,,,,,,,,,,,,,,,,,,,,,,,,,,,,,,,,,,,,,,,,,,,,,,,,,,,,,,,,,,,,,,,,,,,,,,,,,,,,,,,,,,,,,,,,,,,,,,,,,,,,,,,,,,,,,,,,,,,,,,,,,,,,,,,,,,,,,,,,
Mr. Heater Portable Buddy Carry Bag 9BX,41.6, ,"['Be aware that this bag is much wider than the heater that it is designed for!  You can put the heater in easily and still have about 5"" of room within the bag on the end.  This is not a problem but will allow the heater to move around within the bag and because the bag is floppy, it is not quite as nice looking as it would be if everything fit better.  You have room to put an extra couple of tanks in there, or a large thermos!I actually plan on using the extra space for an extra tank and a portable CO2 detector with lithium batteries for it.Other than that the bag is of good quality and has plenty of room to store tanks on the ends and a spot for a hose so that you can use larger propane tanks.', ""The only thing that I see is less that good is that the hook and loop closure comes apart and doesn't stay together. It really doesn't affect the performance until you pick the heater up by the handle and then the bag starts to slide off the heater. Work well while traveling in the tub."", ""This bag is made very durable! It's a must have to keep your buddy heater out of the weather. It will stay clean and last longer now that it's in a dry and safe place till ready to use. "", 'This well made and will organize your buddy heater with the option for extra tanks and hoses.  Quality is the very good and was bought at a fair price!', 'Great price, good quality, easy to use', 'Great for transport and storage. with two canister holders and a new one mounted, it gives you 3 canisters for an emergency. It also has a pouch for a hose and filter for hooking up to a large canister.', 'Great bag for the Buddy, with plenty of room for hoses, adapters, fuel filters, and small canisters. Well made.', 'The bag fits perfect for the Mr Buddy heater.  Plenty room for the heater, 2 1lb bottles and the extended hose.  Keeps everything in one place.', 'good price and works on my buddy l heater', 'Great hose for hook up to 5 gallon propane tank. Good quality and price. Fast shipment.']","New: A brand-new, unused, unopened, undamaged item in its original packaging (where packaging is applicable). Packaging should be the same as what is found in a retail store, unless the item is handmade or was packaged by the manufacturer in non-retail packaging, such as an unprinted box or plastic bag. See the seller's listing for full details. ",Mr. Heater,Portable Heater,,Gas,Radiant,Multicolor,,MH9BX,,Alarm,,,0089301320789,,Metal,F232078,0089301320789,,0.02 gal(0.45 L),,225 sq ft,9000 BTU,,,,2018,,,,,,,,,,,,,,,,,0089301320789,,,,,,,,,,,,,,,,,,,,,,,,,,,,,,,,,,,,,One Size,,,,,,,,,,,,,,,,,,,,,,,,,,,,,,,,,,,,,,,,,,,,,,,,,,,,,,,,,,,,,,,,,,,,,,,,,,,,,,,,,,,,,,,,,,,,,,,,,,,,,,,,,,,,,,,,,,,,,,,,,,,,,,,,,,,,,,,,,,,,,,,,,,,,,,,,,,,,
"Space Heater, 1500W Electric Heaters Indoor Portable with Thermostat , PTC Fast ",40.39,30-day returns, ,"New: A brand-new, unused, unopened, undamaged item in its original packaging (where packaging is applicable). Packaging should be the same as what is found in a retail store, unless the item is handmade or was packaged by the manufacturer in non-retail packaging, such as an unprinted box or plastic bag. See the seller's listing for full details. ",Does not apply,Does not apply,,Corded Electric,,Black,,,,,,,744110763485,,,,0744110763485,,,,,,,,,,,,,,,,,,,,,,,,"Forced Air, Convection",6.4 x 4.8 x 9.09 inches,Does not apply,,,,,,,,,,,,,,,,,,,,,,,,,,,,,,,,,,,,,,,,,,,,,,,,,,,,,,,,,,,,,,,,,,,,,,,,,,,,,,,,,,,,,,,,,,,,,,,,,,,,,,,,,,,,,,,,,,,,,,,,,,,,,,,,,,,,,,,,,,,,,,,,,,,,,,,,,,,,,,,,,,,,,,,,,,,,,,,,,,,,,,,,,,,,,,,,,
Toyuugo Black Ceramic Electric Heater Instant Heat FREE SHIPPING,42.88, , ,,Toyuugo,Portable Heater,Push Button,Electric,Forced Air/Fan,Black,120 V,,1,"Tip-Over Protection, Quiet, Auto Shut-off, Oscillation","Desk/Tabletop, Floor",501-600 W,,,Ceramic,,,,,,,,,,,,,,,,,,,,,,,,,,,,,,,,,,,,,,,,,,,,,,,,,,,,,,,,,,,,,,,,,,,,,,,,,,,,,,,,,,,,,,,,,,,,,,,,,,,,,,,,,,,,,,,,,,,,,,,,,,,,,,,,,,,,,,,,,,,,,,,,,,,,,,,,,,,,,,,,,,,,,,,,,,,,,,,,,,,,,,,,,,,,,,,,,,,,,,,,,,,,,,,,,,,,,,,,,,,,,
Mr. Heater F273711 Brass/Plastic Hose Assembly 1 Dia. in.x1 Dia. in.x12 L ft.,41.13,30-day returns, ,"New: A brand-new, unused, unopened, undamaged item in its original packaging (where packaging is applicable). Packaging should be the same as what is found in a retail store, unless the item is handmade or was packaged by the manufacturer in non-retail packaging, such as an unprinted box or plastic bag. See the seller's listing for full details. ",Mr. Heater,Hose Assembly,,,,Black,,Mr. Heater,,,,,089301737112,,Brass and Plastic,,,,,3.00000,,,,,,,,,,,,10.0,,,,,,,,0.70000,,,,,,,,,F273711,,,,,,10.7,,,,,,,,,,,,MR HEATER,,Y,California residents see Prop 65 WARNINGS: This pr,,,,,,,,,,,,,,,,,,,,,,,,,,,,,,,,,,,,,,,,,,,,,,,,,,,,,,,,,,,,,,,,,,,,,,,,,,,,,,,,,,,,,,,,,,,,,,,,,,,,,,,,,,,,,,,,,,,,,,,,,,,,,,,,,,,,,,,,,,,,,,,,,,,,,,,,,,,,,,,,,,,,,,
andily Space Heater Electric Heater for Home and Office Ceramic Small Heater ...,41.0,60-day returns, ,"New: A brand-new, unused, unopened, undamaged item in its original packaging (where packaging is applicable). Packaging should be the same as what is found in a retail store, unless the item is handmade or was packaged by the manufacturer in non-retail packaging, such as an unprinted box or plastic bag. See the seller's listing for full details. ",andily,,,,,,,Does not apply,,,,,0761895929165,,,,0761895929165,,,,,,,,,,,,,,,,,,,,,,,,,,0761895929165,,,,,,,,,,,,,,,,,,,,,,,,,,,,,,,,,,,,,6.2*4.74*8.3in,,,,,,,,,,,,,,,,,,,,,,,,,,,,,,,,,,,,,,,,,,,,,,,,,,,,,,,,,,,,,,,,,,,,,,,,,,,,,,,,,,,,,,,,,,,,,,,,,Up to 3 Business Days (Usually same day),U.S.A Free And Fast Shipping,100% Customer Satisfaction,"Professional Service, We Will Solve Any Problem",Shipped to select countries outside of USA,"USA 60 Day, International 30 Day Money-Back Guarentee",This product has a special price for a limited time,,,,,,,,,,,,,,,,,,,,,,,,,,,,,,,,,,,,,,,,,,,,,,,,,,,,,
"Honeywell UberHeater Ceramic Heater HCE200B, Black",44.95,30-day returns, ,"Open box: An item in excellent, new condition with no wear. The item may be missing the original packaging or protective wrapping, or may be in the original packaging but not sealed. The item includes original accessories. The item may be a factory second. See the seller's listing for full details and description. ",Honeywell,,"Rotary Knob, Switch, Touch",Electric,Forced Air/Fan,Black,,,2,,"Desk/Tabletop, Floor",1001-1500 W,092926200985,,Ceramic,HCE200B,0092926200985,,1 gal or Less (5 L),,100 sq ft or Less,5000-5999 BTU,,,Less Than 80%,2016,,Strip,,3 or Less,6 ft,,None,,,1-Way,,,,,,,,,,,,,,,,,,,,,,,,,,,,,,,,,,,,,,,,,,,,,,,,,,,,,,,,,,,,,,,,,,,,,,,,,,,,,,,,,,,,,,,,,,,,,,,,,,,,,,,,,,,,,,,,,,,,,,,,,,,,,,,,,,,,,,,,,,,,,,,,,,,,,,,,,,,,,,,,,,,,,,,,,,,,,,,,,,,,,,,,,,,,,,,,,,,,,,,,
MTM SPACE HEATER SPARK PLUG IGNIER 68-3036 - NEW,42.99,Last item available, ,,n/a,n/a,,,,,,n/a,,,,,n/a,,,n/a,,,,,,,,,,,,,,,,,,,,,,,,,,,,,,Unknown,,,,,,,,,,,,,,,,,,,,,,,,,,,,,,,,,,,,,,,,,,,,,,,,,,,,,,,,,,,,,,,,,,,,,,,,,,,,,,,,,,,,,,,,,,,,,,,,,,,,,,,,,,,,,,,,,,,,,,,,,,,,,,,,,,,,,,,,,,,,,,,,,,,,,,,,,,,,,,,,,,,,,,,,,,,,,,,,,,,,,,,,,,,,,,
Handy Heater Pure Warmth Portable Space Heater 1200W,40.0, , ,"New: A brand-new, unused, unopened, undamaged item in its original packaging (where packaging is applicable). Packaging should be the same as what is found in a retail store, unless the item is handmade or was packaged by the manufacturer in non-retail packaging, such as an unprinted box or plastic bag. See the seller's listing for full details. ",Handy Heater,Portable Heater,,Electric,,,1200w,pure warmth 1200w,3,,Desk/Tabletop,,735541199202,,,21008,,,,5.73,100-300 sq. ft,,Ceramic,,,,6.69,,,,,6.40,Standard,,,,,,,,,,,,,,,,,,,,,,,,,,,,,,,,,,,,,,,,,,,,,,,,,,,,,,,,,,,,,,,,,,,,,,,,,,,,,,,,,,,,,,,,,,,,,,,,,,,,,,,,,,,,,,,,,,,,,,,,,,,,,,,,,,,,,,,,,,,,,,,,,,,,,,,,,,,,,,,,,,,,,,,,,,,,,,,,,,,,,,,,,,,,,,,,,,,,,,,,,,,
Presto 1000 Watts Heat Dish Parabolic Electric Heater Model 0791708 Works Great,45.0, , ,"Used: An item that has been used previously. The item may have some signs of cosmetic wear, but is fully operational and functions as intended. This item may be a floor model or store return that has been used. See the seller’s listing for full details and description of any imperfections. ",Presto,Parabolic/Dish,"Dial, Switch",Electric,Radiant,Black,120 V,unmarked,3,3 Settings,"Desk/Tabletop, Floor",1000 Watts,Does not apply,,Aluminum,,,,n/a,N/A,100 sq ft or Less,2000-2999 BTU,Unknown,,Less Than 80%,,N/A,Coil,,3 or Less,N/A,N/A,None,No,,1-Way,None,,,,,,,,,China,,,,,,,,,,,,Compliant,N/A,,N/A,N/A,,N/A,,,,,,,,,,,,,,,N/A,,,,,,,,,,,,,,,,,,,,,,,,,,,,,,,,,,,,,,,,,,,,,,,,,,,,,,,,,,,,,,,,,,,,,,,,,,,,,,,,,,,,,,,,,,,,,,,,,,,,,,,,,,,,,,,,,,,,,,,,,,,,,,,,,,,,,,,,,,,,,,,,,,,,,,,,,,,,,
Black & Decker Convection Heater Model BDCV200 Control Thermostat 2 Heat Setting,40.0, , ,"Used: An item that has been used previously. The item may have some signs of cosmetic wear, but is fully operational and functions as intended. This item may be a floor model or store return that has been used. See the seller’s listing for full details and description of any imperfections. ",BLACK+DECKER,convection,"Push Button, Rotary Knob",Electric,Convection,white,120,BDCV200,2,,Floor,1001-1500 W,,,,,,,,,,,,,,,,,,,,"25""",,,,,,,,,,,,,,,,,,,,,,,,,,,,,,,,,,,,,,,,,,,,,,,,,,,,,,,,,,,,,,,,,,,,,,,,,,,,,,,,,,,,,,,,,,,,,,,,,,,,,,,,,,,,,,,,,,,,,,,,,,,,,,,,,,,,,,,,,,,,,,,,,,,,,,,,,,,,,,,,,,,,,,,,,,,,,,,,,,,,,,,,,,,,,,,,,,,,,,,,,,,,
Cyclone Booster Fan Plus With Built In Thermostat In White For All Seasons NEW,45.0,30-day returns,"['Bought this booster fan to direct warm air into a utility room that has no heat.  I ran a short duct from my den, through a closet, and into the utility room.  I installed the booster in the duct opening in the utility room and it works like a charm.  It took a little bit to get it adjusted, but now whenever the heat is on in the den the fan comes on and draws it into the utility room, making a big difference in temperature.  A few minutes after the heat in the den shuts off, the booster fan shuts off.Overall a nice booster fan that runs quiet, efficiently, and gets the job done.', 'Bought for a room farthest from my furnace. Before the room had very little air flow so was cold in the winter. This makes a big difference. Works very well. That room is now about the same tempreture as the rest of the house.', ""Second time we've bought this product.  It works like a charm."", ""Just doesn't put out the airflow that I anticipated but still a good product"", 'Would like a little more air flow. But it is very quite.']","Open box: An item in excellent, new condition with no wear. The item may be missing the original packaging or protective wrapping, or may be in the original packaging but not sealed. The item includes original accessories. The item may be a factory second. See the seller's listing for full details and description. ",Cyclone,Baseboard Heater,"Switch, Analog/Mechanical, Rotary Knob","Fan, Electric",Forced Air/Fan,White,120 V,,1,,"Baseboard, Floor",101-200 W,0671519300822,,Steel,CM300W,0671519300822,,,,,,Steel,,,2016,6 in,,,,"12.1""",,,,,1-Way,One Year Protection From Manufacturing Defect,,,,,,,,,,,,,,,,,,,,,,X10,,,,,,,,,,,,,,,,,,,,,,,,,,,,,,,,,,,,,,,,,,,,,,,,,,,,,,,,,,,,,,,,,,,,,,,,,,,,,,,,,,,,,,,,,,,,,,,,,,,,,,,,,,,,,,,,,,,,,,,,,,,,,,,,,,,,,,,,,,,,,,,,,,,,,,,,,,,,,,,,,,,,,,,,,,,,,,,,,
Indus-Tool Model CL Under Desk Foot Warmer Tested BS3,,30-day returns,"[""In a Northern state, I've got an expensive office and the brilliant engineers designed a heating system with freezing cold floors. Not only that, constantly getting in and out of the car means inevitable snow on one's shoes in bad weather. This is a prescription for cold feet.This product is ideal for the job. Made of rubber so it's impervious to water or stains, cranks out the heat on high and trolls along beautiful on low. Plus, it's good size, bigger than the cheapie models so you don't have to think about where your feet are placed. Great value and highly recommended."", ""This rubber mat is excellent. I use it under my desk to keep my feet warm. It gets very hot. I believe around 135 degrees is what the mat heats up to. So this isn't some cheap mat that kinda gets warm.You can use it to warm your boots up also. The mat is injection molded one piece so it is water proof also. Would probably work great at the front door to melt snow or ice also."", ""Bought because our 70 yr. old house hardwood floors aren't insulated. This product is durable heats evenly perfect on cold nights to keep my feet warm in front of the tv. Did put down a piece of cardboard beneath the mat and floor as suggested by a previous purchaser's comment do not know if necessary. Have been using for weeks works great waterproof is a bonus, easy to keep clean.      arkansas"", 'The foot warmer arrived in a large, flat cardboard carton. Its switch (from high to low wattage and off) works well. This is the second one I have bought, both not for my feet but for my outdoor dogs/cats. Though it was not guaranteed for pets it works well in dog houses when the temperature is at 10 degrees F. Since it is sturdy for standing on with work shoes it also is tough enough for cats and dogs to sleep on. I put a special wrap on the AC wire to it to prevent animals from damaging the cord and usually use it at the low wattage setting. It is much more sturdy than the electric pet pads that are being sold.', 'My significant other has an office area just outside of our main house, the floor is cold and so were her feet until we put one of these mats under her desk and another by her photo tent.  Now her feet are warm and she is happy, so am I.  The wide range of heat settings and heavy construction make this a good purchase.', ""It's perfect!!!We live in Wisconsin with cold winter day's and night's. Hot water heat in our home so under the table gets real chilly because of having tile flooring.This unit is great because its warm enough to feel, yet not so warm you need to keep turning it on and off.I was also happy to see it had a lighted on/off switch about in the middle of the cord.If your legs ever get cool or cold under a desk or table, buy this unit!!!I wish I had it years ago and saved on the electric bill for the small heater I was using."", 'I repair watches my semi finished basement and I  have struggled trying to keep my feet and legs warm as my bench is against an outside wall. Have had an unheated rubber pad on the floor and it helped somewhat but this electric pad is great, l can actually sit in comfort even without shoes or extra pairs of socks.  Actually warms the air space for my legs too! Only used it for a few weeks but I am very impressed. Hope it lasts a long time.', ""It's a little hot for my feet in socks so I just folded up a bath floor towel into 1/4's and it's perfect in my basement office during the winter. I also use it with a Woods 50030 Indoor Countdown Timer so I never have to worry about leaving it on. Great product."", 'Take your shoes off and enjoy this foot pad on the coldest of days!!! Nice! And it has a handy on/off switch half way up the cord!!', ""I bought two of these foot warmers. One in March and one in May 2021.March purchased died in aprx September.May purchased survived till March 2022.Both were once placed under the table and never moved, so it's not a miss-use or broken cable. We always switched them off after several hours of use.Make your own judgment if it's acceptable. I don't think so.On the bright side - when it works it, well, works, keeping your feet warm.""]","Used: An item that has been used previously. The item may have some signs of cosmetic wear, but is fully operational and functions as intended. This item may be a floor model or store return that has been used. See the seller’s listing for full details and description of any imperfections. ",Indus-Tool,,Switch,Electric,,White,115 V,,1,Timer,Floor,,,,,FW,,,,,,,,,,,,,,,,,,,,,,,,,,,,,,,,,,,,,,,,,,,,,,,,,,,,,,,,,,,,,,,,,,,,,,,,,,,,,,,,,,,,,,,,,,,,,,,,,,,,,,,,,,,,,,,,,,,,,,,,,,,,,,,,,,,,,,,,,,,,,,,,,,,,,,,,,,,,,,,,,,,,,,,,,,,,,,,,,,,,,,,,,,,,,,,,,,,,,,,,,,,,,,,,,,,,,,,,,,,,
 , , , ,,,,,,,,,,,,,,,,,,,,,,,,,,,,,,,,,,,,,,,,,,,,,,,,,,,,,,,,,,,,,,,,,,,,,,,,,,,,,,,,,,,,,,,,,,,,,,,,,,,,,,,,,,,,,,,,,,,,,,,,,,,,,,,,,,,,,,,,,,,,,,,,,,,,,,,,,,,,,,,,,,,,,,,,,,,,,,,,,,,,,,,,,,,,,,,,,,,,,,,,,,,,,,,,,,,,,,,,,,,,,,,,,,,,,,,,,,,,,
220V 500W Electric Heater Fan Warmer Air Heater Winter Home Room Office 2 Gears,42.08,30-day returns, ,"New: A brand-new, unused, unopened, undamaged item in its original packaging (where packaging is applicable). Packaging should be the same as what is found in a retail store, unless the item is handmade or was packaged by the manufacturer in non-retail packaging, such as an unprinted box or plastic bag. See the seller's listing for full details. ",Unbranded,,,,,,220 V,,,,,,Does not apply,,,Does not apply,,,,,,,,,,,,,,,,,,,,,,,,,,,,,,,,,,,,,,,,,,,,,,,,,,,,,,,2 gears,quartz tube heating,500W,500W,220V,,,,,,,,,,,,,,,,,,,,,,,,,,,,,,,,,,,,,,,,,,,,,,,,,,,,,,,,,,,,,,,,,,,,,,,,,,,,,,,,,,,,,,,,,,,,,,,,,,,,,,,,,,,,,,,,,,,,,,,,,,,,,,,,,,,,,,,,,,,,,,,,,,,,,,,,,,,,,,,,,
